"Price","Bed","Bath","Area","HouseURL","Description","Type","Built","Lot"
"$6,950,000","6 bds","8 ba","12,455 sqft","https://www.zillow.com/homedetails/581-Sasco-Hill-Rd-Fairfield-CT-06824/57301937_zpid/","Spectacular Sasco Hill. Custom built in 2010, this Mark Finlay designed home offers a Classic Connecticut facade outside and a modern, open floor plan inside. Perfect for todays lifestyle with both public and private spaces cleverly and expertly built and arranged. High ceilings and abundant windows flood the house with natural light. The deep property offers extensive outdoor space in the backyard with covered porches, balconies, salt water pool/hot tub, outdoor fireplace and amazing post and beam party barn with its own kitchen, full bath and sleeping loft. Geothermal Heating and Cooling system. Wonderful finished lower level with home theater, wine cellar, gym and lots of storage. Finished third floor as well offers en suite guest bedroom and playroom currently fitted with bunk beds. Stairs take you to the widow's walk where you can take in stunning views of Southport Harbor, Long Island Sound and the Manhattan skyline. Prepare to make no compromises to live on Fairfield's premier street. Sasco Hill at it's very best!","Single Family Residence","2010","71,874 sqft"
"$525,000","3 bds","3 ba","2,396 sqft","https://www.zillow.com/homedetails/120-Crane-St-Fairfield-CT-06825/57291380_zpid/","The best home to dream about is one that offers everything you've been hoping for. Looking for a bright, updated colonial located in a quiet neighborhood just minutes to schools, shops and train? Relax with friends and family in the living room equipped with a wood-burning fireplace before sitting down for a nice dinner in the large dining room. The eat-in kitchen with stainless steel appliances and plenty of counter space makes day to day meal preparation a breeze. The family room completes this level and makes for the perfect at-home office or playroom. Retreat up to the spacious master suite with a large walk-in-closet and updated full bath. Two additional spacious bedrooms & another updated full bathroom complete this level. The lower level is finished, heated and adds living space - perfect for an in-law setup or entertainment room. The beautifully landscaped property creates the ideal outdoor retreat for the warmer days to come and the 1 car garage provides additional storage space, if needed. Don't miss this one!","Single Family Residence","1988","No Data"
"$699,000","3 bds","3 ba","3,439 sqft","https://www.zillow.com/homedetails/175-Godfrey-Rd-Fairfield-CT-06825/177294816_zpid/","Sprawling Ranch, larger than it looks, on almost 1/2 acre with pool in convenient Fairfield Woods location!  This 3 Bedroom/3 Full Bath home offers incredible space and an open floor plan.  Kitchen opens to the Dining Room as well as the Living Room with fireplace.  A spacious Family Room with additional fireplace and vaulted ceilings with sliding doors to the back deck.  3 Bedrooms including a Master Bedroom suite with full bath plus 2 additional baths.  Lower Level is a wonderful bonus including Recreation Room, Office plus additional guest area/workout room.  Large deck spans the back of the home and leads to a flat, fenced in backyard with in-ground pool.  Hardwood floors, attached garage and mudroom complete this package.  Opportunity knocks - move in for the summer!","Single Family Residence","1953","18,295 sqft"
"$725,000","4 bds","3 ba","2,260 sqft","https://www.zillow.com/homedetails/138-Woodridge-Ave-Fairfield-CT-06825/57293366_zpid/","Rediscover the joys of walkable, quiet living in the heart of Fairfield. Walk to bustling commerce, the library, the park, and if to your liking, grades K-8. Located on a flat, private quarter acre equidistant from both the Turnpike and the Parkway, you have all the access with none of the noise. This colonial balances charming details and modern amenities across three floors. Original elements of the 1940s accent 2,260 sq. ft. of sun-filled living space. The formal living room centers on a marble-surround fireplace and built-ins, boasting three arched doorways. The kitchen features granite counters and allows a view of both the breakfast and family rooms, which are bathed in sunlight by walls paneled with windows and French doors that open to the rear deck. A powder room and mudroom complete the first floor. Four upstairs bedrooms are anchored by a master suite featuring a tray ceiling, a generous walk-in closet and en suite with a double-vanity, soaking tub and glass stall shower. The finished lower level is ready for an office, playroom or den, while a walk-up attic allows easy access to your keepsakes. The oversized garage accommodates your vehicle as well as outdoor equipment, exercise machines or a work bench and gardening table. A wrap-around stone wall and privacy fence allow for quiet time on the spacious deck and stone patio. The yard is ideal for gardening, practicing sports or a swingset with a layout perfect for parties both large and small.","Single Family Residence","1947","10,454 sqft"
"$2,799,000","5 bds","6 ba","6,308 sqft","https://www.zillow.com/homedetails/1133-Cedar-Rd-Southport-CT-06890/57303433_zpid/","Turn-Key year round home or summer getaway with beautifully crafted & very recent updates blend seamlessly to create the entire quintessential Connecticut Colonial package. Live, work & play from the comforts of a superbly designed custom five bedroom, five full bath home including new wood shingle roof,  sited perfectly in a wonderful Southport location. Architecturally inviting home w/expansive lawn, stone patios & large heated, 20 x 40 salt-water pool on 1.2 acres conveniently located to the town's many amenities. Magnificent heart of the home chef's kitchen w/ butler's pantry, custom cabinetry, striking polished Calacatta marble island, granite countertops & selected high-end Sub-Zero, Wolf & Miele appliances opens to generously sized dining room & family room w/ stone fireplace & lovely shiplap accented walls.Outdoor areas accessed from multiple sets of divided light doors that capture sunlight.Relax in your own luxurious primary suite enveloped w/great light, shiplap & tray ceiling.  Five-piece marble bathroom & Juliette balcony overlooking the sparkling pool & grassy surround await. Two large walk-in custom closets, stone fireplace & deck access round out this haven of a space.Additional gathering spaces w/ beautiful mahogany library, beautiful living room w/ fireplace, secondary office, large media room, gym, vaulted recreation room & 3rd floor bonus room. Crestron system & alarm.Welcoming & practical mudroom w/dual entry points w/full bath, ample storage & built-ins.","Single Family Residence","1947","52,707 sqft"
"$1,389,000","5 bds","7 ba","5,436 sqft","https://www.zillow.com/homedetails/307-Barberry-Rd-Southport-CT-06890/57301581_zpid/","Imagine life in a five bedroom colonial, at the end of a cul-de-sac in Southport, CT where you will be welcomed into the neighborhood. There are many reasons to admire this home with incredible living space.   The grand entry opens to an elegant dining room, a stunning reading room and a fabulous kitchen which is the center for entertaining. The kitchen is designed for a chef with plenty of room and space to prep and cook with a great oversized center island.  The kitchen is situated next to the family room for relaxing and entertaining friends.  There is also a private home office on the main floor. Over the garage is the perfect setup for private and separate in-law or au-pair quarters.  French doors from the kitchen lead to a lovely designed private space to lounge and retreat on the sun-bleached decking with living and dining areas.  The deck with globe bistro strung lights create a  fun ambience for entertaining.  For car enthusiasts, this home offers a 4 car tandem attached garage which can easily be used as a fun rec/playroom as well.  If 5,436 square feet isn't enough, there is an unfinished walk up attic with skylights and lower level with full windows and exterior access.   This home is conveniently located within minutes to the heart of Southport Village, Southport beaches and the Fairfield or Southport train station.  With so much space, think of the endless possibilities to make this home suit your needs.  Turn your dreams into a reality...","Single Family Residence","2004","43,560 sqft"
"$1,184,000","4 bds","4 ba","2,832 sqft","https://www.zillow.com/homedetails/16-Osborne-Ln-Southport-CT-06890/57303250_zpid/","Storybook charm! This Southport Colonial/Cape welcomes you w/open arms the minute you enter. Custom built for original/previous owner. Since then numerous improvements have been made by current owners: CAC '19; remodeled kitchen w/marble countertops, center island, white cabinetry, SS appliances, dining area; bluestone patio w/ stone walls; FR custom built-ins, finished Lower Level; interior/ exterior painting. A unique 1st flr MBR & MBA has an adjacent room that is currently being used as a Home Office. This office has a separate side entrance, which can easily accommodate a small business where principal meets w/ clients. OR this can be an IN-LAW arrangement. Completing the 1st flr is a warm, inviting FR w/FP & custom built-ins, a FDR & fabulous screened in porch that connects w/ kitchen & backyard patio. Second floor features 3 BRs & 2 full baths. There is an incredible amount of storage space on 2nd floor, w/ tremendous expansion potential. Shed dormer the back of this home & increase your BR space! Another MBR/MBA can easily be obtained & expansion/addition of existing BRs. A finished Lower Level adds nearly 1000 sf of comfortable living space. Light, bright & gorgeous! Plenty of room for sectional, tv, game table area. Ping Pong & Pool Table are included in this sale. Located on one of Southport's most desirable streets, this is a place where children can easily ride their bikes, parents stroll their babies & walkers walk! Easy walk to Spt train, Spt Village & beaches.","Single Family Residence","1994","20,037 sqft"
"$999,000","4 bds","3 ba","2,636 sqft","https://www.zillow.com/homedetails/39-Michaela-Cir-Fairfield-CT-06824/57304002_zpid/","Beach area beauty located on a quiet, private cul-de-sac, provides perfect open floor plan living space.  This stylish 4BR Colonial home offers spacious living with proximity to beach and town.   Tons of curb appeal, and gracious front steps lead into this home with an abundance of natural light, 9 ft ceilings, hardwood floors, and generously sized rooms.  Sunny entryway leads to large living room and dining room.  Bright and spacious eat-in-kitchen with white cabinets, granite counters, stainless appliances and access to the freshly stained, private deck overlooking the level yard and wooded open space with walking trail.  Large family room with gas fireplace.  Upstairs is an oversized Master BR w/ lovely bath and huge walk-in closet, as well as 3 other large bedrooms, a laundry room, and full bath.  Full attic for storage, as well as a crawl space that runs the length of the house, 2 car garage.  Walk to town, train and park.  Minutes to beaches, golf, tennis, marina and harbor. Showings begin Saturday 5/1.","Single Family Residence","2001","6,534 sqft"
"$1,450,000","5 bds","4 ba","3,072 sqft","https://www.zillow.com/homedetails/56-Osborne-Pl-Southport-CT-06890/177298300_zpid/","Exquisite Detailing in this gorgeous 5 Bedroom, 4 Full Bath Home Includes  9' Ceilings, Rich Crown Molding, Shiplap Walls, Thermador Appliances and Honed Marble Counters in the Stunning Gourmet Kitchen with its Breakfast Bar & Shaker Style Cabinetry. The Great Room Features a Natural Gas Fireplace and a Wall of Windows with Views of the fenced in Private Yard and Brussels Pavers Patio. Ground Floor Bedroom with Full Bath Currently used as a Home Office. Mudroom with Custom Built-Ins is directly off the Climate Controlled 2 Car Garage. (Storage Units are Included!)  The Master Suite features a high end custom Walk-in Closet. The Spa Like Full Bath features an elegant Kohler tub with Kohler Hardware, Emtek pulls and knobs on cabinets. Upstairs Laundry with Washer and Dryer Included!  Wonderful Southport Neighborhood, Walk to Train - Mill Hill Elementary School. • 2 Car Climate Controlled Garage  • 9 Foot Ceilings  • Emtek Hardware  • Kohler Fixtures  • Tankless On Demand Hot Water  • #1 Select Oak Flooring with Jacobean Stain  • Nest Thermostats and Smoke CO Detectors  • Home Security System  • GAF Architectural 40 Year Rated Roof  • Frameless Glass Shower Enclosures  • Full Basement with 8' Ceilings  • Short Walk to Train and Southport Village  • Upstairs Laundry with Washer & Dryer","Single Family Residence","2016","7,405 sqft"
"$799,000","4 bds","3 ba","2,395 sqft","https://www.zillow.com/homedetails/56-Shoreham-Ter-Fairfield-CT-06824/58783454_zpid/","WELCOME TO 56 SHOREHAM TERRACE! OPPORTUNITY AWAITS FOR YOUR TO MAKE THIS BRAND NEW HOME YOUR OWN!  THIS UNIQUE FAIRFIELD OASIS WITH WATER VIEWS IS JUST A SHORT WALK OR BIKE RIDE TO JENNINGS BEACH, LOCAL RESTAURANTS, SHOPPING AND FAIRFIELD METRO TRAIN STATION.  SET ON A QUIET SIDE STREET CLOSE TO ALL THE DOWNTOWN FAIRFIELD HAS TO OFFER, WITHOUT FLOOD INSURANCE.  THE NEWLY REDESIGNED OPEN CONCEPT FIRST FLOOR WELCOMES YOU WITH TONS OF NATURAL SUNLIGHT, HIGH CEILINGS AND HARDWOOD FLOORING INTO YOUR LIVING AND DINING ROOM.  THE BRAND NEW CUSTOM KITCHEN IS DESIGNED WITH YOU IN MIND - HIGH END GE APPLIANCES, TONS OF STORAGE SPACE AND A BREAKFAST BAR.  THE KITCHEN LEADS YOU OUT TO THE OVERSIZED DECK PERFECT FOR ENTERTAINING INDOORS AND OUTDOORS.  THE FIRST FLOOR IS ALSO OUTFITTED WITH A HALF BATH AND OFFICE/BEDROOM.  UPSTAIRS YOU WILL HAVE TWO LARGE BEDROOMS AND MASTER SUITE BOTH WITH VAULTED CEILINGS THT ALLOW A CONSTANT FLOW OF NATURAL LIGHT AND THAT PRICELESS OPEN AND AIRY FEELING ALONG WITH HARDWOOD FLOORS.  YOUR MASTER SUITE IS COMPLETE WITH WALK IN CLOSET, FULL BATH AND PRIVATE DECK FOR YOU TO ENJOY.  ADDITIONALLY UPSTAIRS YOU WILL FIND A FULL BATH, LAUNDRY AND DECK FOR FAMILY AND GUESTS TO ENOY TOGETHER WITH STUNNING WATER VIEWS.  IN THE LOWER LEVEL YOU WILL HAVE ACCESS TO YOUR GARAGE AND A FINISHED AREA TO USE AS A FAMILY ROOM, OFFICE, GYM OR ANYTHING THAT SUITS YOUR NEEDS!","Single Family Residence","2021","4,791 sqft"
"$1,320,000","6 bds","5 ba","4,774 sqft","https://www.zillow.com/homedetails/50-Whites-Hill-Ln-Fairfield-CT-06824/57301379_zpid/","Meticulous home with heated Gunite pool, conveniently located on a quiet cul de sac in lower Greenfield Hill on the Southport border. The flexible floor plan allows options for all lifestyles and stages. Plenty of space for todays needs, whether working/schooling from home, need an au pair or in law space, or just to entertain friends and family, this has plenty of options. Great room scale and flow. Amazing first floor master bedroom suite has luxurious bath that boasts gleaming stone tile, large glass shower, soaking tub and double vanity. It has french doors that open to the pool terrace, perfect for early swims or relaxing before bed. Three additional bedrooms on this level. Second floor has expansive fun entertaining wing that has room for media, games or gym equipment, an additional bedroom, full bath, second family room and office. Newly painted inside and out. Top of the line Stainless Steel appliances are a chefs delight.  Subzero fridge, Wolfe 6 burner cook top, Wolfe Double Convection ovens with additional warming drawer, and large microwave. The adjoining Mudroom/Laundry room has a walk-in pantry, utility closet, half bath and additional cabinets and counter space which makes it useful when entertaining. A large one bedroom apartment has full kitchen, washer dryer and jet tub, separate entrance and is a legal rental. 2700 sq ft unfinished lower level offers plenty of storage space. Natural gas available in the street. Perfect as a primary home or weekend retreat.","Single Family Residence","1985","89,733 sqft"
"$539,000","3 bds","3 ba","1,915 sqft","https://www.zillow.com/homedetails/176-Adelaide-St-Fairfield-CT-06825/58782769_zpid/","Before you step into this expanded three bedroom, three FULL bath expanded Cape, a front porch will find you thinking about relaxing at the end of the day   When you step into the home, on your right you’ll see an open kitchen for entertaining and a living room that is great for reading or gathering around a fire.  There’s a family room on the other side of the kitchen that could be split into a dining room and an additional bedroom as well as one bedroom on the first floor.   A foyer on the second floor offers plenty of options and two bedrooms upstairs offer plenty of space and great light.  A partially finished basement offers great office space as well as great storage.  Pantries and expanded closets and an attic offer plenty of space for storage.  A back patio and enclosed yard offer more space to entertain and play. Oil heat easily convertible to gas as line comes to home. All of this is convenient to town and train and all area amenities.  Great pre-war classic lines make this a comfy home with a soul.  Come see for yourself!","Single Family Residence","1937","6,534 sqft"
"$1,725,000","5 bds","4 ba","4,488 sqft","https://www.zillow.com/homedetails/432-Old-Post-Rd-Fairfield-CT-06824/57297770_zpid/","Rare opportunity to own a grand antique home steps from Fairfield’s picturesque Town Green. Timeless elegance of a by-gone era is intertwined with style & function for today’s living. An impressive foyer greets you with 11 ft ceilings, antique pine floors & stunning period details. Every room is adorned with oversized windows & almost all have decorative marble fireplaces. The grand Living Room has built-in cabinetry & is truly the heart of the home.  The white eat-in Kitchen has an over-sized island & opens to the sunny Breakfast Room which leads to the charming back Porch. The Billiard Room has elegant built-ins & lovely bay window. Front & back flying staircases bring you to the 2nd and 3rd levels boasting 5 bedrooms & dedicated laundry room. The luxurious Master Suite features an elegant dressing area with elaborate custom built-in cabinetry & walk-in closet. The en-suite marble bath has radiant heat floors, double sinks, soaking tub, double shower & dressing table. 2 spacious Bedrooms each with walk-in closet & built-ins share a marble hall bath. The 3rd floor has an Office & two additional Bedrooms that share a full Bath along with plenty of storage. The lower level offers 2 finished rooms with exposed brick & plenty of storage & access to the two-car garage. The expansive .78 acre property with gardens & private in ground pool create a peaceful oasis in the center of town. Stroll or bike to beach, restaurants, shops & train & enjoy an enchanting location & lifestyle.","Single Family Residence","1844","33,976 sqft"
"$3,999,999","4 bds","5 ba","5,699 sqft","https://www.zillow.com/homedetails/98-Banks-Pl-Southport-CT-06890/57303880_zpid/","Banks Place Farm, a rare find in the heart of Southport Village. This 1835 Greek Revival home has been meticulously restored, renovated and expanded, is a study in refined craftsmanship, bespoke elegance and modern amenities. Private 5.4 acres with a classic red barn is home to native gardens, an apple orchard, and natural stone walkways. Multiple living spaces offer flexibility for today's needs. Cooking and design work in tandem, and is celebrated in the kitchen and dining room addition. Custom cabinetry, multiple workspaces and top of the line appliances complement this ultimate gourmet kitchen. The great room with soaring ceilings provides room for everyone to relax, share and connect. An ultimate Work-From-Home office is easily converted to a guest room with custom hidden Murphy beds. New master suite has a quiet simplicity, with tall ceilings, a dressing suite and master bath that blends up to date luxury with historic charm. Bedrooms one and two share a large new hall bath. New third bedroom suite has sweeping views of property. A hinged bookcase in the second floor hallway hides hidden stairs to the third floor. Extensive renovations include the use of the latest technologies for all new electrical and plumbing, geothermal wells for heat/ac, and heated stone flooring. Historic details were lovingly restored and copied, and considered in the choices for new siding, roof, flooring, windows and doors. Close to beach, village center, harbor, library and train station!","Single Family Residence","1830","236,966 sqft"
"$1,299,000","5 bds","5 ba","3,197 sqft","https://www.zillow.com/homedetails/178-Taintor-Dr-Southport-CT-06890/58784862_zpid/","Incredible opportunity to own this spacious, 5 bedroom, classic Colonial in the heart of Southport Village. Set on nearly half an acre on one of the Village's most coveted streets enjoy walking to incredible restaurants, Equinox, Pequot Harbor, Pequot Library and Southport and Sasco Beach. Inside, an open floorplan beckons--family room with reclaimed wood beams, built-ins, wood burning fireplace and slider to slate patio. Formal living room with wood burning fireplace and kitchen with island and eat-in breakfast room. First floor en-suite master, home office or guest suite possibility with beautiful built-ins. Dining room with French doors to screened in three season room with corrigated metal walls and roof and herringbone brick floors. Huge laundry/utility room and sauna. Upstairs, 4 additional, generously sized bedrooms with tons of closet space and three full bathrooms. En-suite master has huge walk-in closet/office area. Lower level can be finished for additional space. Attached 2 car garage. All new windows, new central AC. Gas and city water. Award winning Mill Hill school district.","Single Family Residence","1961","20,908 sqft"
"$599,000","3 bds","2 ba","1,476 sqft","https://www.zillow.com/homedetails/194-Ludlowe-Rd-Fairfield-CT-06824/57299925_zpid/","In the sought after neighborhood of Ludlowe Park this beautiful home has been meticulously maintained and is within the Ludlowe Park Association.  Walk to all the great amenities Fairfield has to offer - great shopping and restaurants, train station, schools and sports and recreation facilities.  A slightly longer stroll can lead you to one of the 5 beaches Fairfield residents get to enjoy.   This lovely home offers great living space on the first floor to include a sunroom drenched with natural light and an office with built-ins. The upper floor has 3 bedrooms, a Den area and a Full Bath.  This beautiful New England Colonial sits on a little over a half acre which includes a detached 2 car Garage and Garden Shed.  There is finished Studio space above the garage.  The entire exterior was completely painted in November in Benjamin Moore Sea Gull Gray.  The furnace and hot water heater were installed new 2-3 years ago.  Arrange for your private showing today!  This home is a charmer!","Single Family Residence","1927","22,215 sqft"
"$1,999,000","6 bds","7 ba","6,365 sqft","https://www.zillow.com/homedetails/1800-Hillside-Rd-Fairfield-CT-06824/58784183_zpid/","Stately yet modern masterpiece with park-like grounds & magnificent detail. 6,300+ sf with 6 bedrooms, 7 baths, & 5 fireplaces. Upgrades include interior painted, wood flooring installed in 2nd floor bedrooms and sparkling white kitchen cabinetry with oversized island and newer Stainless Steel appliances. 1,200 sf master suite with vaulted ceiling, huge WIC, spa bath, fireplace & private balcony. 2nd master suite option on main level that opens to the veranda. every room is comfortably sized and versatile in it's use. Many options for home office as well. The enormous kitchen has a sitting area with fireplace as well as a casual dining locale overlooking the grounds. Custom cherry wood library/family room with vaulted ceiling, fireplace & french doors to patio.  Bonus rooms above garage are perfect for au pair, in-law or guests. Enjoy the huge terrace, heated IG pool and spacious pool house that gets tons of sunlight. 3 car attached garage. Fantastic location...only 7 min to train & town. A mere 55 miles to NYC! Truly a one-of-a-kind home. Please no showings on Sundays.","Single Family Residence","1979","124,581 sqft"
"$549,900","3 bds","2 ba","1,613 sqft","https://www.zillow.com/homedetails/1030-Jennings-Rd-Fairfield-CT-06824/58783300_zpid/","Welcome home to 1030 Jennings Road, an absolutely delightful storybook Cape with so much charm & character. The current owners have treated this dollhouse with so much love & care over the years and it shows. The welcoming rocking chair front porch leads you into the charming hall that opens into a spacious and classic living room with a wood burning fireplace and sun filled dining room. The updated kitchen features cherry cabinets, granite counters, tile backsplash and stainless steel appliances that leads to a lovely brick patio and private back yard. The generously sized family room with built in for books and collectables is a pleasant surprise that provides additional space for entertaining or just relaxing. The first level bedroom and updated full bath with a walk in shower completes the main level. The second floor features 2 additional warm and inviting bedrooms, full bath and loads of storage space. This home has hardwood floors throughout and a 1 car attached garage with a circular driveway. This beauty won't last long, so make an appointment today before its too late!!","Single Family Residence","1940","8,276 sqft"
