"Price","Bed","Bath","Area","HouseURL","Description","Type","Built","Lot"
"$235,000","3 bds","2 ba","1,941 sqft","https://www.zillow.com/homedetails/584-Gilbert-Ave-Hamden-CT-06514/58906497_zpid/","Charming Ranch located in a secluded section of Gilbert Avenue in Hamden Connecticut. This lovely ranch has tons of potential, and with a little TLC can be a buyer’s dream home. The main floor of the property possesses a long living room with hardwood floors and a rustic stone fireplace.  Also, on the main floor there is a kitchen with a formal dining area, 3 decent sized bedrooms, a full bathroom, and a Den. Moving down to the lower level there is a large partially finished family room as well as a bonus room and a half bathroom. In-law conversion for the lower level may be possible with the planning of a contractor and town approval. In addition to all these great features the house is nestled on almost a full acer of land which allows for plenty of privacy. Don't miss out. Book your private showing today.","SingleFamily","1957","40,075 sqft"
"$269,900","4 bds","2 ba","1,929 sqft","https://www.zillow.com/homedetails/40-Morgan-Ln-Hamden-CT-06514/57914627_zpid/","Space and privacy in a convenient location! Stepping inside, you are greeted by a spacious living room with hardwood flooring and an abundance of light. This extends into the sunken family room, where a vaulted ceiling, exposed wood beams, and a fireplace create a cozy atmosphere, while an oversized bow window provides views of the inground pool. The rustic charm continues in the kitchen and dining room, where you’ll find exposed brick and ample storage. A bedroom and full bathroom on the main level offers the convenience of one-level living, with three additional bedrooms and the second full bath upstairs. Enjoy the seasons from the beautiful, expansive property. Jump into the inground pool in the summer, lounge in the sun, and dine alfresco. An oversized garage provides incredible storage space. Located close to town shopping, restaurants, Quinnipiac, and Yale. Schedule your showing today!","SingleFamily","1954","18,730 sqft"
"$275,000","4 bds","2 ba","1,569 sqft","https://www.zillow.com/homedetails/140-Calamus-Meadow-Rd-Hamden-CT-06514/57918903_zpid/","Neat as a pin and bursting with charm, this home is ready for its new owners. Enjoy the outdoors with this quite and serene location just across the street from peach trees, providing a beautiful spring view.  You can choose to add cosmetic touches to this solid-built abode to create a modern family home with the blank canvas on the second floor or enjoy it as is with all its charm and romance.  Inside, the floorplan offers four bedrooms, all with built-in closets and access to the bathroom. Including a primary bedroom with on-suite. There is a combined living and dining room, plus a kitchen set at the rear of the home.  Forced air central cooling provides year-round comfort. There is also an office/laundry space to work from home on the main floor, plus an attached double garage. A shed in the rear yard offers extra storage space, while the yard offers ample room for the green thumb to indulge their love of gardening.  All of this is located close to local shops, and schools, making it an ideal property for families and downsizers alike.","SingleFamily","1935","18,730 sqft"
"$259,900","3 bds","2 ba","1,342 sqft","https://www.zillow.com/homedetails/90-Lane-St-Hamden-CT-06514/57916759_zpid/","Charming three bedroom one and one half bath Cape. All freshly painted with beautiful refinished hardwood flooring. Updated baths, family room with wood burning stove. Large three season porch, central air, perennial gardens, a must see. Agent related to Seller","SingleFamily","1954","10,454 sqft"
"$239,900","3 bds","2 ba","1,645 sqft","https://www.zillow.com/homedetails/118-Kirk-Rd-Hamden-CT-06514/57920948_zpid/","Location, location, location!  You'll love this convenient location – near Quinnipiac University and downtown shops and restaurants.  The lawn Kentucky blue grass and greens beautifully!  It is level with a patio area for your outdoor fun.  Inside the house features hardwood flooring, 3 bedrooms, a full bath with private access to the master bedroom, and another half bath/laundry off of the lower level family room.  Plenty of space for all your needs and hobbies.  Oil warm air heat and central air ducts (you’ll need to install a new compressor after you purchase) and newer replacement windows.  City water and septic (city sewer in street).  This home is price to be sold and offers the buyer tons of sweat equity.  See it today – it won’t last!","SingleFamily","1960","30,056 sqft"
"$449,000","4 bds","4 ba","2,937 sqft","https://www.zillow.com/homedetails/680-Hartford-Tpke-Hamden-CT-06517/57916219_zpid/","Stately Colonial with the perfect combination of modern day upgrades and classic Spring Glen charm. This 4 bedroom, 3.5 bath architectural gem is not one to be missed! Spacious formal living room with gas burning fireplace leads to a wonderful den/family room featuring a second fireplace. The formal dining room is off the updated kitchen overlooking the lovely back yard and koi pond. The first floor offers an extremely convenient laundry room with half bath, and a potential in-law with a main level bedroom and attached full bathroom. The upper level has the perfect master suite with a full bathroom, a lovely walk in closet, and electric fireplace. Two additional bedrooms plus another full bathroom complete the spacious second floor living space. This home features such stunning curb appeal with gorgeous garage doors, while the back yard has a lovely deck - all situated on a large half acre lot which has an invisible fence. Freshly painted interior, brand new washer & dryer, and so much more!  Close proximity to Yale/New Haven, golf course and highways.","SingleFamily","1924","23,086 sqft"
"$459,900","3 bds","3 ba","2,500 sqft","https://www.zillow.com/homedetails/801-Main-St-Hamden-CT-06514/109739426_zpid/","NEW CONSTRUCTION. Open and Spacious Floor Plan. Living Room leads to the Kitchen and also has Sliders Leading to the Deck. Kitchen with Granite Countertops and Island. Master Bedroom with Full Bath and a Expansive Walk In Closet. Three Total Bedrooms. Lower level Family Room with Full Bath and Sliders out to a Patio. Laundry Room. Taxes are to be Determined The Pictures are from a previously Built Home and will be updated with Pictures from Main Street when the project is ready to photograph. Taxes to be Determined.","SingleFamily","2020","37,461 sqft"
"$449,000","3 bds","3 ba","1,960 sqft","https://www.zillow.com/homedetails/290-Denslow-Hill-Rd-Hamden-CT-06514/303952788_zpid/","Here is your chance to own a New construction home on 3.66 acres. Home to be built by a reputable local builder and will be 1900sqft + or- with 3 Beds, 2 Full and 1 Half Baths. The home can be upgraded with additional costs and will be determined between builder and buyer. The bonus room over the garage is currently not included in the sq footage or price but can be added as an upgrade. Call for more details.","SingleFamily","2021","159,429 sqft"
"$190,000","4 bds","2 ba","1,420 sqft","https://www.zillow.com/homedetails/119-3rd-St-Hamden-CT-06514/57912983_zpid/","Welcome to your new home. This is your opportunity to make this house your home. With some finishing touches, this home will fill your needs. As you enter the front door, you enter directly into the large 3-Season porch for those days to just relax and have some quiet time. The main entry invites you into the living room, dining room, kitchen, 2 good-sized bedrooms, full bathroom and a laundry room. From here, make your way upstairs to 2 more good-sized bedrooms. The unfinished lower level does have a semi-finished room currently being used as a bedroom. The lower level has easy walk-out entry to the backyard for even more space to relax. This house is serviced by an oil furnace, gas hot water, city sewer and city water and the roof is about 15 years old. This house is being sold as-is.","SingleFamily","1910","3,920 sqft"
"$259,900","3 bds","2 ba","1,644 sqft","https://www.zillow.com/homedetails/54-Lexington-St-Hamden-CT-06514/57915567_zpid/","Charming, MOVE-IN condition Colonial has 3 bedrooms, 2 full baths plus finished lower level ROOMS WITH FULL BATH for extra recreation space. Fully applianced kitchen WITH SS APPLIANCES, FORMAL LR, FORMAL DR, Hardwood FLOORING, deck off kitchen, level backyard, open front porch, and oversized one car garage offers lots of storage space, FENCED YARD.","SingleFamily","1935","6,098 sqft"
"$399,900","4 bds","3 ba","2,028 sqft","https://www.zillow.com/homedetails/825-Prospect-St-Hamden-CT-06517/58905305_zpid/","Turn-key Prospect Hill brick home that has been renovated top to bottom! The home features an open layout with living room, dining room and kitchen - perfect for entertaining. This versatile space features new wood floors with a dark contemporary stain, wood burning fireplace and recessed lighting.  Newly remodeled kitchen with waterfall island, stainless appliances, subway tile backsplash and beautiful new cabinets.  The home has three bedrooms and two new full baths on the main level.  There is a spacious master bedroom suite and a gorgeous master bath with double vanity, large tiled shower and fantastic closet space.  The lower level of the home has a family room with new vinyl floors, fresh paint, and a second fireplace, as well a 4th bedroom with a third partially renovated full bath. There is also a large area for storage and washer & dryer hookups.  New roof, replacement windows, new front door and all electric utilities.  Bonuses: a large covered deck, detached two car garage, and nice yard with space for gardening. On the New Haven/Hamden line.  Prime location - only minutes to Downtown New Haven, Yale and local highways!","SingleFamily","1968","10,454 sqft"
"$389,900","4 bds","4 ba","3,227 sqft","https://www.zillow.com/homedetails/511-River-Rd-Hamden-CT-06518/57924266_zpid/","Multi generation living at it's best! This beautiful spacious split with full in-law accessory apartment has a lot to offer! The large remodeled kitchen has sub zero refrigerator,  wolf range with 4 burners and double char broiler, 1 full size oven and 1 half oven,  wine cooler, granite countertops with breakfast bar and 4 stools, ceramic tile floors and large eat in area. Living room with fireplace and newly redone hardwood floors. A nice surprise awaits you when you walk upstairs to find 4 large walk in storage/closet space in the hallway, spacious size bedrooms that has been freshly painted and new carpeting. Lower level apt has bedroom, sitting room and full kitchen with walk out that is handicap accessible. Relax outside in your 15 x 16 enclosed porch built in 2017 with trek decking, 3 car garage and 2 driveways! Close to major highways, restaurants, shopping, medical facilities and health clubs and walking trails and Sleeping Giant park.","SingleFamily","1960","20,473 sqft"
"$389,900","3 bds","3 ba","3,033 sqft","https://www.zillow.com/homedetails/142-Darley-Dr-Hamden-CT-06518/57924749_zpid/","Come see this beautiful Mt. Carmel Colonial with a contemporary exterior flair on the Cheshire/Hamden line! Set on 1.09/acre of land this custom home offers peaceful views of nature and the opportunity to fish trout in your own backyard right from Mill River. Love to entertain? Then don't pass by this versatile floor plan home. Upon entering the front door you will step into a sun-filled 2-story foyer showcasing a solid oak staircase that is flanked by the spacious Dining Rm on one side & an Office on the other, both w/hardwood. The oversized Kitchen boasts stainless appliances, plenty of cabinets & a slider to lead you to the rear deck. Off the Kitchen is a 22x22 remodeled Great Rm w/a gorgeous stacked stone tile wood burning FP, vaulted ceilings, and new flooring...just bring your ideas to make this a focal point room of your new home! The Powder Rm & Laundry is tucked away off the Kitchen. The upper level offers a MasterSuite w/WIC, full bath & vanity w/granite; 2 more bdrms & a full bath complete this level. The walk-out lower level (included in the living area sq ft as per the town) offers a Summer Kitchen & is perfect for a Playroom/In-Law/Au Pair. Just bring your imagination for this exciting home. The yard is tranquil & stunning whether sitting on the multi-level deck or at the fire pit. The 2 car garage & 2 driveways only add to this home. Minutes to Quinnipiac/Yale/Sleeping Giant & Farmington Canal Trails/Oakdale Theatre/fabulous restaurants, shopping & much more!","SingleFamily","1985","47,480 sqft"
"$217,900","3 bds","2 ba","1,908 sqft","https://www.zillow.com/homedetails/91-Vernon-St-Hamden-CT-06518/57920559_zpid/","Home With A Heart! This Mount Carmel neighborhood Raised Ranch is just dreaming of your personal touches. Tons of potential, oversized rooms with walk through main level bathroom off master. Gigantic eat in Kitchen and Dining Room combo. Lower level has both a large family room with wood burning fireplace, as well as an unfinished area that leads to the attached garage, and incredibly high ceilings with full sized windows. Lower level half bath offers laundry hook ups, and plenty of room to add a shower/tub. Tons of closet space and storage, gas, central air, mechanicals have been serviced. Spacious backyard, for perfect outdoor enjoyment.","SingleFamily","1969","12,632 sqft"
"$375,000","3 bds","2 ba","1,400 sqft","https://www.zillow.com/homedetails/60-Caroline-St-Hamden-CT-06517/57911821_zpid/","Perched on a knoll, hidden behind mature shrubs and plantings, overlooking the street, this Bungalow gem has been redesigned by the architect owner. Set on a deep private 0.26 acre lot that stretches all the way to Blake Road.  Inviting large front porch opens to a cheerful Formal Living Room on the right and Formal Dining Room on the left. 1st floor Bedroom could also be used as an office / library. Large updated kitchen has Shaker-style maple cabinetry and ample counter space. The Kitchen is open to the Sunroom with walls of windows overlooking a large IPE deck and professionally landscaped yard.   The 2nd floor as a spacious Master Bedroom with walk-in closet and access to a large balcony / deck overlooking the yard. Second bedroom faces the street and looks over the neighborhood. Comfortably-sized office / den is just at the top of the staircase. and faces the serene yard.   Spacious remodeled bathroom has a custom designed tiled walk-in shower.  The back yard has, in addition to the IPE deck, large flagstone patio. Various areas transition from more ""formal"" outdoor spaces to cleverly designed, secluded parts. A winding flagstone walkway takes you right to Blake Road.  Oversized 1-car garage.  Central air. Recessed light. Minutes to Yale, downtown New Haven, 15 drive to the train station. Only minutes to Hamden center, restaurants, and shopping. Mint condition. NEW ASSESSMENT FOR 2021 IS $141,120","SingleFamily","1925","11,325 sqft"
"$275,000","4 bds","2 ba","1,748 sqft","https://www.zillow.com/homedetails/97-Vernon-St-Hamden-CT-06518/57920560_zpid/","Check out this spacious Colonial! Located in a quiet neighborhood this property features 4 bedrooms, 2.0 baths, 1 car garage, hardwood floors, gas heat, fireplace and much more! Approved for Student Housing.  Come view it and make it yours!","SingleFamily","1970","12,196 sqft"
"$368,500","4 bds","3 ba","1,815 sqft","https://www.zillow.com/homedetails/110-Killdeer-Rd-Hamden-CT-06517/57911967_zpid/","This charming 4 bedroom, 3 bath bright and cheerful colonial sits on a beautifully landscaped lot on a quiet, tree-lined block. It has been well maintained, has many modern updates, and is in move-in condition.  The first floor offers a large, open kitchen/dining room with good work space, SS appliances, travertine back splash, Caesarstone counters, and a six foot dining peninsula. In addition, there is a good table area and an original corner cupboard.  The spacious living room has built-in bookcases, a fireplace, and a French door leading to an outdoor patio. There is a private  rear room and full bath that work well for a family room, office, or guest suite. The second floor has three spacious bedrooms and two full baths.  The lower level has a clean laundry area and is an ideal space for future development. A two car garage, mature landscaping, and lots of garden and play area surround the house. The very convenient location is close to Yale, hospitals, highway access, parks, shopping, and restaurants. This house sparkles!","SingleFamily","1940","13,068 sqft"
"$180,000","3 bds","2 ba","989 sqft","https://www.zillow.com/homedetails/28-Pine-St-Hamden-CT-06514/57911006_zpid/","Why rent when you can own! This beautiful 4 bedroom, legal 3 bedroom 2 bathroom home in Hamden offers a great setup w/ 989 sqft. .11 acres and 1car detach garage home brings you into 1st-floor master bedroom and spacious bedrooms upstairs. Start by walking up to your very own porch, which makes for a perfect place to sit back and relax. Then enter through the front door into your cozy living room perfect for entertaining. Keep going into the kitchen where you'll see stainless steel appliances and a huge walk-in pantry. Looking for more storage head down to the basement where you'll find plenty of space along with another room used as a den but makes for a great at-home office. You want privacy, head to the beautiful, green backyard where you'll find more than enough room for just about anything. Property is conveniently located near schools, shops, and close to park. Something you simply do not want to miss.","SingleFamily","1900","0.11 Acres"
"$348,000","3 bds","2 ba","1,560 sqft","https://www.zillow.com/homedetails/58-Norris-St-Hamden-CT-06517/58907207_zpid/","Beautiful colonial in Spring Glen with classic style and exceptional upgrades, inside and outside. This home has been lovingly cared for and will take your breath away. The large elegant Living Room opens to the sun-filled Formal Dining Room with built-in. The beautiful eat-in Kitchen was renovated with custom cabinetry, garden window, state-of-the-art appliances and stunning Caesarstone quartz countertops. French doors lead to a pleasant screened in sunporch and is a lovely part of the first floor living space. Upstairs you’ll find three generously sized bedrooms, tastefully painted with gorgeous hardwood floors. The remodeled Full Bathroom has a skylight and marble vanity and gorgeous tile throughout. An additional office/dressing room with plenty of storage could be used as a potential fourth bedroom. This home has a large walk-up attic adding ample storage space. Architectural features include gleaming hardwood floors, crown molding, beautiful original interior doors and trim in perfect condition. Central air conditioning, a finished lower level with full bathroom, separate (electric) heat, and full-sized walkout. This home has a wide driveway and two-car garage. Park-like outdoor living includes curved granite walkway, southern-exposure garden area and a professionally designed patio for sunbathing, entertaining and sunsets. A true oasis to enjoy and love. Minutes to Yale, walking distance to shopping, churches, gym and the Farmington Canal paved bike/walking path.","SingleFamily","1926","6,098 sqft"
"$535,000","7 bds","5 ba","3,560 sqft","https://www.zillow.com/homedetails/81-Old-Coach-Hwy-Hamden-CT-06518/57922052_zpid/","This meticulously maintained, and completely renovated contemporary \is a show stopper!  Architecturally designed for generational living, this home has on trends style! Offering endless possibilities, 7 bedrooms, (3 potential master suites),  5 full baths, and a large in-law apartment with private entrance, full kitchen, and master suite. This intelligent floor plan flows beautifully and features large rooms, hardwood flooring throughout and several outdoor entertaining areas.  Renovation with extreme attention to detail make this house shine. Marble and gorgeous new wood on the floors, marble countertops,  new stainless  (both kitchens).  The Open main living space, with vaulted ceilings allow for wonderful living space.  Ductless adds to the heating/cooling, along with renovations, and newer windows makes this a highly energy efficient home.   The professionally landscape grounds are a dream, complete with a brand new children's playground!  You will find the blue trail just down the street to met your outdoor adventure needs, and easy access to highways, schools, shopping, Universities, Downtown New Haven, and major roads. Make your appointment today!","SingleFamily","1978","28,314 sqft"
"$329,000","3 bds","3 ba","1,867 sqft","https://www.zillow.com/homedetails/1345-Paradise-Ave-Hamden-CT-06514/57921992_zpid/","Nice updated raised ranch on the Mt. Carmel section of Paradise Avenue, on a private interior lot and close to shopping, major highways, golf course, Sleeping Giant state park and Quinnipiac University. Open floorplan in the main living area features vaulted ceiling and 2 sliding doors to refurbished, wrap-around deck. The remodeled kitchen ha new cabinets, granite countertops, new tile backsplash and new SS dishwasher and garbage disposal (both are not connected). Beautiful heated sunroom is open to the master bedroom providing great lounging area with access to the deck.  There is a ""Ring"" doorbell at the front entry.","SingleFamily","1995","25,700 sqft"
"$299,900","3 bds","2 ba","1,294 sqft","https://www.zillow.com/homedetails/212-Augur-St-Hamden-CT-06517/57911374_zpid/","Beautifully renovated 3 bedroom, 2 full bath colonial with lots of upgrades. Wonderfully open main floor with wood burning fireplace, hardwood floors , and fresh paint throughout. Beautifully remodeled kitchen with herringbone tile backsplash, new stainless appliances, and wonderful stone countertops, just to name a few. Fully renovated main floor full bath with tiled floor and shower. Upstairs you'll find 3 bedrooms with hardwood floors continued throughout, and another remodeled full bath. With nicer weather on the way, enjoy dining or lounging outside on your oversized deck! Nothing to do here except decorate!","SingleFamily","1940","5,662 sqft"
"$599,900","5 bds","4 ba","7,009 sqft","https://www.zillow.com/homedetails/4224-Whitney-Ave-Hamden-CT-06518/57924562_zpid/","A stunning retreat.  Ready for you to finish and customize.  This custom built home offers many possibilities!  The first floor is a rear wall of windows bringing the natural landscape in!  The open floor-plan offers options such as an eat in kitchen, great room, fabulous Butler's pantry, formal dining room or living room.  Check out the pictures for design ideas! The 1st floor 2 bedroom suite with full bath could double as a home office.  The 2nd floor showcases a stunning master bedroom/bath, library/study, guest bedrooms, and a bonus room that would be perfect for a home schooling space.  The exterior offers a pretty red barn house with electricity and it's very own front porch. Beyond the beautiful backyard lies nature at it's best with wooded trails, a bridge to take you over the stream. Please refer to pictures to see the current state of the home","SingleFamily","2017","131,115 sqft"
"$200,000","2 bds","2 ba","1,411 sqft","https://www.zillow.com/homedetails/34-W-Helen-St-Hamden-CT-06514/57912745_zpid/","This is the cozy cape that feels like HOME! Features 2 beds and 1 1/2 baths plus partially finished finished lower level. There is potential for an office and 3rd bedroom. Entry foyer with opens up to the large living room. The kitchen is adjacent to formal dining room.  The main level offers a half bath and a bonus room/sunroom.  The upper level has two large bedrooms and a full bath. Additional space in the finished lower level, makes a great play room, home office and storage. Enjoy a large screened in back porch, great for starting your day or the perfect end to the day. There is a drive way long enough for several cars and a detached garage. Make this your home today!","SingleFamily","1941","5,662 sqft"
"$1,499,000","6 bds","8 ba","8,430 sqft","https://www.zillow.com/homedetails/6-Prospect-Ct-Hamden-CT-06517/57911616_zpid/","East Rock/Prospect Hill. Minutes down the coveted Hill to Yale and downtown New Haven. This sophisticated 8,430 sq ft Tudor mansion has 6 bedrooms, 8 bathrooms, 4 fireplaces, an in-ground  heated pool, and a stunning separate one bedroom guest house with lavish kitchen and central air. A circular driveway welcomes guests with a two car garage with beautiful wood doors, stone patios, landscaped gardens, and the private backyard with terrace which complete the exterior of the property. The interior was custom designed and renovated for two years with the highest level of workmanship and materials, 10 ft+ ceilings, front and back staircases. The first floor boasts a grand foyer which leads to the formal living room with oak paneling, intricate moldings, built in bookshelves, and a 5 ft fireplace with rose carvings, french doors to terrace lead into a formal dining room, conservatory with palladian windows, a mahogany library with extensive built-ins, and a family room with an interior balcony, cathedral ceiling, full bathroom and wet bar! The architect designed 40 ft kitchen is the centerpiece; every upscale appliance and gadget one can imagine; boasts granite, limestone backsplash and slate floors with a Butlers pantry. Upstairs there are 6 bedrooms/5 bathrooms on two floors and a dazzling 1,000 sq ft master bedroom suite with fireplace, dressing room, office and a luxurious marble bathroom with jacuzzi tub and separate steam shower. Work and entertain by the pool this summer!","SingleFamily","1928","33,976 sqft"
