"Price","Bed","Bath","Area","HouseURL","Description","Type","Built","Lot"
"$849,000","5 bds","5 ba","4,985 sqft","https://www.zillow.com/homedetails/301-Hogan-Rd-Hamden-CT-06518/72304877_zpid/","Sundrenched Nantucket style Contemporary Colonial with the feel of a new home with all the extras! Newly remodeled kitchen and baths. Two-story family room boasts a floor to ceiling RHF stone fireplace, built-ins, access to expansive Trex deck (42x15) and open kitchen. Kitchen offers top of the line stainless steal appliances including a Wolf gas stove with vented hood, granite countertops, breakfast bar and intimate eating area. Sought after first floor Master with two walk-in closets, luxurious bath with separate shower and tub and French door leading to the private deck. Upper level has three additional bedrooms, one with full bath. The Bonus room could be used as a fifth bedroom or office. The finished lower level has a bath and opens onto a private patio with a brick firepit.   The elaborate details in this custom home includes wide crown moldings, wainscoting, oversized windows to capture the light and East/West exposure, gleaming hardwood floors, recessed light and built-ins. Situated on 2.5 private acres at the foothills of Sleeping Giant, this home is within minutes of Quinnipiac University, downtown New Haven, Yale University and several sought after private schools. The perfect move-in ready home!!","SingleFamily","2006","106,722 sqft"
"$265,000","3 bds","2 ba","1,290 sqft","https://www.zillow.com/homedetails/45-Delsole-Rd-Hamden-CT-06518/57921816_zpid/","Fantastic student rental investment opportunity, these QU student investment are rare opportunities. The property is well maintained and consist of 4 beds 1.5 bath and has a strong rental history. Property is already rented for the upcoming school year, which makes it a turn key opportunity for an investor.","SingleFamily","1950","12,632 sqft"
"$239,500","3 bds","2 ba","1,416 sqft","https://www.zillow.com/homedetails/89-Glenbrook-Ave-Hamden-CT-06514/58905608_zpid/","Spring Classic! As you enter this welcoming home, you immediately feel the quality of construction-they don't build them like this anymore! French doors open to graceful living room with fireplace. Arched opening to grand dining room and onwards to modern kitchen. Rear entry mudroom provides a catch all for coats and shoes, or possibly convert to laundry area? Upstairs a wide hallway with three ample bedrooms and a full bath. Basement area ready for your expansion ideas, presently used as an at home gym. Spend relaxing evenings sipping beverages on your sweet front porch or retreat to your outdoorable partially fenced rear yard. Nearby recreation at Lake Wintergreen Park, great restaurants, shopping, QU, SCSU & short drive to downtown New Haven central business district.","SingleFamily","1930","6,534 sqft"
"$299,900","3 bds","3 ba","2,152 sqft","https://www.zillow.com/homedetails/9-Raelin-Rd-Hamden-CT-06514/57922021_zpid/","Location Location Location  !!!!  Come to this beautiful spacious colonial on a quiet cul-de-sac Mt. Carmel area . Great family home with open kitchen leading into the family room with fireplace, which overlooks the swimming pool and outdoor deck. Three spacious bedrooms with large closets. Offers central air, 2 full bathrooms and one 1/2 bathroom. Don't let this one go by, this home won't last!!  . AT OWNERS REQUEST NO SHOWINGS ON WEEKDAYS  BEFORE 4:PM . WEEKENDS ANY TIME WITH 24HOUR NOTICE.","SingleFamily","1973","23,086 sqft"
"$175,500","3 bds","2 ba","1,326 sqft","https://www.zillow.com/homedetails/34-Merritt-St-Hamden-CT-06517/57912072_zpid/","This Old Style single family home has 3 bedroom/ 2 full bathrooms with a cozy front enclosed porch and charming front door entrance. Walking into the home you are greeted with a warm foyer and stairs to the upper level with sight line through the kitchen and to the glass back door. Living room is on the right off the foyer and dining room off of the kitchen. Back door leads to fenced back area fully paved. No yard maintenance with plenty of space for outdoor furniture to enjoy the warm weather. Craftsman dream project with plenty of wood trim waiting for some TLC. PRICED TO SELL. Furnace is 9 years old. Selling home as-is. Take a look and see the potential! Book your showing in ShowingTime.","SingleFamily","1919","3,484 sqft"
"$565,800","4 bds","3 ba","4,100 sqft","https://www.zillow.com/homedetails/19-Cobblestone-Dr-Hamden-CT-06518/57922998_zpid/","This stunning custom colonial in the desirable West Woods area of Hamden sits on a professionally manicured half acre lot near Quinnipiac University, Sleeping Giant State Park and a short commute to Yale University. The open concept, architecturally designed, chef's kitchen features a 6-burner Viking range, built-in separate convection and microwave ovens with warming drawer, custom cabinetry, Bosch dishwasher and a large center island including high top table. The flow continues into a large family dining room with mirrored bar and wine fridge and an adjoining sunroom overlooking a 30x40 Trex lighted deck. This exquisite 4,100 sq ft home boasts hardwood floors throughout, new heating/central air conditioning systems, central vac, marble gas fireplace and a large, finished lower level. This home is move-in ready, and affords amazing space for family, entertaining and creating wonderful memories together.","SingleFamily","1993","23,086 sqft"
"$1,780,000","5 bds","5 ba","4,541 sqft","https://www.zillow.com/homedetails/150-Deepwood-Dr-Hamden-CT-06517/57911474_zpid/","Spectacular renovation of this iconic mid century modern home sitting on 3.3 acres of lushly landscaped grounds with breathtaking unobstructed views of New Haven and Long Island Sound . The private estate has walking trails, waterfalls, tea house and outdoor fireplace. Throughout the last five years the current owner has architecturally  transformed the original structure to this one of a kind light filled residence. Kitchen with adjacent walk in pantry and baths have all been tastefully updated using the finest of materials. Panoramic views from every window( all recently replaced). First floor guest bedroom with private entrance features a full handicap bath. Versatile floor plan allows for creative use of the upper level rooms.  All updated mechanicals. The detached garage has also been repurposed as a private studio/office with separate heat a/c that is a perfect peaceful retreat. The rooftop deck that offers 360 degree views is a magical area for entertaining. This is a home that you will love coming home to and will not want to leave. Irrigated professionally landscaped gardens. Electric charging station for car in driveway. Enjoy the ever changing weather and seasons from a different perspective 200' above sea level.","SingleFamily","1970","145,054 sqft"
"$419,500","4 bds","4 ba","1,685 sqft","https://www.zillow.com/homedetails/35-Deepwood-Dr-Hamden-CT-06517/57911740_zpid/","A FEELING OF SOLITUDE AND PRIVACY os offered in this hidden gem located in a beautifully treed private area. This 4 bedroom, 3.5 bath house has a quiet serenity. Every room looks out on nature and you’ll feel like you’re in a tree-house. The entry to the house has a large front porch perfect for a swing. The first floor has an entry hall, half bath, large living room with three sets of French doors, a fireplace, and built-in bookcases. The formal dining room has 2 original china cabinets and leads to a pantry with great storage. The simple kitchen has painted wood cabinets  and an area to have a breakfast table.  The second floor has four bedrooms and 3 full baths plus a library/study room. The walk-up third floor has a studio room that is an ideal get away from it all study. There is a two car garage and a patio area which is a great spot to look at the splendid trees and plantings that surround this home. Bring your imagination some TLC will go a long way to make every day in this house feel like you’re on vacation!","SingleFamily","1935","19,166 sqft"
"$335,500","3 bds","2 ba","1,574 sqft","https://www.zillow.com/homedetails/43-Lansdowne-Ave-Hamden-CT-06517/58906927_zpid/","Fabulous Cape in the heart of Spring Glen! From the foyer, to one side enter the charming sun filled front to back living room with a beautiful bay window or to the opposite side enter the renovated kitchen with beautiful cherry and maple cabinets, granite countertops (installed 2021), and stainless-steel appliances (updated 2020 & 2021).  The kitchen opens to the large formal dining room with a picture window overlooking the spacious backyard.   The inviting kitchen/dining room open floor plan is terrific for entertaining family and friends.  The first floor also features a bedroom or office (renovated 2012), in addition to a half bath (updated fixtures 2020). The upper level has 2 large bedrooms with ample closet space, in addition to a full bath (updated fixtures 2014 & 2021). Hardwood floors throughout and many rooms freshly painted.  Other updates include:  high efficiency tankless hot water heater/furnace (installed 2018), energy efficient windows, updated electric.  Located just minutes from Yale University and downtown New Haven! Walk to the Spring Glen village, coffee shops and Bassett Park. *Contingency","SingleFamily","1950","10,890 sqft"
"$199,900","3 bds","2 ba","1,775 sqft","https://www.zillow.com/homedetails/42-Fairview-Ave-Hamden-CT-06514/57910590_zpid/","This home because of it's location has tons of possibilities. Waking distance to SCSU ( 1 Block) and in the middle of a commercial area. Level lot with the possibility of additional housing on the rear of the home which had pre-approval. Has 3 Bedrooms two Full BATHS large kitchen and an equally large living room with fireplace. It's in an R-4 zone. Would also be an excellent investment for someone whose child is a boarded at SCSU 's dorms. Great rental possibilities. Could also be used a a group home, halfway home, or a day care because of it's centrality. Make a reasonable offer !","SingleFamily","1840","13,503 sqft"
"$289,000","5 bds","3 ba","1,710 sqft","https://www.zillow.com/homedetails/346-Pine-Rock-Ave-Hamden-CT-06514/57912532_zpid/","Wonderful opportunity to own this updated Hamden cape on a beautiful corner lot less than ½ Mile to SCSU! Offered at an 8% cap rate, this house was remodeled in 2019 with wood-look vinyl throughout, ceramic tile in kitchen and bathrooms, new plumbing, and enlarged kitchen. With 3 full bathrooms and 5 warm and spacious sun-filled bedrooms, this home could be perfect for investors and owner occupants alike. The first floor features a large eat-in kitchen, stone fireplace in the living room, a full bathroom, one bedroom, and one bedroom with ensuite full bath. The second floor features 3 bedrooms, an office/den, and one full bath. 1 car attached garage and driveway provide ample off-street parking. Fenced in back yard is perfect for gardening and entertaining. Plenty of storage space in the basement where the laundry is located. Call today to set up a showing!","SingleFamily","1863","9,147 sqft"
"$349,900","4 bds","3 ba","2,498 sqft","https://www.zillow.com/homedetails/175-Treadwell-St-Hamden-CT-06517/57915647_zpid/","Beautiful large Colonial home nestled in the Whitneyville of Hamden. This bright and full of natural light 4 bedroom and 3 full bath newly renovated home makes you feel at home. It is ready to move in. New carpeting in 2nd floor bedrooms, sparkling hardwood floor in the living room and dinner room. Open kitchen features maple cabinetry, granite countertop and stainless steel appliances. This spacious home also has 3 fireplaces to make your winters warm and cozy, they are in the Living Room, Family Room and finished basement which provides extra living space. Large private backyard with a shed for storage. Off street parking, 2 minute walk to Treadwell park where the children and pets can play. 12 minute ride to Yale University and downtown New Haven and 15 minutes to University of Quinnipiac, 5 minute ride to Hamden Plaza for all of your essential shopping and to Merritt Parkway. A TRULY MUST SEE.","SingleFamily","1938","10,454 sqft"
"$265,000","4 bds","2 ba","1,326 sqft","https://www.zillow.com/homedetails/20-Amherst-St-Hamden-CT-06518/68544190_zpid/","Fantastic student rental investment opportunity, these QU student investment are rare opportunities. The property is well maintained with an updated kitchen and gorgeous hardwood floors it consist of 4 beds 2 full baths and has a strong rental history. Property is already rented for the upcoming school year, which makes it a turn key opportunity for an investor.","SingleFamily","1938","11,325 sqft"
"$718,900","6 bds","6 ba","7,111 sqft","https://www.zillow.com/homedetails/3-Maplecrest-Ln-Hamden-CT-06514/72304608_zpid/","A home is more than a house, especially with this custom-crafted colonial! This is an entertainer’s dream home with 6 beds, 5.5 baths, and 8000 square feet of luxury living space. From the moment you enter, the bar is set high with a formal entry foyer that boasts a stunning split staircase. This double staircase and gleaming hardwood floors draw you into the breathtaking family room with a 19 ft high cathedral ceiling and gas fireplace. As you stand there in amazement, your eyes will be drawn to the large open kitchen with granite countertops, SS appliances by Viking, gorgeous backsplash, custom floor tile work, and cherry oak cabinets. You'll envision all the cooking, bonding, and entertaining you'll be doing in this open concept home. As you enter further, you'll see the formal dining room flowing from the kitchen and imagine all the holidays you'll host. 9-foot ceilings, crown moldings throughout, French doors, central air, gas heat, library, playroom, large mudroom, first-floor master suite with walk-in closets, jacuzzi tub, and stall shower, extensive second-floor master suite with large walk-in closets. As you move throughout the open floorplan, the transition is seamless with gorgeous hardwood floors and natural light. You have 4 bedrooms, 3 full baths, and laundry on the second floor, as well as a guest bedroom with a full bath in the basement. The basement has hardwood floors, a huge wet bar, fridge, wine chillers, entertainment center, and so so much more.","SingleFamily","2006","23,958 sqft"
"$235,000","3 bds","2 ba","1,821 sqft","https://www.zillow.com/homedetails/141-Gorham-Ave-Hamden-CT-06514/57913152_zpid/","Charm abounds a classic colonial home in the heart of a quiet neighborhood.   Living room and dining room with inlaid hardwood floors, framed with a contrasting wood adding a distinctive finish to the floor.  Eat in kitchen, all appliances will remain with the home and a door that leads to the quiet level backyard, a great outdoor space in the warmer weather for casual entertaining or a place to build a snow man in the winter.   A stately staircase brings you to the upper level which offers 3 spacious bedrooms and a full bath.  A pull down staircase to the attic offers easy access for storage.  Additional living space with a  family room located in the lower level of the home. The finishing touch is a 1 car garage. Home location provides easy access to shopping and to highway for commuters.    Don't miss out on this one!!","SingleFamily","1940","4,791 sqft"
"$1,495,000","7 bds","6 ba","4,936 sqft","https://www.zillow.com/homedetails/10-Marshall-Rd-Hamden-CT-06517/57911858_zpid/","Video attached! A mere two and one half miles from Yale University and former home to one of Yale’s Law School Dean’s sits one of the most prestigious properties offered in Hamden in over two decades. Quaint Marshall Road gracefully meanders up to this spectacular 3.2 acre estate; referred to by some as one half soccer field and one half exotic arboretum. Once within the estates private, yet welcoming, environment one forgets just how close you are to New Haven’s plethora of fine restaurants and diverse entertainment; or how convenient it is to travel to  New York or Boston. Walk to East Rock Park, Lake Whitney, or the New Haven Country Club.  Or, simply enjoy your surroundings pretending you are comfortably nestled within a Vermont-like environment. Harken back to the days when neighborhood friends got together on the front yard to enjoy a game of soccer or touch football. Or, remember when creative gardening set you atop the neighborhood pecking order. Speaking of gardening, beginning in 1950, the home was occupied by a family who enjoyed gardening and planting exotic specimen trees. The former President of the Garden Club of New Haven made certain that something colorful greeted its beloved caretakers each month while her husband carefully selected and located specimen trees.","SingleFamily","1913","139,392 sqft"
"$265,000","3 bds","1 ba","1,219 sqft","https://www.zillow.com/homedetails/105-Rentell-Rd-Hamden-CT-06514/57919881_zpid/","This house is truly turn key. There are no details missed in this well maintained home. Updated kitchen with Silestone countertops, oak cabinets and newer floors. The living room, dining room and 2 main floor bedrooms have sparkling hardwood floors. The bathroom is recently remodeled. The third bedroom is located on the second floor and has plenty of closet space. The dining room has sliders that lead to a large covered patio and perfectly maintained yard. The basement is very dry and can easily be finished into additional living space, including a second bathroom. 2 car oversized garage, and a 3 season porch with double doors. Oversized shed. Central Air. Plenty of storage in the large attic.  The driveway is extra wide and can accommodate extra cars, a camper or other recreational vehicles. Convenient location, close to highways and shopping. **Interior pictures will be uploaded tomorrow**","SingleFamily","1953","13,939 sqft"
"$99,000","-- bds","-- ba","900 sqft","https://www.zillow.com/homedetails/2644-State-St-Hamden-CT-06517/2076620181_zpid/","Liquor store on busy intersection in Hamden, CT.  for Sale. Busy Route, steady traffic, loyal clientele has great potential to grow under owner operation. Liquor, Lottery, Cigarettes, ATM, ICE, Drinks, and much more. Rent $1,200.00 per month. By changing hours of operation from 10 am- 8 pm to 9:00 am- 9:00 pm will boost the business exponentially.","Unknown","1990","Lot features: Urban"
"$574,900","4 bds","4 ba","3,288 sqft","https://www.zillow.com/homedetails/100-Birchwood-Dr-Hamden-CT-06518/57924301_zpid/","Unique custom Tudor style colonial sitting high (3288 SF) on a quiet street ON A CUL DE SAC) in the heart of West Woods! Spacious home well built on almost an acre (.96) with 3 attached garages (heated, 24 x 36) + 1 garage rear of property.  One of a kind sunroom (26 X 27) with 4 skylights, oversize fireplace (can be use for cooking as well) + small brick pizza oven.  Total of 13 rooms with 4 bedrooms, 3 full baths + 1/2 bath, gleaming hardwood floors throughout & tile. 2 levels home, kitchen, dining room, living room has also another fireplace, 1/2 bath on 1st level plus a foyer area that can be a study or office.  This home has concept and style with walkout lower level that can easily become an in-law apartment. Gross area total 5541 SF brick veneer & stacco on maso.  Secluded in itself since the driveway is long & private with serene backyard. A couple of fruit trees, gardening and let us not forget wild mushrooms! This home has 2 zones, central air, 2 oil tanks (capacity of 330 gal. each & connected) newer roof, city water, septic has new leachfield + sprinkler system front & rear.  - Gross Area  total of 5541SF  Plus 3 garages have heat!","SingleFamily","1985","41,817 sqft"
"$449,000","3 bds","3 ba","1,960 sqft","https://www.zillow.com/homedetails/290-Denslow-Hill-Rd-Hamden-CT-06514/303952788_zpid/","Here is your chance to own a New construction home on 3.66 acres. Home to be built by a reputable local builder and will be 1900sqft + or- with 3 Beds, 2 Full and 1 Half Baths. The home can be upgraded with additional costs and will be determined between builder and buyer. The bonus room over the garage is currently not included in the sq footage or price but can be added as an upgrade. Call for more details.","SingleFamily","2021","159,429 sqft"
"$129,500","-- bds","-- ba","-- sqft","https://www.zillow.com/homedetails/2-Crestway-Hamden-CT-06514/2076828739_zpid/","Commercial lot 0.63 +/- acres with frontage on Sherman Avenue in approved Manufacturing/Commercial zone. Minutes to Cheshire, Hamden Center, I-91 and the Merritt Parkway. Public Water and Sewer along with Natural Gas already in the street.","Unknown","No Data","Lot size: 0.63 Acres Lot features: Open Lot, Dry, Corner Lot, Level, Highway Access, Industrial Park, Office Park, Other, Approved Building Lot, Rough Graded"
"$175,000","-- bds","-- ba","-- sqft","https://www.zillow.com/homedetails/4183-Whitney-Ave-Hamden-CT-06518/109739755_zpid/","Prime Commercial lot zoned T-3  1.03 +/- acres with frontage on Route 10 (Whitney Avenue) providing easy access to Cheshire and points north as well as Hamden and points south. Minutes to 1-91, I-84 and route 15. Can be purchase with the adjacent parcel at 4180 Whitney Ave.","Unknown","No Data","Lot size: 1.03 Acres Lot features: Dry, Cleared, Sloped, Suburban, Approved Building Lot"
"$150,000","-- bds","-- ba","-- sqft","https://www.zillow.com/homedetails/4121-Whitney-Ave-Hamden-CT-06518/109731358_zpid/","Commercial lot 0.92 +/- acres with frontage on Route 10 (Whitney Avenue) providing easy access to Cheshire and points north as well as Hamden and points south. Minutes to 1-91. Can be purchase with the adjacent parcel at 4107 Whitney Ave (MLS #170210599).  Zone was changed to T3.5 zone with the Town Planning and Zoning Department in March 2019.","Unknown","No Data","Lot size: 0.92 Acres Lot features: Level, Suburban"
"$150,000","-- bds","-- ba","-- sqft","https://www.zillow.com/homedetails/4107-Whitney-Ave-Hamden-CT-06518/109724656_zpid/","Commercial lot 0.92 +/- acres with frontage on Route 10 (Whitney Avenue) providing easy access to Cheshire and points north as well as Hamden and points south. Minutes to 1-91. Can be purchase with the adjacent parcel at 4121 Whitney Ave (MLS #170210601). Zone was changed to T3.5 zone with the Town Planning and Zoning Department in March 2019.","Unknown","No Data","Lot size: 0.92 Acres Lot features: Level, Suburban"
