"Price","Bed","Bath","Area","HouseURL","Description","Type","Built","Lot"
"$359,900","3 bds","3 ba","1,900 sqft","https://www.zillow.com/homedetails/34-Nathan-Hale-Rd-Middletown-CT-06457/2076643806_zpid/","TO BE BUILT - New Construction To Start Spring 2021 - Pick Your Lot On This New Culdesac in Middletown Ct Today. Many Plans Available. PHOTOS OF HOME FILE.","SingleFamily","2021","7,405 sqft"
"$225,000","3 bds","1 ba","960 sqft","https://www.zillow.com/homedetails/124-Hickory-Cir-Middletown-CT-06457/57867588_zpid/","Just in time to enjoy your new home for the summer.  Barbeque on your deck, take in the outdoors in the cozy or enjoy your favorite activity in this very large open yard.  This bedroom ranch offers hardwood floors throughout.  Updated kitchen with granite and updated bathroom.Sunroom sq footage is not included so add more living space to what is stated, so add another 230 sq ft.  Large dry basement area is perfect for storage or suitable to finish. New shed for outdoor storage. Don't miss your opportunity - schedule your showing now!","SingleFamily","1961","20,473 sqft"
"$359,900","3 bds","3 ba","1,900 sqft","https://www.zillow.com/homedetails/35-Nathan-Hale-Rd-Middletown-CT-06457/2076643412_zpid/","TO BE BUILT - New Construction To Start Spring 2021 - Pick Your Lot On This New Culdesac in Middletown Ct Today. Many Plans Available.","SingleFamily","2021","7,405 sqft"
"$357,900","2 bds","2 ba","1,300 sqft","https://www.zillow.com/homedetails/160-Webster-Ln-2-Middletown-CT-06457/2076754130_zpid/","Founders Ridge - NEW MODEL Home -  this Stunning home TO BE BUILT located in new Active Adult Community in desirable Westfield area! Lovely wood kitchen cabinets, hardwood floors in living areas, tile in baths and laundry!! NATURAL GAS heat and AC. Come visit us- Friday through Sunday 1-3pm. Agent/Owner related. Photos similar. Come see why our motto is : "" Choose a Carefree Lifestyle"".","SingleFamily","2021","No Data"
"$409,900","2 bds","2 ba","1,400 sqft","https://www.zillow.com/homedetails/162-Webster-Ln-2-1-Middletown-CT-06457/2076708102_zpid/","PHASE II NOW OPEN!!!! NEW MODEL the ""STOW""  1,400 square feet-9 foot ceilings ,Front bay, Premium unit. Enjoy the views from your rear deck on this desirable corner lot. Tile in baths and laundry. Walk-in master closet. Natural Gas and central A/C. Visit this completed and decorated unit Fridays - Sundays 1 - 3 PM.  Building prices escalating! Come see this beautiful unit before additional price increases- this home can not be reproduced for this price!  Photos similar. Agent/Owner related.","SingleFamily","2020","No Data"
