"AREA","BED","BATH","BUILT","DESCRIPTION","LOTSIZE","PRICE","TYPE"
2027,3,3,1935,"Charming and beautifully updated and meticulously cared for 3 Bedroom, 2.5 bath move in ready Cape Cod home on desirable West Side, 30 minutes to Westchester County Airport, 60 minutes to LaGuardia, 15 minutes to Brewster, NY Train Station and just an hour and 10 minutes to Manhattan, NY, Times Square and Central Park. This home boasts a newly remolded kitchen with stainless steel appliances, and soft close cabinetry, set on just under a half acre of land. Hardwood floors throughout, arched entry ways, detailed woodwork, molding and many original details contribute to its charm and character. On main floor you'll find an open floor plan with living room, den, dining room and kitchen that allow for wonderful entertaining and a welcoming feel. Main floor bedroom does has its own entrance and half bath, which can be used as Master Bedroom, or if one prefers, one of the spacious two bedrooms on upper level, both with cedar closets, can be used. The upstairs also offers a full bath. Off of the kitchen is an enclosed, 3 season porch that was fully enclosed just under two years ago, with floor to ceiling windows, screens and sliders that open up to your private and serene back yard. In your back yard, you'll find a place for a garden, to have a cook out or to just sit and relax around one of the two fire pits. Downstairs you'll find a dry and partially finished basement area used as a workshop, with washer and dryer and full bathroom.","17859 sqft",389500,"SingleFamily"
2270,4,3,2010,"Welcome to your new home! Immaculate home located on a dead end street! No expense spared. Custom built home. Stunning attention to detail. The kitchen is complemented by stainless steel appliances, granite countertops, stone backsplash, ample storage, and tons of natural lighting. Open floor plan. Living Room features recessed lighting as well as a floor to ceiling stone fireplace. This home offers four bedrooms with three gorgeous bathrooms! Gleaming hardwood floors, custom millwork, and high end finishes can be found throughout. Hand forged artistic iron railings. A plush master bedroom suite that features an extra large walk in closet, soaking bubble tub, stand up shower and double sinks. Laundry room is conveniently located on the second floor. The bedrooms are bright and sunny. Lower level offers a bedroom, living room, wet bar and full bathroom. Newer build home with great mechanicals help keep the bills down. Radiant heat floors in the master bath and 1st floor, including the garage. Large outdoor living space with patio that is great for entertaining. Beautiful stone walls. Yard offers fruit trees, manicured landscaping, and playscape. Exceptional property. Very convenient location. Subdivision abuts Waterbury Country Club Golf course. Schedule a showing today!","34412 sqft",379900,"SingleFamily"
3706,3,3,1982,"A private haven in a tranquil natural setting.  Saltbox contemporary hidden away on 2.5+ acres at the end of a leafy lane in lower North Stamford. 3+ bedrooms, 2.5 baths. Numerous flex spaces for home office, gym, playroom or nanny/guest suite. Smoke and pet free. Main floor: Large country kitchen with 6-burner gas stove, adjoining family room with fireplace and dining area with sliders to deck. Cathedral-ceiling living room with Palladian windows, second fireplace and adjacent study. Adjacent large dining room seats eight. Mudroom convenient to deck and oversized double garage. Powder room. Second floor: Large primary bedroom with mini greenhouse, bath, dressing area with vanity and walk-in closet. Oversized second bedroom, full bath and laundry. Enclosed loft with skylight, currently home office. Third bedroom, currently second home office, with cathedral ceiling and Palladian window. Ample closet space and attic. Lower level: Walk-out lower level boasts large bonus room with separate entrance. Well pump, hot water heater, refrigerator, washer/dryer and second floor central air replaced 2016. Well pressure tank replaced 2020. Ample acreage, including subdivided lot, for large garden, recreation, etc. High speed internet available. Bus stop at the bottom of the lane; 5 minutes to Merritt Parkway, Trader Joe’s, Starbucks, other shopping and restaurants, 10 minutes to train, 20 minutes to Westchester Airport, an hour to NYC.","108900 sqft",729000,"SingleFamily"
1195,3,1,1943,"Direct Waterfront on Beautiful Lake Hayward.  Located on East Shore Dr this spacious seasonal cottage is almost 1200 sq. ft. 3 BRS/full bath.  Home features fireplaced living room with built-ins and cathedral ceiling.  Eat in kitchen/dining area with  large loft above.  Each bedroom is generous in size unusual for a cottage.  Sunroom provides additional living space to relax and enjoy your view.  Expansive Deck with panoramic view of the lake and fantastic size for entertaining.  Shed for storage.   Approx 48' of waterfront with your own private dock adequate to fit pontoon boat; canoes, kayaks and smaller boats.  Internal Noncombustible engines only.  Enjoy the peaceful setting..  Property conveys with all furnishings, small boats. Just pack your clothes!  Perfect for alternate use as Airbnb.  This home has many newer updates including paved driveway; windows, roof, water heater, exterior paint and staining, and dock.   Septic tank in 2016.  .37 acres include .14 lot across the street.  Taxes reflect both properties.","16117 sqft",409900,"SingleFamily"
3516,5,4,1890,"Classic Three Story Center Hall Colonial. Five Bedroom Three & One Half Baths. Two Car Garage, One Side, And Upper Level Are Finished. In Ground Pool.  Large Yard, Full Basement, Large Master Bedroom & Bath. Many, Many Updates.  House Sold ""As Is"". Owner Broker. Interior Photos Are Virtual.","24393 sqft",759000,"SingleFamily"
1604,4,2,1982,"This refreshed Raised Ranch offers a true in-law layout while still providing for the extended family. Main level features a bright & airy living room with new hardwood floors and large picture window. The kitchen showcases new granite tops, abundant cabinetry, new stainless steel appliances and a slider leading to the newly stained deck. The warm and inviting dining room is separated by a knee wall while the chair rail molding allows for potential two tone wall colors. Enjoy the updated full bath with new vanity and stone top, medicine cabinet and a tub/shower combo. The two bedrooms are both complimented with new carpeting, soft tone colors with chair rails and double closets. Lower level showcases an in-law suite with separate entry and the option for either two bedrooms with new carpeting and wainscoting, full bath, fully applianced kitchen and living room separated by pocket door to upper level. The second option allows for the main home hosting four bedrooms while giving the in-law the full bath with a studio kitchen and a living room/bedroom combo. With a new Boiler, thermo-pane windows, freshly painted throughout, extended deck, fully fenced-in backyard, shed, architect shingle roof and paved off street parking this home is just the beginning when it comes to making those new family memories!","8276 sqft",269900,"SingleFamily"
1477,3,2,1840,"Salisbury In-Town - This beautifully renovated 1840 village home is conveniently located in Salisbury.  An open-concept first floor layout includes the Kitchen with large island, Dining Area, Living Room with propane fireplace and Full Bath. A large back Deck that overlooks the yard creates cohesive indoor outdoor space. Upstairs there are three bedrooms and a Full Bath. A walkout basement and Mudroom off the Main level provide great space.    Enjoy the convenience and charm of in-town living from this quintessential New England home. Nearby Lakeville Lake, Twin Lakes, Catamount Ski Area & Aerial Park, Hotchkiss, Salisbury School, Berkshire School, Indian Mountain School and the villages of Millerton, NY and Great Barrington, MA.","13068 sqft",565000,"SingleFamily"
1588,3,2,1953,"Meticulously maintained ranch home. Three bedrooms, two bath and central air. The main level of this home welcomes you with a large open living/dining area boasting a new hardwood floor and access to an upper outdoor terrace. Kitchen with updated appliances, newer windows, and three bedrooms. The master bedroom has a spacious triple closet for your entire wardrobe! Fully finished lower level with walkout, work room and updated bath. This room is so grand that you can plan large gatherings/parties etc. or you may want to divide it into several spaces to accommodate your life style. There is an oversized two car garage that can house all of your extras. Enjoy the beautifully landscaped, sprawling, yard, either on your back terrace or your covered front deck. It is very private yet close to shops and amenities. This adorable catch won't last!","22215 sqft",299000,"SingleFamily"
1827,3,2,1952,"Check out this bright, updated, move-in ready colonial! Convenient to train, I-95, shopping and much more. Kitchen renovation in 2019, complete with granite countertops, soft-close custom cabinetry, wood floor, refrigerator, dishwasher, microwave/convection oven and newer stove/oven! Partially finished basement, expansive walk-up attic. Updated fireplace & newer built-ins in living room. Hardwood floors throughout the home and most rooms recently painted. Attractive, private patio installed a few years ago. Corner lot on quiet street. New washer and newer chimney upgrades.     PRINCIPALS ONLY for showings please - NO EXCEPTIONS! Please abide by Covid protocols. Masks are required. Please remove shoes if wet weather.     Home photos are from two years ago when home was on the market for rent. Seller and agent reviewed the home recently and deemed that the photos are representative of current condition of the home.","6098 sqft",520000,"SingleFamily"
1480,2,1,1950,"Welcome to this lovingly cared for ranch-style home situated on a generous corner lot with a circular driveway and one car garage/workshop area.  It offers a large living room with a charming wood burning fireplace, spacious bedrooms and hardwood floors throughout.  Enclosed sunroom off living room opens to backyard.  Potential expansion in the partially finished basement (30.5 ft x 15.5 ft) and attic (32 ft x 18 ft).  Tons of storage everywhere including large shed adjacent to garage.  Quiet neighborhood yet convenient to all local amenities.  Won't last long in this market!","16117 sqft",149900,"SingleFamily"
1939,3,2,2003,"Who's looking for a custom built ranch with great views of Crystal Lake? Well, you're in luck! You are close enough to walk to the town beach! You will simply fall in love with the open floor plan in this home. The chef in your family will love the kitchen which features lots of maple cabinets, granite counter tops, tile flooring, and a large center island. The kitchen also features an informal dining area, which flows effortlessly into the living room. The living room has a cozy vibe with its hardwood floors and wood stove insert, perfect for our cold New England winters. The open concept formal dining room has crown molding, and the same hardwood floors. This space is perfect for large holiday gatherings and oversized furniture. The master bedroom has the same charming hardwood floors, a walk in closet, and a custom ensuite bath. The amply sized master bathroom has a large jetted tub and a luxurious large tiled shower. There are two additional bedrooms, both with hardwood floors and neutral paint. The second full bath is also spacious and has a shower/tub combo. Rounding out the main level is a conveniently placed laundry area. The rear yard is peaceful and lightly wooded, perfect for enjoying your morning cup of coffee. You can either entertain on the deck or on the stylish paver stone patio, while taking in the sounds of nature. This is one you won't want to miss, so schedule your showing today!","40946 sqft",395900,"SingleFamily"
1417,3,2,1964,"LOCATION AND POSSIBILITIES! This is a rare opportunity to tackle a project well worth undertaking in the desirable Sunrise subdivision just two miles from the historic Guilford green and just minutes to highways, shopping and the train station. This 1964 Split Level has great bones but needs a new owner’s creativity, updates and love. Three bedrooms up, a large family room with wood burning fireplace below, and a main level featuring a kitchen and combination living/dining room with sliders leading to a level fenced-in and sun-filled yard ideal for playground, dogs, and flower and vegetable gardens. The Sunrise Association offers a neighborhood basketball court, tennis and a playground.","21780 sqft",257000,"SingleFamily"
2052,2,2,1950,"Charming Cape Cod style home that functions as a Ranch!  Main floor offers 2 bedrooms, a large eat in kitchen, living room with fireplace, dining room and full bath.  There is also a enclosed back porch off the kitchen which connects to the garage and back yard.  The lower level is completely finished with a family room, office, half bath, laundry area and a workshop.  The upper level on the home is not finished, but can easily be completed for additional living space.  The hardwood floors have just been refinished.  Central air, one car attached garage and a WHOLE house generator - which kicks in automatically the minute the power goes out!  The back yard is level and has a koi pond and putting green. The location is awesome - directly across from East Rock Park!  Home will be sold in as is condition (home is in good shape - but the seller does not want to do any work).  Inspections will be for informational purposes only.","13068 sqft",224900,"SingleFamily"
2490,3,3,1968,"Bring your checkbook!  One level living with many updates, quiet Huntington location & low taxes.  3 Bedrooms, 2.5 baths, 2 car garage under, all hardwood beneath carpeted floors.  Light and Bright.  Seller just installed new septic tank and fully passed inspections.  Vinyl, newer windows, lots of storage, etc.  Seller is purchasing new construction that will not be ready until June 15th.","40946 sqft",397500,"SingleFamily"
1032,3,1,1961,"Completely Remodeled Perfect Starter Home, There's Nothing to do here but Move-In, Wonderful Open Floor Plan and Gleaming Hardwood Floors through-out, Features include Eat In Kitchen with SS appliance, Granite Counters, Slider to Deck and Level back yard, Bright spacious Living Room, 3 Bedrooms and 1 Full Bath, The Lower level has an 11 x 11 Room with Electric Heat can be Home Office, Den or Gym, 1 Car Garage, Newer Siding, Roof and Windows, Well Established Oakville neighborhood, Easy to Show call Today.","7840 sqft",229000,"SingleFamily"
2358,4,3,1970,"This beautiful home is nicely situated on a bucolic, park-like 1.47 acre with frontage on the Wepawaug River. An ideal location to unwind and take in some fishing or kayaking. In addition to the river views, you will surely enjoy spending time with loved ones at the inground pool, on a warm summer day. This spacious, approximately 2358 square foot, home is just as impressive inside. Upon entering the home, you will be greeted by the nice and bright living room with hardwood floors and large bow window. A remodeled eat-in kitchen, with custom cabinetry and tile flooring has sliders that lead to an oversized deck. The main level also provides four bedrooms, all with hardwood flooring, including a master bedroom en-suite. Feel like grabbing a book and cuddling up by a fire? Come on down to the walk-out lower level which offers a family room with fireplace, office/bedroom, an updated, third full bath and separate laundry room. Other amenities include a covered patio, central air, two car garage, newer furnace and roof and freshly painted interior.","64033 sqft",445000,"SingleFamily"
4332,4,3,1974,"Act now, this is the home you've been waiting for in the sought after Pyquag Village of Wethersfield.  Features 4 bedrooms, 2-1/2 baths, a front to back living room and a front to back family room each with their own beautiful fireplaces.  Kitchen has a breakfast bar seating to a dining room with custom wainscoting.  Enjoy year round entertaining in the sunken four season sun room which is perfect for all occasions.  The sunroom  has a sliding glass pocket door for privacy off the kitchen, a wet and dry bar,  beautiful windows, french doors leading to an expansive trex deck with built additional surround seating, and a built in gas grill. A beautiful private landscaped yard set on .41 acre property.  Start planning your entertaining now! Lower level is partially finished with an abundance of storage space. Centrally located with transportation between New York City and Boston. This is the home to make it your own with so much potential to fit your needs whether it be a home office, family space, a home gym, etc. Truly a must see to appreciate all it offers!","17859 sqft",429900,"SingleFamily"
3107,4,4,1905,"Unique 1905 property on sought-after Parsonage Rd. Bright 4 bedrm Colonial  w/ 3 updated bathrooms in North Street School district, situated on a gorgeous level acre. Sun-filled Living Rm has fireplace & antique wide-plank floors, French door to Terrace. Formal Dining Room w/ fireplace. Welcoming eat-in Kitchen & Family Room opens to 2 large stone terraces. Study w/ wideplank floors & built ins. Primary Suite w/ 3 aspects, vaulted ceiling, walk-in closet & ensuite bath. 2 more Double Bedrooms & bathrooms (one ensuite) + a single Bedroom (currently a 2nd office). Sweeping lawn, perennial plantings, fenced backyard. Garage is As Is. All town utilities. This superb location combines the best in Greenwich addresses w/ great convenience to town, schools, train. One of a kind!","1 Acres",1775000,"SingleFamily"
2624,4,3,1966,"highest and best Sunday @ 5 INVESTORS TAKE NOTE!! CASH BUY..DIAMOND IN THE ROUGH.  SITUATED IN LOVELY NEIGHBORHOOD WITH WELL KEPT HOMES, THIS 4 BEDROOM COLONIAL CAN ONCE AGAIN BE THE NEIGHBORHOOD JEWEL! MAJOR RENO NEEDED.  EAT IN KITCHEN, DINING ROOM, LIVING ROOM WITH FIREPLACE, 4 GOOD SIZE BEDROOMS.  ONE FULL AND 2 HALF BATHS. LOWER LEVEL WAS BEAUTIFULLY FINISHED AT ONE TIME AND THERE IS WALK OUT.  VERY LARGE AREA WITH FIREPLACE AND HALF BATH.  POSSIBLE INLAW.   4 CAR GARAGE.  TERRIFIC NEIGHBORHOOD CLOSE TO RESTAURANTS, SHOPPING, RT. 8.  A FAIRFIELD  COUNTY. HOME.  24 HOURS NOTICE PLEASE.  COVID COMPLIANT. MASKS PLEASE. PRICE REFLECTS APPRAISAL. CENTRAL AIR UPPER LEVEL ONLY. INSPECTIONS FOR INFORMATIONAL PURPOSES ONLY.  NO BINDERS, SMART MLS OR NEW HAVEN BOARD OF REALTORS ONLY.  MOLD FORM TO BE FILLED OUT BEFORE ANY SHOWINGS ARE CONFIRMED.","40946 sqft",280000,"SingleFamily"
3734,4,6,1962,"Welcome to 78 Ledyard Road. This intriguing sun-filled Modern Ranch offering 4 bedrooms and 4.2 baths is a private retreat located in West Hartford that could be your next home. Behind the gated front door awaits an enclosed courtyard complete with a calming fountain to relax in seclusion.  This tranquil space is accessible from many rooms on the first level. Inside the home, the open floor plan provides flexibility for friends and family and the opportunity for authentic California-inspired indoor/outdoor living. The light-filled interior has wood floors throughout and numerous updates. The living room and the master bedroom opens to an expansive deck that overlooks the meticulously manicured grounds of The Hartford Golf Club. The updated kitchen offers granite counters and stainless steel appliances. There is even a wet bar for when guests are over! The master bedroom has an en suite his/her bath and walk-in closets. The main level also includes a cozy library and office space. The lower level is the perfect spot for everyone. In addition to 2 bedrooms with private baths, there is also a family room with a fireplace that opens to a bluestone patio surrounded by a brownstone wall. There are so many unique features of this house it is truly a ""must-see""! The space is ready and waiting for you to make it your own.","25264 sqft",9e+05,"SingleFamily"
11098,7,10,1974,"Mid-Country compound built to the highest standards located in a private association. Spectacular setting for this shingle-style manor house that has it all. Over 11,000 finished square feet with seven en-suite bedrooms including two fabulous master suites. The first floor has wonderful space for today's family living. Spacious formal and informal rooms plus offices and exercise room. The first floor flows to the outside stone terrace that overlooks the verdant lawns, pool, pool house and tennis court. The second level has a sensational master with spa like bath and walk-in closets. The lower level offers a huge playroom, oversized entertaining room w/wood and stone and walk-in wine cellar. Unparalleled in workmanship, this country retreat can offer so much enjoyment for family & friends.","88862 sqft",6895000,"SingleFamily"
2576,5,3,1987,"This forever home is in a class all of its own. Walk to the beach, to live music, or just simply enjoy the quaintness of this sweet spot. Breathtaking water view sunsets from all of your decks. Enjoy a completely private back yard with a custom tiled pool and bubbly builtin hot tub. A new professionally installed paver pool patio completes the landscape. Irrigation system, yes. Every inch of this property is meticulous, and thoughtfully designed. Custom birch cabinetry with state of the art appliances in the kitchen. Enjoy your morning coffee, lunch or dinner on your water view IPE deck which leads to a spiral staircase to the pool. It is such a cozy private space. There is a smartly positioned home office space which leads to the custom crafted magnificently designed great room. Coffered ceilinged great room with custom designed built ins and fireplace are a pleasure to behold. 3 bedrooms on main floor including a master ensuite. Every bath is tiled and completely updated. There are two additional bedrooms in lower level for guests. Imagine the possibilities. The lower level could also serve beautifully as an in law amenity. Laundry is on this level and also game/exercise space.  An additional entertaining/media room leads out to the pool. An immaculate epoxy covered floor in the 2 car garage, and a whole house generator. What more could you possibly need? This well loved home does not come along very often. It is near perfection. You will be amazed.","17859 sqft",749900,"SingleFamily"
1056,2,1,1952,"Home needs total rehab.  Cannot access structure per owners request.  1 acre lot that used to be part of a working farm.  Right next door to Lisbon Landing.  Back lot is also for sale and with a package deal, could be a great development!  Property will not go Gov't financing!  Also listed as commercial 170326472","43560 sqft",449749,"SingleFamily"
1860,3,3,1973,"ESSEX VILLAGE, a short walk gets you into the middle of the Best of 100 Small Towns in America and 1,000 Place to See Before You Die. Lot's of privacy being on the end of a cul-de-sac in an area of beautiful homes. A winding driveway leads to this charming home. You can enter through the spacious mud room with all the built-ins or enter through the front door that looks out to a professionally landscaped lawn. Once in the home you will feel the open space living you have been looking for. The oversized living room with wood burning fireplace has views of the outside deck accessed by a bank of french doors. The kitchen with breakfast bar has stainless appliances,and recessed lighting.  Around the corner is the first floor laundry area which leads out to the large deck and entrance to the garage.  The front den/office has a full bath that can be converted to a first floor bedroom.  The open staircase takes you to the second floor and 3 bedrooms. The smaller bedroom has a half bath  and down the hallway is the master bedroom that runs from back to front of the house. Two generous closets in the master plus it's loaded with windows for a lot of natural light. Master bathroom with tub shower and designer sink with window for natural light. A good sized third bedroom down the hall rounds out the second floor living space. The grounds are beautiful, surrounded by stone walls and seasoned landscaping and lots of room for a garden. Short distance to mass transit to both NY and Boston.","27442 sqft",610000,"SingleFamily"
1375,4,2,1959,"Ready to move in! Four-bedroom ranch, freshly painted, with newly refinished hardwood floors and new carpeting. The home is located near the end of a quiet cul-de-sac, which borders the Pequenock Valley Greenway! Hot water baseboard radiator heat with newer central air. Screened porch and finished basement. A short drive to local stores and dining, as well as the Trumbull Mall!","12196 sqft",379900,"SingleFamily"
2621,2,3,2002,"A Woodland Hills Classic - This well appointed Granville offer so much space! Hardwood flooring, recessed lighting, crown molding. Beautiful Sunlit & Roomy Living Room and Dining Room, Eat In Kitchen with Pantry leads out to new private patio. Need a Third Bedroom? This special unit has LOFT providing versatile GUEST/OFFICE SPACE. Lower level has a private finished room also perfect for home office. Lovely Master w/ GORGEOUS RENOVATED full bath and ample closets. 2nd Bedroom has en-suite bath and walk in closet. The Best Complex in Danbury Boasts Beautiful State of the Art Clubhouse with gym, private party room with full kitchen, and basketball court.Relax by the heated pool, play tennis, entertain the children in the tot lot and kiddie pool, take in nature through the beautiful marked walking trails. Woodland Hills is truly the loveliest community in Danbury. A perfect location.... Enjoy nearby quaint Bethel  Just 15 minutes to the Ny border on 84.","No Data",320000,"SingleFamily"
