"AREA","BED","BATH","BUILT","DESCRIPTION","LOTSIZE","PRICE","TYPE"
5530,4,4,1993,"This is the house you have been waiting for!  Custom built with 2x6 construction by current owner with attention to quality details and impeccably maintained. Sited on parklike 1.26 acres of professionally landscaped grounds with rolling lawn and terraced gardens. Plenty of room for a pool. Hunter /Hydrawise app irrigation system covers all lawn and most gardens . Gorgeous terraced stone work and a fabulous patio provides ample space for outdoor dining and entertaining.      Stunning 2 story entry opens to living room with wood burning fireplace and Formal dining room.  The gourmet kitchen with eating area & walk in pantry opens to a great family room area with a gas fireplace. There is an office with full bath on this level. The first floor has 9 foot ceilings.  A wonderful screened porch is accessed from the kitchen.  A back staircase for added convenience.  The master suite is spectacular!  New luxurious master bath with top of the line amenities.  Adjoining space would make a great office or exercise room.  There are built in drawers, a cedar closet & huge walk- in closet, with doored access to storage space   Finished 1800 sf lower level offers great space for recreational, work, exercise and home schooling.   A Large below grade room is ideal for storing wine.  A 2nd potential laundry room has been plumbed and wired (just needs to be vented).  Walk out to lower lawn brings in natural light.    House is wired for audio with Sonos control.","54885 sqft",949900,"SingleFamily"
5634,5,4,1986,"Do you love the versatility of a Ranch style home?   This sprawling, 4 sided brick ranch offers a thoughtfully designed layout.  The main floor plan of this home encompasses 3,186 sq ft all on one level.  Welcoming you into the home is a large elegant foyer that flows into the formal living room, formal dining room and large family room. The eat in kitchen area will easily accommodate gatherings no matter how large or small.  The main floor also features a laundry room, 2 full baths and 3 bedrooms. The Master Bedroom includes a walk-in closet and full bath, as well as a private balcony.  Be sure not to overlook the functionality of the additional 2,448 sq ft of finished space on the lower level complete with a full kitchen, 2 bedrooms, full bath and plenty of dining space and living space. The walk-out lower level has the potential for Multi-generational living or an in-law space, providing plenty of room for immediate family, extended family or guests!   This expansive ranch lends itself perfectly for a balance of family privacy and togetherness all under 1 roof!    Located on a in a quiet neighborhood setting with close proximity to highways, Wesleyan University and shopping and dining.","33976 sqft",475000,"SingleFamily"
2508,4,3,1977,"Southern New Milford Classic Four Bedroom home! Located within the development of San-P Estates this property is part of a neighborhood within a neighborhood. You can't beat the location with easy access to NYC and Southern Fairfield county. And you definitely can't beat taking in the afternoon sunsets that make a beautiful end to the day. This home features a large living room with hardwood floors and a formal dining room with plenty of room for those large holiday gatherings.  The kitchen is fully equipped with a breakfast bar and a separate dining area with access to the rear deck for outdoor enjoyment.  The family room is the heart of the home with its hardwood flooring and fireplace surrounded by bookcases.  The main level laundry is a real bonus along with a full bath.  The upper level boasts four bedrooms all with hardwood flooring. The Master Bedroom has an ensuite full bath and walk in closet.  Three additional large bedrooms round off this level with a full bath.  The lower level offers plenty of storage space along with housing all the home utilities and a two car garage.  Embracing the home are beautiful gardens, boasting flowering dogwood trees, outstanding rhododendrons, holly bushes and hydrangeas just to name a few of the outstanding specimens of mature landscaping that border the property.  Easy commute location while convenient to enjoy all that takes place at the town green.","43124 sqft",4e+05,"SingleFamily"
1632,4,2,1962,"Southern Enfield location for this Starr Colonial on fenced corner lot, offering magnolia, pear and peach trees.  Oversized 2 car garage for 2 cars plus large workshop area, and pull down stairs for additional storage.  Four Bedrooms, 1.5 Baths, some updating complete.  Front to back Living Room with fireplace, large window overlooking private rear yard.  Formal Dining Room, Kitchen with lots of cabinets and eating area/  Lower level offers Laundry area as well as craft/hobby area, complete with separate sink and counter.  A side deck offers awning for those sunny days.  A great property to make your own","15246 sqft",239900,"SingleFamily"
1575,4,2,1950,"Enjoy beautiful year round views of the inlet. Bird watching, kayaking and swimming just across the street. The 2nd floor has approximately 3/4 HW floors under carpet. The furnace was recently replaced. The basement is semi finished with exterior access. Private back yard with large deck for entertaining. Oversized one car detached garage provides additional storage. Property record notes the house as 3 bedroom, 1 bath. This is a well built home cared for by the current owner for 50 years. Move in and update with your personal touches.","5662 sqft",379900,"SingleFamily"
2208,3,2,1956,"Highest and Best Offers Due by 12pm on Monday April 19th.  Immaculate West Norwalk Ranch located on quiet cul-de-sac location. Drenched with natural light, this 3/4 Bedroom home checks every box. Hardwood flooring on main level and an open floor plan - perfect for both living and entertaining. Large living room with wood burning FP flanked by custom built-ins. Updated kitchen with granite counters & Newer S/S Appliances including induction Oven/range. Oversized great room with wall of windows and slider to large deck (20 x 14). Deck was refinished and painted in 2020. Primary Bedroom & 2 more Bedrooms with custom closets on main level with updated Full bath. Huge mudroom with wall of closets complete the main floor. Lower level with newer carpeting has generous sized family room with built-in, office/den/possible 4th bedroom, laundry room and updated full bath. Plenty of storage. 1 car attached garage. Brand New Roof. New Hot water heater. Security system, New Central A/C. Professionally landscaped level property. Irrigation system with control clock and fenced in private back yard with sand box.  Nothing to do but move in.","9147 sqft",549000,"SingleFamily"
6064,4,5,2002,"Spectacular country estate featuring a lovely custom home, a resort-style pool with pool house, a massive post & beam barn, chicken coop, mini barn, and more! Sited on just over 5.5 acres abutting conservation land, the property features two fenced areas for animals, sprawling front and rear yards, and a wooded area and rear pasture. This exquisite property truly has something for everyone! The home offers 3,564 square feet of living space on two levels featuring high-end finishes and extensive millwork throughout including crown molding, wainscoting, hardwood floors, and soaring ceilings. The first floor features a gourmet kitchen that comes complete with high-end appliances, a large island with a prep sink, granite counters, and a large pantry. Additionally, there is a great room with a floor-to-ceiling stone fireplace and two-story windows, a formal dining room, a butler pantry with a wet bar, a home office, and a media/family room. The second floor offers an incredible master suite with a spa bath, and three guest beds, one en suite and the others sharing a Jack & Jill bath. The barn was recently completed by Country Carpenters and offers approximately 2,500 square feet of add'l entertaining space on the second floor and room on the first for a car collection, golf simulator, workshop, etc. The pool house, also constructed by CC, has a half bath, living room, mini bar, and loft. The home also includes a new Control 4 system, a whole property generator, and a gas fire pit.","240886 sqft",1595000,"SingleFamily"
998,2,1,1928,"Welcome home!!! Well maintained Colonial on a no outlet street in a quiet neighborhood. Move in ready, recently painted, hardwood floors throughout. Newer bathroom and kitchen with stainless steel appliances. Main floor with living-room, dining-room and kitchen. Upstairs, two ample-sized bedrooms and a full bathroom. Full unfinished basement for laundry and storage. Newer high efficiency gas heating system. Electrical had been updated. Great yard for entertainment!!!","6534 sqft",175000,"SingleFamily"
2758,4,3,1988,"This 2758 square foot single family home has 4 bedrooms and 3.0 bathrooms. This home is located at 43 Lisa Dr, South Windsor, CT 06074.","0.46 Acres",NA,"SingleFamily"
1352,3,2,1987,"Welcome to your new home at 35 Brookside Dr! Located near public parks, with close proximity to Lake Hayward, and rt 11 for easy access to all Salem has to offer. This home has many great features such as hardwood floors throughout, an attached 2-car garage, and a spacious backyard. Enter the home into the entryway with easy access to the kitchen which offers ample counter and cabinet space as well as an island perfect for all your cooking needs. From the kitchen head on into the dining room equipped with hardwood floors and convenient access to the kitchen or living room allowing for easy entertaining. Walk on into the open living room with hardwood flooring and a fireplace great for a night of relaxing.  Then head on upstairs to find 3 comfortable bedrooms with hardwood flooring, plenty of closet space, and ceiling fans in two of the three rooms. This home has so much to offer including a spacious unfinished basement perfect for all your storage needs. Exiting the home through the sliders located straight down the hall from the front entryway, you'll find access to the deck overlooking the large level yard with a fire pit, garden area, and storage shed. This home has so much potential, including an unfinished basement and an expansive space above the garage with architectural plans allowing these spaces to be transformed to any room that suits your needs. Come see all this home has to offer today!   ****SALE IS SUBJECT TO SELLER FINDING SUITABLE HOUSING","49222 sqft",3e+05,"SingleFamily"
2995,4,3,1995,"Sought after location in Gilead Heights subdivision!  This 4 bedroom 2½ bath home is situated on 6+ acres for the utmost in privacy. Enjoy the best of both worlds - be in an established neighborhood yet enjoy the privacy of a large rear lot. A stylish hip roof Colonial, enter through the front door into the foyer with crown molding and turned staircase and notice the hardwood floors throughout.  The foyer is flanked on one side with the formal dining room with crown molding and on the other with the front to back living room with fireplace. The living room is open to the eat-in kitchen with center island, bead board trim and new stove and microwave.  Flooded with natural light, the first floor has been freshly painted and the popcorn ceilings have been removed.  Access to the ground-level deck is from French doors in both the living room and kitchen.  On the second floor you will find the master suite with walk-in closet and bath with double vanities and whirlpool tub.  3 generous bedrooms share a hall bath with double sinks and the laundry room is conveniently located upstairs.  The lower level adds almost 500 sq feet of living space plus plenty of room for storage.","291852 sqft",369900,"SingleFamily"
1224,4,1,1955,"Four Bedroom Cape Style home in the North End of Bridgeport. Hardwood flooring throughout the home. Main floor features a Living Room, Eat-in-Kitchen and Full Bathroom.  Two well appointed bedrooms on the main floor.  Upper floor offers two additional bedrooms.  Deck overlooking the spacious yard.  Large and spacious unfinished basement - ample storage opportunity.  Private driveway - unpaved.   Ample off-street parking.  Cul-de-sac.  Ideally located - minutes to public transportation, shopping, highways and all amenities.   Home is offered ""AS IS"".  Note - Sale of this home is subject to the owners finding suitable housing.","6534 sqft",275000,"SingleFamily"
1532,2,2,1999,"This private retreat is ""One of a kind"" and sits on 3.5Ac in Essex within a quick walk to Essex Village.  This home is reminiscent of an antique New England Mill. In addition to the home there is a rustic barn that is a perfect office or guest space.  The main house has a Family Room with cathedral ceiling and fireplace.  Antique beams in the  Dining Room along with the wooden cathedral ceiling and wideboard floors give the room an 18th century feel. The Living Room, Kitchen, pantry and half bath complete the first floor. A spacious patio is ideal for entertaining and is accessible from the family room and dining room. The second floor of the home has a Master Bedroom with wideboard floors, a second bedroom also with wideboard floors. There is one hall bath plus the laundry. A natural stone path leads from the patio to the Barn and garage.    The first and second floor of the Barn is a wonderful office/overflow guest space.  There is heat and a/c in the barn.  From this home you can stroll through Cross Lots (across from end of driveway) and from there to the Library, Park, Tennis Courts and onto Main Street where you will find wonderful Shops, Restaurants, Yacht Clubs and the Connecticut River.  Located two hours from New York and Boston.  A perfect getaway from the City!   Move to Essex... once described as ""The Best Small Town in America"".","153331 sqft",550000,"SingleFamily"
1331,3,2,1939,"Classic Colonial with three bedrooms PLUS first floor office and two full baths (first floor bath room with oversized jetted tub, second floor with stand-up shower and heated towel bar). Open Kitchen & dining concept features granite counters, copper tile back splash, oak cabinets with walnut stain.  Hardwood Flooring throughout (white oak & southern yellow pine).  Wood burning fireplace in living room. Original 8"" wide baseboards and french doors.  Full walk-up attic accessible through bedroom (#2).  Washer and Dryer (and Lower Level Freezer) Included.  Gas Furnace (steam radiators! The best type of heating!) 2002.  Architectural Shingle 2003. Rear deck made of red cedar is 450 SQFT. Detached three car garage (one bay can be rented for additional $$)","7840 sqft",209900,"SingleFamily"
3038,3,3,2021,"Stunning NEW CONSTRUCTION on quiet rural road with 2.19 acres for privacy. Watch for deer in your backyard. Colonial style home with full basement. Elegant living room with stunning Hickory wood flooring and Windsor trim. Formal Dining room with Oak wood flooring and lots of sun light. Thoughtfully designed kitchen with granite counters, distinctive tile flooring, center island for extra storage and work area and a pantry closet. Kitchen has area for eat in with sliders to a beautiful 12 X 12 Composite deck making entertaining a breeze for upcoming summer evenings. Extra convenient half bath on the main floor. Beautiful detailed hard wood stairs lead up to the second floor. Master bedroom with oak flooring full bath and walk-in closet . Bonus room off the master 6x6.5 could be office, craft room or more closet space. Conveniently located laundry on the second floor. Two more generous sized bedrooms and ceiling fans in all the rooms. 28x24 Oversized 2 car garage with automatic garage door openers.","95396 sqft",429900,"SingleFamily"
1524,3,1,1948,"Welcome Home! This beautiful Cape is ready for a new owner.  The property features 3 bedrooms, 1 bath, updated spacious kitchen, new flooring, hardwood, finished lower level, laundry room, detached garage, level lot and much more! Come view it and make it yours! Sold As Is.     ***MULTIPLE OFFERS, BEST AND FINAL DUE BY SUNDAY 4/18 AT 8:00PM***","6534 sqft",185000,"SingleFamily"
3478,4,3,1953,"A real charmer in Havemeyer Park with North Mianus and Eastern Middle schools. Crescent shaped drive introduces home. Enjoy open plan with high ceilings, hardwood floors, kit/ gas DCS stove, stainless appliances, granite counters. Fabulous mstr suite with luxe bath, walk in closets. Large studio could be bunk room, add'l bedrms or playrm. 2 car gar opens to mudroom.. Library/den is perfect office with sep entrance. Dine outdoors on  stone terrace with seating wall overlooking beautifully planted, private grounds. Sep au-pair/in-law quarters w/private outdoor entrance and sep laundry. Sauna, whole hse generator,sprinkler sys. alarm. Owner has plans for studio to create bedrooms, playroom and bath. A wonderful house in move-in condition!! Contact agent to show.COVID precautions required","0.28 Acres",1950000,"SingleFamily"
2700,4,2,1951,"Welcome Home!! Four bedroom two full bath ranch.  This house has been completely renovated.  New roof, new windows, new electric, new pvc plumbing, hardwood floors, porcelin tile in the kitchen, ceramic tile in the baths, new cabinets, granite counter tops, stainless steel appliances, fireplace, new deck, oil heat, central air, and two car garage.   There is a room downstairs plus a large unfinished space that could be finished.  All permits were pulled for the renovations.  There can be a fifth bedroom in the basement.  This home is a must see!!!","14374 sqft",289900,"SingleFamily"
4476,5,5,1995,"LOWER Weston: Location, location and lots of space.  Work from home, entertain and/or just spread out, there’s room for it all!  Move right into this expanded floor plan with 4600 square feet offering a flexible layout. 5 spacious, light-filled bedrooms, 4 1/2 bathrooms, a picturesque great room with wood-burning fireplace, spacious dining room, living room (currently used as arcade thanks to Covid) and a large kitchen with center island and full-size breakfast area.  In addition there is an enormous first floor playroom, and two separate large, windowed offices upstairs (one of which could easily be a 6th bedroom, additional playroom, upstairs family room, or so much more). When we say spacious, we mean it -- lots of big rooms to use to your specific lifestyle, this is truly the luxury of flexible living! High ceilings, large windows and amazing natural sunlight fill the entire home.  The expansive backyard, with room for a pool and tennis/sports court, allows for endless outdoor enjoyment. This center hall colonial is nestled on 2 acres on a quiet cul-de-sac.  Minutes from Weston’s town center and highly sought-after schools, and just over the Westport line, you have easy access to the Merritt, Westport train station and Compo beach. This house offers the ideal blend of privacy and convenience in a neighborhood setting.  Own the home where family and friends want to gather to create your favorite memories.","87991 sqft",1349000,"SingleFamily"
3400,4,3,1960,"Room to roam in this expanded home updated by carpenter/owner to include loads of specialty moldings, hardwood floors throughout, main level spacious bedroom and full bath, upstairs kitchenette, bonus loft/den area on second floor, master bedroom with private bath on 2nd level, open floor plan great for entertaining with super sized kitchen and family room open to one another , newer well pump, roof 8 years young, aqua booster 8 yrs old, 2nd floor laundy hook up as well as basement area, hydro air unit in attic, stamped concrete sidewalk, covered front porch.....the extras go on and on....Come and see the value!","40075 sqft",590000,"SingleFamily"
1758,3,3,1935,"Dreams Come True! This charming three bedroom home has exceptional curb appeal and great outdoor space for entertaining and gardening. Architectural details of the home include cathedral ceilings with wooden beams, lots of glass, wood floors and a magnificent Fieldstone Fireplace. A secret patio room is  located off the back of the house. This unique home is located on Candlewood Isle in New Fairfield, Connecticut. Candlewood Isle amenities include a guardhouse entrance, tennis courts, bocce court, basketball, Clubhouse with social events, marina, private beach, playground and summer youth camp. There are miles of private roads for biking, walking, and jogging. New Fairfield's in-town shopping and restaurants are a plus in addition to nearby hiking trails in Pootatuck State Forest and Great Hollow. Candlewood Lake has approximately 65 miles of shoreline and is used year round for swimming, fishing, paddleboarding, water skiing and tubing. New Fairfield is less than 90 minutes from NYC. Call for an appointment today!","10018 sqft",525000,"SingleFamily"
1995,3,4,1951,"This beautiful home located on one of West Hartford’s few cul-de-sacs is a rare find! Set on a quiet street yet walking distance to Bishop’s Corner, Whole Foods, elementary, middle and high school, and houses of worship, and also just minutes to West Hartford Center and Blue Back Square! Charming and light-filled, featuring 3 bedrooms, 2 full baths, 2 half baths and hardwood floors throughout. You will love the spacious front-to-back living room with fireplace, kitchen with an opening to the sunny dining room, multi-windowed bonus room that could be a den, office, or playroom and the convenience of a first floor laundry/mud room with direct access to the 2-car garage. Upstairs you can restfully settle in to a large primary bedroom with en suite bath, a second bedroom that comfortably holds a king-sized bed, a third bedroom which easily fits a queen-sized bed, and a beautifully tiled hallway full bath with granite countertop. Plenty of outdoor fun to be had with the .43 acre level lot including back patio, expansive backyard, and in-ground basketball hoop! Plus, there is an additional 900 square feet in the partially finished lower level - perfect for a rec room, gym, workshop, or storage and it has a convenient half bath. You will enjoy the benefits of central air, gas heat, and a new water heater! Don’t miss this one!","18295 sqft",399900,"SingleFamily"
3883,5,4,1979,"Come enjoy this modern and chic home centrally located in Easton, privately set back on 3 acres. Exceptional layout with soaring ceilings, floor to ceiling windows showering this home is abundant sunlight. Open 2 story foyer leads to the living room with fireplace and built ins, hardwood floors throughout the main level, light drenched dining room flanked by windows. Views from every room in the house. A renovated kitchen with granite island, stainless steel appliances, and sliders to the deck. Bright and spacious first floor master bedroom with cathedral ceilings, walk in closet, private balcony overlooking the backyard and a master bath with double sinks and jacuzzi tub.  The roomy upper level boasts 3 bedrooms with hallway bath. The fabulous extra bonus is the finished walk out basement with family room, fireplace, wet bar, 5th bedroom and full bath with sliders to the backyard. Enjoy peaceful living, convenient to schools, shopping, dining and commuting. Be part of the special Easton community with country living and award winning schools! This unique, chic home is not to be missed!","141134 sqft",750000,"SingleFamily"
1660,3,3,1986,"Welcome to 64 Harold Rd., in Beautiful Farmington CT, known for its Blue Ribbon Schools.  This contemporary Raised Ranch with phenomenal curb appeal and professional landscaping,  was the model home for the subdivision.  Quality through out including a full masonry fireplace and chimney, newer 40 year architectural shingles, Anderson casement windows, and gleaming hardwood floors. Updated kitchen with granite counters. There is not a more meticulously maintained home in Farmington.  Location, Location, Location!  A fabulous, peaceful neighborhood tucked away, yet easy access to Route 6 and major commuting routes, close to shopping & dining. The open floor plan on the upper level makes it a pleasure to entertain indoors or just snuggle up in front of the wood burning fireplace.  The large deck off of the dining area has plenty of room to entertain the guests with access to the park like rear yard with privacy fencing. There is absolutely nothing to do to this home except bring your belongings!  The spacious lower level is finished with walk out access to a patio in the rear of the home.  The garage is spacious with organization shelving and newer garage door openers.  Make an appointment today for your private showing. Interest rates are still at an all time low, buy now before it's too late!","13068 sqft",359788,"SingleFamily"
NA,NA,NA,NA,"OPEN CORNER LOT VACANT.BOUNDED BY SIDEWALKS AND FENCE.  SOME OLD FOUNDATION.",NA,10000,"Unknown"
NA,NA,NA,NA,"Builders take notice! Excellent visibility and access on this level lot with over a half acre! Great opportunity to build on with potential for neighborhood business or other commercial use. Prime location with connections available for electric, water, sewer and gas.",NA,15000,"Unknown"
NA,NA,NA,NA,"Come and check out this nice size lot with a road frontage of 36 feet by 125 feet long. Close to Bridgeport industrial zone. Please check with city of Bridgeport for potential uses.",NA,19900,"Unknown"
