"AREA","BED","BATH","BUILT","DESCRIPTION","LOTSIZE","PRICE","TYPE"
1256,3,2,1955,"Unpack and enjoy this sprawling 3 bedroom, 1.5 bath, ranch style home with updates galore! Impressive floor plan offers vast amounts of space throughout unlike most ranch style layouts. Enjoy a large eat-in kitchen with an abundance of cabinetry and counter space, living room with fireplace and picture window overlooking the private rear yard. Updated baths, hardwood floors in all 3 bedrooms, ceiling fans throughout. Looking for more? How about the 11x21 enclosed 3 season porch with sliders (not included in total sq. ft.) attached to the 1 car garage with auto door opener. Full unfinished basement with hatchway and high ceilings is ready to finish for additional space. Updates include newer windows, roof, siding, gutters, electrical, gas furnace, gas hot water heater, garage door, kloter farms shed, plus a full home energy audit with new insulation inside and out makes this home complete. Truly a wonderful place to call home....Some photo's virtually staged to envision spaces furnished.","13068 sqft",257500,"SingleFamily"
1479,3,1,1927,"Located in the Behind the Rocks neighborhood of Hartford, this great 3 bedroom 1 full bathroom Colonial is perfection! Situated on a mature tree lined street your blocks away from all the wonderful amenities Hartford has to offer!  With a spacious eat-in kitchen that opens nicely to the formal dining room, it makes entertainment a breeze!  Enjoy the fireplace in the living room on those chilly New England nights.  This house has a wonderful mix of old world charm and modern day updates!  A quick drive lands you on New Britain Ave with it's world famous shopping and restaurants. Blocks away from Pope Park, Rocky Ridge Park, and Trinity College.  Don't let this one pass you by!","6969 sqft",159900,"SingleFamily"
4358,4,4,2008,"Stunning waterfront property tucked away on a peninsula with over 4,000 square feet of living space, including 4 bedrooms and 4 baths, set on 1.3 acres with 325’ lake frontage on a 43-acre lake adjacent to 300-acre state park. Feel at one with nature as you observe the changing colors throughout the seasons. A wonderful spot to swim, kayak, or paddleboard. Enjoy non-motorized boating in the summer months and ice skating in the winter, while watching amazing birds. No expense was spared in designing this home. Luxurious finishes are enhanced with custom wood cabinetry, rails, bookcases, doors, hardware, hand painted tile, art glass, granite, copper & slate. An open main floor design and plethora of glass maximizes the spectacular water views, while the entertaining spaces flow seamlessly together to gather or retreat. Other features include: 3 fireplaces, luxury appliances, built-in closets, multi zoned heating and cooling systems, automatic generator, security & irrigation systems, hydraulic gated entrance, surround fenced yard, mahogany deck with solid iron rails, wire ready sound system, 3-car garage, ample basement space that leads to a slate patio with stone terraces set among numerous specimen plants and trees. Minutes to schools, restaurants, shopping, and concerts in the park. Located in a private beach community with year-round activities. It is truly a magical spot for those seeking detail, quality and location in the beautiful, charming town of Ridgefield.","57063 sqft",1499999,"SingleFamily"
3042,3,3,1825,"Perfect home and location for the artist and aesthete! Affectionately referred to as ""Frog Hollow"", this  c. 1825 home is also referred to as the Enoch Gilbert house, and is an absolute treasure both inside and out. Located on a designated scenic road and bordering the celebrated 60 acre Weir Farm, this historic property is just 5 minutes to shopping and train, and 15 minutes to I-84, I-95 and the Merritt. This well preserved home is sited  beautifully on an exceptionally picturesque and bucolic property that includes stone walls, patios, a private pond and pergola, as well as a front courtyard that leads to the two car detached garage with loft. Unique and quaint floor plan allows everyone their own privacy, and actually has two main levels. The front to back living room has one of three fireplaces in the home, and the kitchen  includes top of the line stainless steel appliances and opens up to the family room which has windowed walls offering fantastic views of your own private oasis. And don't forget the dining room with fabulous brick flooring, a fireplace, and access to the patio outside. The master suite also offers those private and  exceptional private views. Perfect weekend getaway for those who wish to escape the city, and yet be close to everything. ALSO to note: New well pump Dec. 2020; New septic tank Dec. 2020","93218 sqft",9e+05,"SingleFamily"
1992,4,2,1980,"MOVE IN Ready Ranch with finished walk out basement .  New hardwood floor, New Appliances ,newer roof , update kitchen and baths, 2 newer central air and hot water heater.HAS IN-LAW APARTMENT AND WALK TO THE LAKE.","46609 sqft",299900,"SingleFamily"
1044,2,1,1944,"Location, location, location! Here is your prime opportunity to own this fantastic ranch, equipped with so many perks, just minutes to the water! Here you will find an open floor concept on the main level with a generously spacious living area, a formal dining room, a kitchen that leads to the one car garage, breezeway and oversized enclosed porch lined with windows overlooking the backyard. Gleaming hardwood floors stretch across the main level into each bedroom. The large master bedroom offers vaulted ceilings and a walk-in closet. The 2nd bedroom features a large double size closet. The main level concept is perfect for entertaining and gatherings all year round. The main level bathroom has been recently updated to give you a cozy beachy vibe. For extra space, the lower level has plenty of additional room with electric heat and lots of storage area. Other top notch features include a 2 tier yard with views looking out to the Long Island Sound, a garden area, a patio, new central air system, and a water heater installed in 2017. Conveniently located near I95, schools, shopping centers, restaurants, the local train station, parks and the best beaches West Haven has to offer!","10018 sqft",239900,"SingleFamily"
3255,4,3,1973,"Waterfront living at its finest! Owned by the same family for 27 years, this expansive 3,255 square foot, 4 bed, 2.5 bath colonial sits on 1.26 acres at the end of a quiet cul-de-sac with over 250 feet of frontage directly on the Connecticut River! Take advantage of your east-facing river view and enjoy daily sunrises from your picture-perfect patio, complete with an in-ground pool and hot tub. The open concept first floor features a beautifully-updated eat-in kitchen with gleaming hardwood floors, an enormous island, granite countertops, stainless steel appliances, and STUNNING RIVER VIEWS! The first floor also features two additional living areas, a half bath, and a laundry room. Head upstairs to find an expansive master bedroom complete with a beautifully-updated en suite, two walk-in closets, and a bonus space (currently used as an office) with more amazing river views. Continue down the hallway to find three additional spacious bedrooms and another updated full bath. Want more river frontage? An additional 1.11-acre buildable land parcel with an additional 125 feet of frontage (375 feet total) is available for sale as well! (See 45 Riverview Drive MLS #170362503). Opportunities to own direct riverfront property do not come around every day! This will not last!","54885 sqft",564900,"SingleFamily"
1152,4,1,1942,"Back on Market, no fault of house, buyer neglected to apply for mortgage.   Welcome to this lovely renovated cape style home located on the Trumbull/Bridgeport line with so much character and charm. Main level offers gleaming  refinished and stained hardwood floors throughout, light and bright NEW Eat-In Kitchen with stainless steel appliances and quartz countertops,  NEW bathroom, spacious living room, and 2 sun-filled rooms.  Upstairs boasts 2 additional bedrooms with hardwood floors. Lower level is bright and dry, just awaiting your ideas to turn into a playroom, office, gym, study, family room, lots of possibilities! Updates include 3 yr. old architectural shingled roof, gutters/downspouts and 5 yr. old  energy efficient windows and appliances.    Enjoy the large private, fenced backyard to relax after a long day.  Great location where you can enjoy shopping dining and easy access to highways and public transportation bus lines. Close proximity to New York.  Perfect for a family or Cash Cow for an investor.  IMMEDIATE OCCUPANCY","8712 sqft",299000,"SingleFamily"
3226,5,3,1928,"The historic Blanchard House on Norfolk's ""Victorian Row"" is sited gently above the road just a few blocks from the village center. The home offers over 3,000 sq. ft. of living space with beautiful detailing throughout. There are 5 bedrooms with the possibility of more, 3 full baths, formal living and dining rooms, a sitting room/family room, a first-floor master bedroom, and a stunningly remodeled kitchen with a private side porch. There are also two offices/workspaces making it an ideal work-from-home opportunity. The period detail provides a unifying atmosphere in this commodious home which offers space for family members and guests with room to spare.  There are outbuildings that offer a studio, workshop, garage, storage, and more, making it ideal for artists, photographers, car enthusiasts, woodworkers, and a variety of additional opportunities. The home offers heating by oil, a wood stove, a pellet stove, and active solar (6.6 kilowatts).  The Blanchard House is ideal for year-round living or a weekend getaway for family and friends, with Norfolk's offerings of dining, entertainment, shopping, recreational activities, hundreds of acres of state parks, a curling club, a country club with golf, tennis, and dining, Yale's auxiliary Summer music and art school, Toby Pond for swimming, historic neighborhoods, and skiing choices close by. Norfolk Connecticut ""New England in a Capsule""","12196 sqft",375000,"SingleFamily"
2596,4,2,1890,"The historic Isabella Beecher Hooker House sited on ""Norfolk's Victorian Row"" presents a plethora of memories relating to suffragism as well as period historic architecture beginning at the welcoming open front porch. This rare and unique home offers rich victorian detailing throughout as well as modern amenities. From the winding open staircase in the foyer to the double parlor, library, and dining room, one room draws you into another and then back again, each filled with its own personality. There are up to four bedrooms and a full bath on the second floor, a powder room on the first floor, and a large attic for storage as well as future additional rooms and multiple uses.   A light-filled kitchen just off the dining room also opens to a parking area with a two-stall garage with a large light-filled finished space above making it ideal for a painter, photographer, writer, office, storage, and additional uses.  This well-known home is just two blocks from the historic village center with dining, shopping, and entertainment. The town also offers swimming at Tobey Pond, state parks with trails, historic neighborhoods, a curling club, skiing opportunities a short distance away, and Yale's auxiliary summer campus for music and art. Norfolk Connecticut ""New England in a capsule.""","10018 sqft",359500,"SingleFamily"
1225,3,2,1961,"Light filled, open concept living space in this easy living ranch.  Nothing to do but move in.  Newer kitchen with stainless steel appliances, quartz counter tops and tile back splash. 2 Updated baths. Windows, roof, flooring, septic system and more are recently updated. Fully fenced in yard. Potential to add a garage.  Easy walk to Cadigan Park and Candlewood lake. Minutes to highways, shopping and restaurants.  Lovely area of Brookfield.  Welcome Home!!","21344 sqft",315000,"SingleFamily"
780,3,2,1972,"Very nice recently renovated 3 bedrooms and 1 1/2 baths. Covered deck, new thermopane windows, new propane furnace and new flooring. Move in condition and available immediately. Nice level leased lot. Lot rent is $540. includes water, septic and trash removal. On site parking.   All buyer(s) are subject to park approval. Dog allowed with park approval. Additional $10 per month for dog.","No Data",55900,"SingleFamily"
2028,3,3,1986,"Don't miss out on this immaculate well-maintained home located on a quiet street in the desirable northeast section of Bristol! This beautifully updated home includes an eat-in kitchen with granite counters and stainless steel appliances which is open to a large family room with vaulted ceilings, skylights and a fireplace with wood stove insert which significantly reduces heating costs. The main level also includes a formal dining room with crown molding and wainscoting, living room with built-ins, and a renovated half bath. Newer hardwood floors in living and dining rooms. The upper level includes all 3 bedrooms with newer carpet, including the master suite with a renovated master bath with a tile shower. Off the hallway is a full bathroom with double vanity. There is also a large bonus room on the second level with a cathedral ceiling and hardwood floor. There is an unfinished basement that offers great potential to finish off for additional living space. 2 car attached garage, central air, irrigation system, freshly painted inside and out. Enjoy the outdoor space on the maintenance free composite deck and patio, overlooking a large level lot abutting preserved land. This house has it all including attention to detail throughout, plenty of storage and location!","18730 sqft",350000,"SingleFamily"
3561,4,3,2002,"This home was designed and built with entertaining in mind. The expansive view to the north extends all the way to Selleck Hill in Salisbury and the beginning of the Massachusetts Berkshires. The living room features a cathedral ceiling, wood burning fireplace and wet bar equipped with wine cooler.  The living room is open to the dining room and large cook's kitchen. There are double wall ovens, granite counters, cherry cabinets and a generous center island with seating. When you enter the house from the attached heated garage, there is a laundry room and a full bath off the mudroom. Further down the hall is a cozy den/TV room.  There is a built in audio system with speakers in the living room, master bedroom and den. The master suite is on the main level in a wing of it's own and includes a library, large bathroom and substantial walk in closet  Upstairs are 3 bedrooms and full bath.  In addition, there is a large loft that is perfect for gaming and television viewing. The 3 bay garage is heated and includes a workshop.  The heating system has 5 zones and both radiant heat in the floors and hot water baseboard systems.  Central air and central vacuum. The property across the road from the house is state owned and protected as farmland. Seller is agent related.","87120 sqft",850000,"SingleFamily"
3887,3,4,1985,"Welcome to Cheshire!  This well maintained home sits on a 1.09 acre lot on a cul de sac.  Relax on your large rear deck over looking the level back yard which abuts Ives Farm.  On the roof is an extensive solar panel array to offset your electric energy costs. If you are looking for a 3 bedroom, move in ready home in Cheshire, LOOK NO MORE!!  Lets take a tour.  As you enter the front foyer, you are greeted by cathedral ceilings, which brings you into the two story stairway.  To the right is the study, to the left is the dining room and straight down a short hallway is the eat-in kitchen with a large granite counter topped island.  Opening up to left leads to the oversized 2 car garage and into a separate mudroom and pantry area with second refrigerator, cabinets, counter top & sink.  The open floor plan on the opposite side of the kitchen extends into the great room boasting more gleaming hardwood floors and a massive field stone, wood burning fireplace.  Heading upstairs to the right are 2 large bedrooms with large closets, a hallway linen closet, a laundry room and a full bath with yet another closet, tub and separate shower stall. The entire opposite side of the second floor is the master bedroom suite, complete with reading/sitting area, dressing area with several closets that have automatic lighting and full master bathroom with granite counters, tub and a separate shower stall with dual shower heads.  There is also an adjacent room with door for the water closet.","47480 sqft",649900,"SingleFamily"
4011,4,4,1996,"Beautifully remodeled one owner home.  This home has it all, 2 story entry way, gleaming hardwood floors, newly remodeled kitchen with white craftsman cabinetry, large center island, quartz counter tops and stainless Bosch appliances.  The main floor includes a separate study with French doors.  Newly designed mudroom with wood grain tile, ship lap walls and shelving. The master suite has large windows with remote Douglas shades.  The master bath feels like a spa, with it's heated tile floors, soaking tub and glass enclosed shower with rain shower head. Thee additional bedrooms and newly remodeled hall bath.  There is a finished bonus room connected to the upstairs but also has a separate staircase to the main level.  The lower level is finished and includes a workout room, full bath and separate guest bedroom.  The rear yard is fenced and originally had a pool and could easily be done again. Professional photos and floor plans coming","219106 sqft",719000,"SingleFamily"
2590,3,2,2004,"Welcome to this impeccable, well maintained and lovingly cared for home. Pride of ownership throughout.  Beautiful, bucolic setting in country, yet convenient to major highways and amenities as well as RI and MA.  Hardwood flooring, tile throughout lower level boasting a wonderfully appointed eat in kitchen with granite countertops, plenty of cabinetry and  leading to a generous deck. Upstairs, there is a good sized  master with a sitting area; as well as ample sized bedrooms with plenty of storage/closet space.  Finished lower level perfect for extra space to entertain.  Sit on your beautiful front porch and enjoy the scenery!!  Backyard is perfect for entertaining offering a lovely landscaped yard. There is also an above ground pool as well as a spacious deck.  You do NOT want to miss out on this lovely home!! There is nothing to do but move in!!  Be in your perfect house just in time for summer enjoyment!! Join us at our Open House Saturday 4/17 from 11-1 and Sunday 4/18 from 11-1!!","35719 sqft",349900,"SingleFamily"
3580,4,3,1996,"Custom colonial on 8 acre wooded lot at end of private cul-de-sac. Open floor plan with large kitchen leading to family room with cathedral ceiling, rear staircase and fireplace. Two story foyer with main stairs leads to living room and private study with French doors. Large dining room with chair rail wood work. Master bedroom suite with Brazilian cherry flooring, stall shower and whirlpool tub. Second floor has three additional bedrooms, full bathroom and laundry room. Fully finished walkout lower level has slider to private patio, workshop, storage room and rough plumbing for additional bathroom. Dwelling offers several locations for in home office. Entertain on rear deck with electric awning or relax on large paver patio with built-in fire pit. Bluebird Lane is a private road with annual maintenance fee of $700. Come see this unique home today.","344995 sqft",489900,"SingleFamily"
1692,3,2,1951,"Immaculate 3 bedrooms and 2 full baths cape style home tucked away on a quiet street but still conveniently located close to I-84, Route 8, restaurants and shopping; brand new roof, new vinyl siding with foam insulation under the vinyl siding, new windows, new exterior doors, new furnace, new central air system, updated electrical, new hot water heater, new light fixtures, and all new flooring; the main level features a living room, kitchen with stylish new cabinets, granite counter tops, and stainless steel appliances, dining room, one bedroom and a totally remodeled full bath all on main level; 2nd level features 2 nice sized bedrooms with plenty of closet space and another remodeled full bath; lower level features a recreation/theater room, laundry area, attached garage access, storage and utility room; private and fully fenced backyard with an amazing tri level concrete and stone patio - skilled masonry workmanship - built in stone grill and inground basket ball hoop - perfect for entertaining family and friends; paved driveway and an attached garage; nothing to do but to move into the beautiful completely updated home; low annual taxes; wont last!","5227 sqft",279000,"SingleFamily"
6485,5,6,2018,"LIVING IS EASY IN THIS RIVERSIDE WATERFRONT AT THE END OF CUL-DE-SAC. IMPRESSIVE AND SPACIOUS OPEN RESIDENCE WITH 10' CEILINGS, MAGNIFICENT WATER VIEWS FROM ALMOST EVERY ROOM. THE OPEN FLOOR PLAN ENCOMPASSES A SLEEK, STYLISH GOURMET KITCHEN THAT FLOWS OPEN TO DINING ROOM, FAMILY ROOM AND LIVING ROOM. THE EXPANSIVE LIVING ROOM OPENS UP TO A PATIO THAT OVERLOOKS THE WATER. MASTER SUITE WITH STUNNING WATERVIEW COMPLETE WITH FIREPLACE, LUXURIOUS EN-SUITE AND OVERSIZED WALK-IN CLOSET. THREE ADDITIONAL BEDROOMS ALL WITH EN-SUITE BATHS. LOWER LEVEL HAS ADDITIONAL BEDROOM AND BATH AND A HUGE SPACE FOR PLAYROOM, BILLIARD ROOM, ETC. SQUARE FOOTAGE BREAKDOWN 4415 ABOVE GRADE AND AN ADDITIONAL 2070 IN THE LOWER LEVEL FOR A TOTAL OF 6485. NOT IN FLOOD ZONE.","0.34 Acres",3295000,"SingleFamily"
3157,5,3,1800,"What you've been waiting for -- rare find for this one-of-kind LANDMARK antique property with many modern updates in the HEART OF SOUTH WINDSOR. 3100 sq ft main home with 5 bedrooms and 2 1/2 baths PLUS separate 3 car garage building with 500+ finished square feet and full bath, ideal for home office or business. Situated on prime 1.26 acre secluded lot surrounded by mature landscaping and farm land for added privacy. 3600+ total sq ft of heated living space and 3 1/2 baths. Main home features very open and bright yet VERSATILE layout. Antique charm with architectural detail meets high design blended with INTIMATE living spaces for comfortable everyday living. Ideal set-up for MULTI-GENERATIONAL living with first floor master bedroom wing. Remodeled kitchen with stylish cabinetry, granite counters, and stainless steel appliances. Detached 3 car garage is ideal for a contractor, handyman, mechanic, or hobbyist. Storage galore throughout with ample closet space, full basement, and more. Backyard is your own PRIVATE OASIS with expansive patio, hot tub, and lush landscaping with irrigation. City sewer, private well, central air, newer siding and roof. All of this in sought after brand new ORCHARD HILL Elementary School district and just minutes to Buckland Mall, Evergreen Walk, and I-84.","54885 sqft",439900,"SingleFamily"
835,3,1,1920,"The best opportunity to build some sweat equity in this market with a little work. Located in the Forestville section near shopping, local parks, and easy highway access, this home features wood floors, a detached garage with additional overhead storage, a fireplace in the living room, an enclosed front porch, and a large open back porch overlooking a cleared, level lot.","6098 sqft",129900,"SingleFamily"
975,3,1,1955,"Cute as a button 3 bedroom ranch in Southington (Plantsville).  Beautifully updated kitchen with newer cabinets, stone backsplash and stainless steel appliances.  Updated bath with tile flooring and newer vanity. Hardwood floors throughout. Some additional features include newer windows, roof and siding. Enjoy summer nights with family and friends in this beautifully landscaped yard (with irrigation system) stone patio and above ground pool, . Plenty of storage in the 2 car detached garage and full basement. Solar System in place, bill rnges from 45$ - 90$ per month. Visit today and make this adorable home yours.","12196 sqft",225000,"SingleFamily"
1480,3,2,1923,"Charming spacious 3 bedroom 2 bath home featuring hard wood floors throughout~remodeled bathrooms ~remodeled kitchen with beautiful granite counters ~formal dining room with built in hutch~living room with fireplace~new furnace and hot water heater in 2019","7405 sqft",259900,"SingleFamily"
2852,5,4,1956,"Built By Redding’s previous building inspector Master builder Theodore Dachenhausen , this custom built ranch/cape awaits...this home is privately situated on a three acre rolling lawn with mature landscaping and Magnolia trees. The heart of the home is the family room with vertical beam cathedral ceilings, knotty pine paneling, fireplace and light filled windows. The large 2,300 sq ft above grade living area has a galley style kitchen with custom cabinetry and a sitting area which features a large picture window overlooking the private backyard. The large mahogany wrap around deck is accessed by both the kitchen and dining room, offers beautiful views of the very private rear property and access to a large custom built patio. Down the hall features two full baths, one with a Jacuzzi style tub and three additional ample bedrooms with custom designed walls featuring faux painted and fabric wallpaper. Second floor has a master with full bath, walk in cedar closet and large picture window overlooking the back yard. The lower level is perfect for an au pair suite, a home office or in-law. This bonus area has a large fireplace, bath and kitchen area. The laundry room can be accessed separately by both upstairs and the lower level. The garage features custom built doors.  Redding is an ideal place to call home.  The backyard connects to undeveloped land trust with walking trails.  Come make 83 Limekiln Rd your new home!","130680 sqft",840000,"SingleFamily"
