"AREA","BED","BATH","BUILT","DESCRIPTION","LOTSIZE","PRICE","TYPE"
1248,2,2,1981,"This 1-acre  piece of paradise on a hill overlooking Heser's Pond includes a modest two-bedroom contemporary home that could be  turned into a gem with some updating and attention to deferred maintenance to the exterior, particularly the siding and deck and balconies.  This home would make a great weekend getaway where one could relax on the deck with a drink of his/her choice or even decide to ""wet a line"" and  snag a sunny or perhaps a bass in the pond. The combination living room/dining room has a wall of windows fronting the pond and a slider to the deck.  The large stone, heatilator fireplace is perfect for the chilly winter nights.   In winter when the pond is frozen and local children are skating and playing hockey, it looks like it's right out of a Currier and Ives print  Both second-floor bedrooms have sliders to a balcony that spans the entire front of the house. The second-flour laundry room presently has a side by side washer and dryer, but by installing a stackable one in their place, it might lend itself to becoming at least another half bath.  Another good reason to consider this home is that it is practically around the corner to the Chamard Vineyard and also very close to the Clinton Outlets and the Henry Carter Hull Library.","43560 sqft",259000,"SingleFamily"
1132,3,1,2008,"Nicely cared for & move -in ready Raised Ranch style home with open living floor plan, master bedroom with walk-in closet, 2 more bedrooms and full bathroom on same floor. Lower level ready to be finished, another bathroom possible. This home is situated on a corner lot with lots of open space for gardening and more! Nice deck off the dining area for your outdoor enjoyment with fenced yard! Call today!","51836 sqft",249900,"SingleFamily"
948,3,1,1920,"Fantastic opportunity to own in the desirable Momauguin neighborhood! Just steps to the East Haven beach and shoreline restaurants, this prime location makes it a perfect choice for year round beach community living. As you enter the home, you will instantly notice the living room's vaulted ceiling and skylights. The main floor continues to flow beautifully into the updated kitchen space and dining area. A bedroom and full bath complete the main level. Head upstairs to find two additional bedrooms. The beautiful main bedroom boasts a vaulted ceiling. The home also boasts an over-sized yard, which includes a back deck, screened in porch, and a fenced in backyard. The detached two car garage includes two bonus rooms, great for entertainment and/or storage. Best of all - NO FLOOD INSURANCE!","6098 sqft",264900,"SingleFamily"
1902,4,3,1963,"University Area FOUR BEDROOM home on a quiet cul-de-sac, convenient to everything! The home sits on over a half acre of property with great natural light. The rear of the home faces South, overlooking the large backyard. Offering space on the main floor for formal living, dining and family rooms connected by the recently renovated eat-in kitchen, the home is warm and welcoming for any number of guests. The family room has a wood burning fireplace and sliding glass doors leading to the rear deck. The kitchen features KitchenAid cooktop and wall ovens and Bosch dishwasher. All four bedrooms are nicely sized with the primary bedroom featuring an en suite bathroom and oversized closet. The rear deck overlooking the yard adds to the relaxed flow of the home for soaking in some fresh air while keeping an eye on the kids. An motorized awning covers the entire deck to provide shade on warm, summer afternoons. The windowed walkout basement, at almost 1,000 square feet, provides lots of finished possibilities for a growing family. The home is wired for a generator (not included) to keep the family comfortable and safe when needed. A large shed in back has space for bikes, tools and more. The South facing backyard presents large, level spacing for swing sets, soccer goals, gardens or that in-ground pool you've dreamt of!","24829 sqft",725000,"SingleFamily"
2280,3,3,1964,"Welcome to convenient South Wilton offering a fantastic commute into SONO, Stamford and NYC.  This 3 bedroom 2.5 bathroom Raised Ranch includes, new roof, fresh interior paint,  newly refinished hardwood floors, large rooms, great flow between Living Room, Dining Room (large bay window with window seat) and Kitchen.  Primary Bedroom includes ensuite - 2 additional good sized bedrooms.  Main floor also offers a home office/library for those that are working from home.  Neighborhood includes a great pond to skate on in the winter and canoe/kayak in the summer (voluntary annual association free is $250 for access to the pond).","43560 sqft",599999,"SingleFamily"
2022,4,2,1949,"Situated at the end of a quiet cul-de-sac, in the Mill River Country Club area, is this very charming 2,022 sf Cape Cod home resting on .26 acres. This picture-perfect home with great curb appeal and an attached two car garage features: four generous sized bedrooms -with two being on the main level and two on the upper level, 2 full bathrooms, a sun filled living room with its expansive bow/picture window and fireplace, dining room area, a centrally located kitchen between the dining room area and a generous family room with cathedral ceiling and side entrance. The rear of the home features a fenced in level yard, expansive deck, green grass areas for sport and entertaining and a shed. Lower level is host to the laundry area, an abundance of storage and additional space -just waiting for your finishing touches. Worthy of mention, is the central air conditioning, the newly finished hardwood floors, freshly painted rooms, brand new carpeting in family room, custom drawer and shelf built-ins on the upper floor in both bedrooms, ceiling fan, newly landscaped beds, and the conversion of oil over to gas fuel (tax records are incorrectly noting oil and not updated). Range is electric but home can accomodate a gas range/cooktop. Conveniently located in a great commuter's area, with train station 7 minutes away, 5-minute drive to the Merritt Parkway, walking distance to Mill River Country Club, and short drives to shopping and restaurants.","11325 sqft",4e+05,"SingleFamily"
1944,3,3,1982,"Completely Updated, Spacious Condo-Duplex near the Center of Greenwich. 3 Large Bedrooms and 3 Bathrooms. Modern EIK with granite counter tops and stainless appliances. Possible Mother-Daughter Suite with Separate entries in Basement Unit. Perfect for guest or family member. No condo charges. Off street parking for 2 cars. Fully enclosed back yard for Secure Pets and Children to Play. Entertain with Professional Barbecue and room for an above Ground Pool. Ideal for owners and investors! Schedule your viewing today, before someone else grabs it!","0.02 Acres",758800,"SingleFamily"
1456,2,2,1962,"Knollwood Beach-White picket fence surrounds this lovingly maintained Cape with beautiful, natural gardens. Year round home, One owner occupied since 1962.  Paved brick front walk & driveway. Family room on main level could be used as main level bedroom. 1 full bathroom on main level. 2 bedrooms on 2nd level with 1 full bathroom. Hardwood flooring under carpeting. Newer windows. Newer oil furnace. Newer 30 year roof in 2012. Generac Generator to transfer with home (uses Propane). 3 Mitsubishi air conditioning wall units. Knollwood Beach community offers a clubhouse, beach access, tennis courts, basketball court, playground and picnic tables. Great place for sledding in the winter!","9147 sqft",499000,"SingleFamily"
2612,3,3,2007,"Beautiful 3 bedroom 2 and half bathroom colonial set on a professionally landscaped 1.5 acres, the lightly wooded lot offers lots of seclusion and privacy. The back patio area is great for relaxing in the hot tub or entertaining with lots of space for seating areas, fire pit and access to the enclosed 3 season porch. The main level of the home is warm and inviting starting with the 2-story grand foyer, the floor plans opens up starting with sunken living room which has been updated with a ship lapped accent wall feature, next is the formal dining area with sliding door access to the 3 season room. The stately kitchen with granite countertops, 18' center island with breakfast bar seating, new stainless-steel appliances, large double sink with garden window feature perfect for growing your own herbs. Bonus room on the main floor could be used a home office, den, or kid’s space. Upstairs you will find all 3 bedrooms, and 2 full baths. The master bedroom suite is designed for comfort and relaxation, the attached bathroom offers his and hers sinks, large, jetted tub, and separate shower. The remaining bedrooms are generously sized with ample closet space and share the remaining full bath. The basement is unfinished but offers lots of additional storage and could be used as a home gym or recreation area. Property is close to Rt. 69 & 42, and within 30 minutes to Quinnipiac and Yale University. Call to schedule your showing today.","66646 sqft",560000,"SingleFamily"
1072,2,2,1950,"You will absolutely love this cute two story corner lot home.  Great neighborhood, close to schools, shopping and beaches.  Two large bedrooms, large fireplace in living room with with terrific floor plan. Refinished hardwood floors upstairs and downstairs. Some of the upgrades include, new kitchen with granite counter tops and granite back splash. Brand new stainless steel appliances, new bathrooms, new boiler, new roof, new fixtures. Entire interior freshly painted; new fenced in yard.  Full basement with over size utility sink, new garage door with electric opener. Many more extras. A must see turn key home. Agent owned property.","5227 sqft",289900,"SingleFamily"
2436,4,2,1983,"Come Finish Your Dream Ranch Home on the Water! 1860 SF! 4 Bedrooms! 2 Full Baths! Oversized Heated 2 Car Garage!  Beautiful Custom Kitchen w/ Exposed Beams, Vaulted Ceilings, Skylights, Island & Breakfast Bar!  Open Floor Plan! Master Suite w/ Large Jacuzzi! Newer Septic System & Addition!Large Finished FR!  A Must SEE!","17859 sqft",299900,"SingleFamily"
2128,3,2,1950,"Outstanding spacious ranch that offers one floor living.  Location is perfect as it offers many nearby amenities that include restaurants, shopping, commuter bus and much more.  The living room has plenty of natural light and a fireplace waiting for its new owners.  The 3 bedrooms are located on the main floor and an extra bedroom in the lower level.  This home offers many additional rooms (side porch, huge sun-room with lots of natural light, and a large family room in the lower level).  Schedule while you can!","8712 sqft",299900,"SingleFamily"
3538,4,4,1998,"Welcome to 11 Red Fern Ridge, an entertainer's dream home! Situated in the Forest Crossings development in Huntington Shelton. Home boasts all the privacy of a cul-de-sac yet provides quick access to all the local amenities. As you drive up to the home you'll note the careful attention to detail of the Blue Stone walkway, Belgian Block accents, and gabled roof. Enter the grand 2 story foyer and appreciate the sun-kissed stairs from the oversized palladium window. To your left is a private office and powder room. As you gaze forward you are greeted by an expansive Great Room for entertaining fully equipped with a gas fireplace offering access to the grounds via twin sliding doors. The first floor boasts a formal dining room complete with chair rail and crown moldings. The living room offers high ceilings, Greco pillars, and an overpouring of natural light. The second floor vaunts an expansive master suite detailed with mahogany floors, sitting area, walk-in closet, and gas fireplace. Master bath comes complete with dual sinks, royal vanity, frameless glass shower, as well whirlpool tub with Flat screen TV. The 2nd bedroom is on-suite and the 3rd and 4th bedrooms jack and jill bathroom. Just under 1 acre, the exterior of the home is where you will smile, laugh, and enjoy the brick-paved patio, scalloped shaped in-ground heated pool, complete with an outdoor kitchen. The outdoor kitchen is where you can discover your inner gourmet with granite countertops, gas grill,","41817 sqft",849900,"SingleFamily"
2219,3,2,1900,"Charming Colonial style home in Plymouth! This home features hardwood flooring and natural lighting throughout. Upon entering the home you are greeted by a large family room that is perfect for entertaining! Do you enjoy cooking? Well this kitchen is equipped with all stainless steel appliances and an island. Share your creations from the kitchen in the dining room large enough to fit dinner parties, and is still intimate for everyday dining. Kick your feet up and relax in the living room that has natural lighting pouring in from the many windows. This home also features updated 1.5 bathrooms, and 3 spacious bedrooms. The finished attic provides ample storage space as well as 2 additional bonus rooms that can be utilized as an at home office, play room, or distant learning area. Enjoy your morning cup of coffee on the ample sized front porch! Do you enjoy outdoor entertaining? Well this deck is perfect for grilling and soaking up the sun! The detached 1 car garage provides even more storage space. This home is conviently located to stores, restaurants and shopping.","16117 sqft",240000,"SingleFamily"
1104,3,2,1960,"Ranch style single family home on a corner lot in Bridgeport's North end. Three bedrooms, updated kitchen and bath. Close to restaurants, medical building, hospital, walk to bus line, convenient stores and more. Agent /owner","6534 sqft",315000,"SingleFamily"
1326,3,2,1919,"This Old Style single family home has 3 bedroom/ 2 full bathrooms with a cozy front enclosed porch and charming front door entrance. Walking into the home you are greeted with a warm foyer and stairs to the upper level with sight line through the kitchen and to the glass back door. Living room is on the right off the foyer and dining room off of the kitchen. Back door leads to fenced back area fully paved. No yard maintenance with plenty of space for outdoor furniture to enjoy the warm weather. Craftsman dream project with plenty of wood trim waiting for some TLC. PRICED TO SELL. Furnace is 9 years old. Selling home as-is. Take a look and see the potential! Book your showing in ShowingTime and contact listing agent for questions.","3484 sqft",175500,"SingleFamily"
2205,4,3,1900,"This brick Victorian rowhouse is the perfect urban home. Magnificently renovated by designer owner who has created an impeccable, stylish city residence. The main level of living space is a great open area with a high end fully integrated cook's kitchen, architect designed cabinetry, 6 burner stove, and quartz countertops. On the same floor is a dining and or living area and half bath, all with tall ceilings, excellent light, and wood flooring. The second level offer two good size bedrooms and a stunning new completely renovated full bath with a soaking tub, Italian vanity, and lots of charisma. All fixtures in the house are designer quality. The third level has two more bedrooms, a newly constructed full bath and a delightful, efficient study. The very top floor has two additional rooms perfect for a study, playroom, or guest room. Wonderful, beautifully landscaped private fenced secret garden feels like a calm oasis. The house location can't be beat: close to Yale, lots of cultural events, Town, neighborhood markets, cafes, and shops. This house is truly spectacular and is a joy to behold!","2613 sqft",749500,"SingleFamily"
2589,4,4,1950,"Contemporary Elegance Wells Hill Road - Designed beautifully for todays living this Litchfield county home on over four acres offers room to breathe, room to live and room to play! The screened in porch and bluestone patio lead you to a heated salt water pool. This 9-room home with 4 bedrooms and 3 ½ bathrooms has been renovated to perfection. The open gourmet kitchen, dining and living room with a woodburning fireplace are filled with natural light. This home offers a first-floor primary suite, a detached barn/garage with an office/studio on the 2nd level truly making this property a wonderful oasis yet within minutes to the villages of Lakeville and Salisbury, Ct.","205167 sqft",2345000,"SingleFamily"
1707,3,2,1900,"LOCATION!!  Minutes to Metro North, Stratford Center dining and all major highways.  Due to condition, the possibilities are endless!  Over 1,700 sq feet of above ground living.  Fireplace in living room, main level bath. 3 bedrooms, full bath and walk-up attic on 2nd floor.   Town records indicate new roof and new furnace in 2010.  Home needs complete rehab and will not qualify for conventional financing.  Private, level lot, dead-end street.  Great opportunity to live in-town and enjoy all of what Stratford offers!  This property is an estate, therefore no disclosures, sold ""as is"".","6969 sqft",189000,"SingleFamily"
3327,3,4,1996,"Lots of Detail and Charm went into this Custom Built Victorian Colonial Home Situated on Professionally Landscaped 2 Acre Level Corner Lot with Perennial Garden Beds, Fruit Trees, Stonewalls and Patio with Builtin Stone Grill and Fire Pit. Hardwood Floors Throughout Boasts lots of Built-ins including Floor to Ceiling Bay Areas in Living, Dining Areas, Master Bedroom and 3rd Bedroom with Large Windows to Allow for lots of Natural Sunlight. The Galley Kitchen has Ample Counter Space and Cabinets, Full Pantry. Right off the Kitchen You'll Enjoy the Convenience of a Large Breakfast Nook, Half Bath with Laundry / Mud Room. Great Room offers a Wet Bar area that can easily be Transformed into a Main Level Master Bedroom Suite. Partially Finished Basement Provides a Wonderful Recreation & Media Room or Home Theater with Full Bathroom for Entertainment PLUS an Additional Area for Storage & Home Gym. Lots of Parking for RV / Boat with a 3 Car Detached Oversized Garage.  Truely a Must to See!!! THIS HOME IS NOT A DRIVE BY in this Well Saught After Area of Harwinton.   .","87120 sqft",519900,"SingleFamily"
2021,3,3,1965,"*2nd CHANCE* Welcome home!! This charming 3 bedroom 2 1/2 bath colonial is located on the Portland/South Glastonbury line on a quiet cul de sac. The updated kitchen offers granite countertops, plenty of counter and cabinet space and tile flooring.  The dining room is perfect for family gatherings.  The spacious front to back living room has a large picture window with window seat perfect for reading, built in bookshelves, wood burning fireplace and crown molding.  The bright family room offers a Vermont propane stove to relax in front of on cold New England nights.  The family room leads to a large deck overlooking beautiful gardens and a pool area.  The master bedroom has a walk-in closet and an updated bathroom with a tiled shower. The 2 other bedrooms have hardwood floors and plenty of closet space.  A full bath with tub finishes the upper level.  The updated partially finished basement makes for the perfect playroom.  Above the garage you will find a walk-up attic with plenty of storage space.  Hardwood floors and crown molding throughout the home adds to it's charm. Close to local farms, restaurants, walking trails and Cotton Hollow Preserve. Make 20 Grace Lane your forever home today!!","23958 sqft",354900,"SingleFamily"
4433,4,3,1820,"Conveniently located in the heart of downtown Greenwich, this renovated and expanded home is close to Greenwich Avenue’s renowned shopping and restaurants as well as Whole Foods and Starbucks. The house offers a great combination of open layout for coming together and rooms to find sanctuary. A fantastic 2nd floor master suite complete with WIC, balcony and a luxury bathroom. The lower level would make a great media room and/or gym. The third floor boasts a great playroom/bonus room. There is also a nice sized yard and detached garage. With over 4,400SF and so close to town, this is rare home in Greenwich that is not to be missed.","5227 sqft",2595000,"SingleFamily"
1824,3,2,1968,"Split style home with 3 bedrooms,2 baths, 2-car garage at 0.48 acre of level lot.  New roof (2018), vinyl  siding (2012), newer 2 bathrooms and some new windows. Central A/C, city water and city sewer. Possible in-law apartment with separate entrance in lower level. Sought after location, close to major roads, shopping malls, schools. Coming to the market on 4/21, Weds.","20908 sqft",309900,"SingleFamily"
2223,3,3,1934,"Waterfront home full of New England seaside charm! Located on Palmer’s Cove with over an acre of land, you will feel like you are on vacation every day with stunning views and direct access to incredible shoreline amenities. Once inside, you’ll find beautiful details throughout the completely remodeled home. Open main living areas feature crown molding, space for entertaining, and oversized windows for ample natural light. The gourmet kitchen features a large center island, stainless steel appliances, and beautiful cabinetry. The sunroom is sure to be a favorite spot to take in panoramic views of the water. On the other side of the home, a cozy living room with exposed wood beams creates a quiet retreat. Also on the first floor is a bedroom and full bathroom for one-level living. Upstairs, a sitting room at the top of the landing provides space for an office, and two generous bedrooms are complete with their own walk-in closet and ensuite bath. Outdoor living will also delight, with a new expansive cedar deck. Sit and relax while you enjoy the views, or head out to the water from your private dock. With direct access to Fishers Island Sound and hiking trails from the property, wake up and begin your adventure when you please! The property also features a 400 sq ft barn with electricity and water, ideal for a guest house, studio, or workshop. Located near Noank’s beaches, restaurants, and shops. Added bonus: no flood insurance! Schedule your showing today!","51836 sqft",950000,"SingleFamily"
3887,5,5,1955,"Totally renovated, top to bottom, this 5-bedroom charmer has an easy/open layout with hardwood floors, wonderful natural light and fresh/modern finishes throughout. All new windows, doors and high-efficiency mechanical systems. Beautifully renovated bathrooms, brand new eat-in kitchen with premier appliances. Separate bedroom suite on the 2nd floor, plus a finished walk-out lower level add a surprising amount of ''getaway'' space. Set back from the coveted Mid-Country lane on nearly 2 acres, this fenced property offers privacy and lovely outdoor play space. Full-house generator, 3-car garage.","1.88 Acres",2695000,"SingleFamily"
4430,4,5,2002,"Welcome Home to this wonderful, Classic Colonial with a lovely Open Floor Plan and a lightly wooded, level backyard in desirable Ledgebrook Estates subdivision. This home is well maintained, freshly painted and has many lovely features to it. This home consists of 4 bedrooms, 3 full baths and 2 half baths. The kitchen has plenty of sunlight coming in with a center isle and spacious cabinet space and pantry and a large dining area. The formal living room has custom built ins and lovely hardwood floor, and crown molding. The formal dining room has hardwood floor with a walnut inlay, crown molding, chair rail and raised paneling. The master suite has a dressing room, a very large walk in closet and a 17 X 10 master bathroom. The other 3 bedrooms are generous in size and has a hallway bathroom and there is also a Jack N Jill full bathroom. There is also a full, walk up attic. The basement is fully finished with a walk out and has a rec room, an office with built in desks and a media room with pocket doors.  For your convenience, the laundry is on the 2nd floor. Home is conveniently located with easy access to highway, schools, shopping areas, great restaurants and the CT Wine Trail is close by. Be a part of this wonderful community, Southbury is known for it's excellent schools. Close proximity to Hartford, New York and Boston.","64468 sqft",699900,"SingleFamily"
3756,4,4,1900,"South Cheshire at it's best, This stately historic Colonial  is nestled up on the knoll of South Brooksvale Road, From the front porch enjoy the view across the street  of Cheshire land trust property.  Enter this home from the front porch to a welcoming  2-story entry.  The first floor includes an updated eat-in  Kitchen with custom cherry cabinetry, Gibraltar counter tops, large Island with prep sink, 5 burner gas range, double ovens, separate laundry area with cabinets; Living room features coffered ceilings, wood burning fireplace with large mantle, over-sized windows, French Doors to the sun porch;Office with built ins and  wainscoting;Dining room also has built in storage, wainscoting and large windows. Family room boasts a propane gas log fireplace with hand-carved mantle, French doors; the second floor has 4 bedrooms with hardwood floors and 3 full baths,including a master bedroom suite, its own sitting area, walk in closet, oversize en-suite bath with double vanity sinks, steam shower and jetted tub;3 additional bedrooms,2 additional full baths including a  “Jack and Jill” bathroom.The oversize Sun porch stretches across the back of this home ~Over-sized deck ~perennial gardens, stone walls, large lawn area for entertaining~Gutter Helmet with heat cables on the second story~Leaf Guards on first story~2-275 Oil Tanks~ 4 zone Oil Baseboard Heat~City Water~Septic~Propane for cooking&Fireplace~ Historic District~Easy Commute to Merritt Parkway and 91~","80150 sqft",449900,"SingleFamily"
