"AREA","BED","BATH","BUILT","DESCRIPTION","LOTSIZE","PRICE","TYPE"
1564,3,1,1950,"MUST SEE! MOVE IN READY! THIS UNIQUE 1,564 SQ FT,  3 BEDROOM 1 FULL BATH RANCH STYLE HOME IS LOCATED IN A VERY PRIVATE AREA IN MIDDLETOWN IN A CUL-DE-SAC,  CLOSE AT THE SAME TIME TO THE I-91. FRESHLY PAINTED, VINYL SIDDING, NEW HARDWOOD FLOORS. TAKE DELIGHT IN THE BEAUTIFUL KITCHEN WITH NEW GRANITE COUNTERTOPS, NEW SINK AND STAIN STEEL APPLIANCES. PROVIDING AMPLE SPACE WITH A LARGE OPEN FLOOR PLAN, A GORGEOUS BRICK FIRE PLACE WITH A NICE VIEW THROUGH ALL THE WINDOWS. LARGE MASTER BEDROOM  AND THE  2ND BEDROOM ALSO WITH A GOOD SIZE AND SPACIOS CLOSETS, THE LAUNDRY IS ON THE MAIN LEVEL, ALSO NEXT TO AN OFFICE SPACE AREA. IT HAS CENTRAL AIR, UNFINISHED BASEMENT CONNECTED TO THE 2 CAR GARAGE AND ALSO IT COUNTS WITH 2 DRIVEWAYS, A GOOD SIZE SHED AND A NICE BACK YARD,  HALF OF ACRE, JUST MOVE RIGHT IN!!! PRICED TO SELL!!! VERY LOW TAXES $3,602.84, THIS INCLUDES WESTFIELD FIRE TAX DUE ANUALLY EVERY JULY,  AND IT WILL WORK FOR ANY TYPE OF LOAN, ( DINNING ROOM OR SUNPORCH CAN BE UTILIZED AS A BEDROOM) (3RD BEDROOM CONVERTED TO DINING ROOM, YOU COULD REVERSE TO A BEDROOM OR BIG SUNROOM)  PROPERTY HAS CAMARAS!!!  PROPERTY TAX $3,448.00 + FIRE ANNUAL  TAX $154.84 TOTAL $ 3,602.84","30056 sqft",225000,"SingleFamily"
800,2,1,1949,"Handyman Special! Come take a look at this adorable Economy style cape! The home has 800 Sqft and features 2 bedrooms and 1 Bathroom! Bring your eye for design, and come see how you can turn this into the home of your dreams! Fantastic opportunity for an Investor or Owner Occupant.","6969 sqft",85000,"SingleFamily"
4540,5,4,2001,"WATERFRONT SANCTUARY ~ This private seaside retreat in an idyllic setting high above Long Island Sound is a rare opportunity to own a truly unique and special property that offers tranquility and inspiration with its sweeping views of the sea and speciality trees, perennial gardens, and abundance of nature on 1.36 acres of direct waterfront. Begin your day with the sun rising over the water in front of you on your balcony in your MBr suite high above LIS, take in the sunlit days on the expansive deck watching the sea sparkle, and wind down your evening with a glass of wine in the gardens with the moonlight dancing on the water in front of you. Beautifully designed, this classically elegant 4500 sf/5 BR/3.5 bath shingle style home was built by renowned Lyme craftsman, Skip Broom, with superior construction, distinctive detail and ever-changing scenery from each room. Sunlit living spaces open to the nature around you, inviting both relaxation and entertaining while a separate studio building with its performance-level cork floors and 360 degrees of windows are perfect for yoga, dance, meditation, art, music, or an office.","59241 sqft",2800000,"SingleFamily"
2347,4,3,1950,"Great Convenient Location- Updated 4 bedroom and 2.5 bath Cape/Colonial Style home with Hardwood Floors throughout.  Spacious Living Room with lots of room for Entertaining, Dining Room was Freshly Painted, Kitchen with Pantry, Cozy Den, 4 Spacious Bedrooms on the 2nd floor with Newer Bath, Lower Level has Playroom/Media Room, Office, Laundry Room and Full bath-  Great for Entertaining, Mancave, Teen Hangout etc..  The Outdoor Space includes Large Deck, Carport and Upper Deck with Plenty of Paved Parking make this a Great Place to Call Home!  There is a RING Doorbell and Camera System in Place. HIGHEST AND BEST BY MONDAY- APRIL 19th at 12 NOON- thank you!","4356 sqft",343000,"SingleFamily"
1624,3,2,1950,"Amazing Unionville location across from Farmington River!!! Unionville center, bike path/hiking trail, schools, restaurants, mini golf and fun community seasonal events, all within walking distance! This adorable Ranch features a living room with hardwood floors and cozy fireplace and leads into a sunny eat-in kitchen. Main floor also features a full bath, 3 bedrooms and a separate sitting room/den off the master bedroom. Enjoy an additional 400 SF of living space in the lower level, perfect for a family room or rec room. Lower level also has a half bath. Enjoy all that this home and the town of Unionville has to offer! Tour today!","10890 sqft",249900,"SingleFamily"
9665,6,8,2017,"Better than new! This spectacular recently constructed home has been taken to the next level. Perfect combination of traditional and transitional exterior combined with a chic interior provides seamless flow. Near town, within private, and quiet Calhoun Drive Association with huge useable yard and pool. Dramatic double-height central foyer leads directly to formal and informal areas, all finished and decorated to the highest standard. Open plan kitchen / family room is at the heart of the first floor and is flanked by a large mudroom and butlers' pantry. Ultimate bi-fold doors offer access to the bluestone paved deck with firepit and built-in grill. The flat yard has been enlarged with new stone walls as well as upgraded with deer fencing and new landscaping that further encloses the year-round pool with retractable cover and spa.  The second floor features a large master suite including his / hers closets and a sitting room / office area.  Four further ensuite bedrooms, as well as, laundry room, complete the second-floor layout.  Dramatic light-filled second stairway connects to lower level with a huge playroom, media room, 6th bed / bath, sauna and gym. Square footage includes bonus space on third floor and finished lower level, for a total of 9000+ sq. ft. A three-car garage and whole house generator round out this gracious home.","56192 sqft",7250000,"SingleFamily"
1649,3,2,1986,"This is not your average Raised Ranch! Meticulously maintained with large addition in 2008 which added a 2 Car oversized Garage, Master Bedroom Suite, and Living Room to make this custom home shine! New 35 foot composite deck added in 2020 with vinyl railings adds to the outdoor amenities of beautiful stone walls and outcroppings that surround the home which give it privacy and visual interest. There is a working waterfall and pavilian area as well as lots of low maintenance annuals that bloom at different times for each season. Inside, there is an updated kitchen with huge pantry closet and Convection oven along with open concept dining area. Light and bright living room with oversized 5x8 picture window to enjoy the sunrises along with a french door with side panels that open overlooking the deck. Lower level has additional bedroom, loads of storage and could be converted to extra living space. Nothing to do here but move in as everything has been updated...roof, vinyl siding, Pella windows, well components, hot water heater...the list goes on and on! Schedule your showing today, showings start on Friday, April 16th!","26136 sqft",295000,"SingleFamily"
2624,4,3,1978,"Located 90 Minutes outside of NYC, this Connecticut Colonial is sited on a park like 2+ acres. Unmatched craftsmanship is evident in the masonry as you drive up the gated entrance, past the tranquil waterfall and arrive at the stunning tiered yard which has been thoughtfully crafted and perfected over the years. From the beautiful stone patio and pergola, perfect for outdoor entertaining, to the pool SITE which could also house a play space, perfect for soccer or any outdoor activities, this is not your ordinary yard, but truly an oasis. Meander to the side yard where the raised garden beds will be a favorite location for the gardener in your life. Inside, you will find an open concept family, kitchen, dining room, complete with a cozy stone fireplace. A vaulted ceiling that adds drama and a coffee/wine bar with drink fridge combine to make this a perfect spot for gathering. The main floor also boasts an office with a SECOND rustic style fireplace as well as a half bathroom. Upstairs, you will find four generous sized bedrooms each featuring hardwood floors. The master bedroom not only has a full bathroom with double sinks but also includes access to a private deck overlooking the yard, a perfect spot for reading or relaxing.  The three other bedrooms share the second full bathroom on this level with an updated shower with glass door.  The partially finished lower level has potential for many uses plus houses the THREE car garage. Set up your showing today!","93654 sqft",499000,"SingleFamily"
1080,3,1,1944,"This well maintained 3 bedroom cape is waiting for you. It has an eat in kitchen, tile flooring, all appliances remain.   Fireplaced living room, with a bow window, and wood floors.  Dining room has sliders to a covered deck that leads to a level back yard. The tandem garage leaves plenty of room for you. Owners park a truck and a car in it  It also has a work bench area for the person that likes to dabble. First floor bedroom that is generous in size. and two bedrooms upstairs with plenty of closet space. Lower level has a finished rec-room. and a laundry area. Hatchway for easy access. Central air is just another plus! This home is conveniently located near many amenities that Manchester has to offer. Schedule  a showing today!","9147 sqft",182900,"SingleFamily"
5392,4,4,1750,"Old world charm married with today’s modern amenities, this Georgian Colonial has it all including a amazing, separate modern guest house/in-law suite! There is also a bonus third property set up as a full functioning workshop with 200-amp service and exhaust system, a gym room and a storage area. The property boasts 5000 sq.ft. total with 7 fireplaces, central air, central vacuum, a new heating system, new stand-by whole house generator and a modern, chef style kitchen. The main house has 3 large bedrooms and 2.1 baths including a master suite and a second-floor laundry room! The 2cd house has 1 bedroom with 1 bath and bright, sunny open concept kitchen/living room. Throughout the main home the rooms are generously sized and there is a one car garage is under the main house. This is truly a spectacular one-of-a-kind property! Coming soon!! Professional photos coming soon.","7405 sqft",349900,"SingleFamily"
1482,3,2,1989,"COUNTRY GETAWAY OF A LIFTIME…Nestled in the hills of Barkhamsted this lovingly maintained home is waiting for you. Nothing to do but move in.   Built in 1989 and located on 2 acres on a very private road this home was designed for comfort living.  Sunlit rooms are accentuated by gleaming hard wood floors throughout.  Walking in the front door you are greeted by a large living room with a vaulted ceiling and a fireplace to keep you warm on those cold winter months. The living room opens to a dining area that overlooks a private back yard.  Master bedroom boasts a private bathroom, with 2 more larger bedrooms.  Enjoy your morning drink or family cookouts on the spacious covered deck wile listening to the sounds of nature.  Recent updates include 200 AMP electric, newer furnace, windows and added insulation for maximum energy efficiency.  Wide open basement can easily be finished or used for home projects or hobbies. This property is AMAZING!","87991 sqft",362000,"SingleFamily"
6802,6,6,2006,"COMPO BEACH LOCATION!  In the heart of a most coveted Westport location, overlooking the 3rd fairway of Long Shore Golf Course with winter views of Long Island Sound, sits this gorgeous 6-bedroom home. 18 Manitou Road is perfectly sited amidst a backdrop of lush landscaping and manicured grounds. Sparing no expense, this home was reimagined and renovated in 2006 and has a recently refreshed palette. Step inside the double-height entry to find elegant indoor and outdoor spaces that flow seamlessly. With quality millwork, high-end fixtures, and finishes throughout, the main level living spaces are vast yet comfortable. The thoughtfully designed kitchen features a Wolf 6 burner range and double ovens, two sinks, plenty of prep space, a warming drawer in the center island, separate desk workspace, butler’s pantry, and a walk-in pantry. Generous work and lounge spaces include a fabulous living room with floor-to-ceiling stone fireplace, billiards room with built-in bench and adjacent playroom with loft. The primary bedroom features a dressing room flanked by two walk-in closets, a gorgeous bath, and French doors leading to a balcony with plenty of space for seating around the built-in stone fireplace. Walk to train, tennis, sailing, golf, and bike to Compo beach from your sanctuary.","39639 sqft",3295000,"SingleFamily"
2160,4,2,1932,"Here is a chance to own an antique home with authentic charm in the center of Orange on a level, open lot with plenty of driveway around the back for the cars. From the open lazy porch to the gardens, this gem is a typical Connecticut Farmhouse. The huge living room and dramatic staircase help preserve this vintage style property. With city water, newer furnace and a redone septic in 2004 this four bedroom home is very desirable. The kitchen has a tin style ceiling and all the rooms have hardwood flooring. An open feeling on both floors, just needs a little TLC. This home has been in the family for generations!","22651 sqft",485000,"SingleFamily"
2351,2,2,1953,"A picture-perfect Ranch home set in a lovely, quiet neighborhood tucked between CCSU and Stanley Golf Course and bordering West Hartford and Newington.  So much to love about this home with fabulous curb appeal, a remodeled kitchen with white cabinets, glass tile backsplash, new stainless appliances, hardwood floors, freshly painted and a 1 car attached garage with direct access into the kitchen to carry your groceries. Don't let the 2-bedroom label fool you. There are surprises around every corner. With 2 bedrooms on the main level, the master bedroom is oversized and could easily fit 2-3 beds. The bonus feature of this home is the fantastic walk-up attic and finished space with hardwood floors that could be used as a 3rd bedroom. Currently unheated but highly functional with plenty of head room to use in a variety of ways. You will find more bonus space in the heated lower level with a family room, fireplace, a full bath and yet another heated room for a potential 4th bedroom or office space. The lower level is a walk-up-and-out to the flat backyard. There are so many possibilities in this home to function to your needs. You really need to see it to believe. Truly a fantastic location minutes to the highway, local grocery store and West Farms Mall, 10 minutes to downtown Hartford. Stroll through the neighborhood over to Stanley Quarter Park or Stanley Golf Course.","14810 sqft",225000,"SingleFamily"
8996,6,7,1964,"Extraordinary 5.63 acre private oasis boasts sundrenched 6 bedroom Contemporary built in Frank Lloyd Wright style overlooking tranquil pond, ideal for fishing and non-motorized boating. With pool, tennis court, putting green and apartment. Showcases water views from walls of windows, doors in most rooms, vaulted ceilings, 2019 chef's kitchen with fireplace, newly painted interior and 2020 roof.  Features stunning wood cabinetry in family room, expansive dining room open to great room with stone fireplace, screened-in porch and glass/stone studio. Offers main level master suite with his/her baths, sitting room with stone patio; three bedrooms and full bath. Second floor affords sweeping views of property; second master suite with den, deck, fireplace, baths, walk-in closets and bedroom.","5.63 Acres",5200000,"SingleFamily"
4558,4,4,1996,"Old Stonewall estates welcomes you to one of the most coveted locations in Easton.  With over 6 acres, this home sits off the road on a picturesque cul-de-sac offering a quiet escape.  This center hall colonial offers all the right spaces to live, work, and entertain. Crown & dental moldings, chair moldings, transom windows, french doors enhance this open concept layout. The first floor features an abundance of natural light, two-story foyer, hardwood floors throughout, formal LR w/fireplace, formal dining room, chef's kitchen offering stainless appliances, cooking island, granite and dining area. Kitchen opens to vaulted, beamed family room w/soaring stone fireplace w/french doors to expansive sunroom. Perfectly located first-floor office offers the quiet space for today's lifestyle. First floor laundry room completes the main level. The second floor; retreat to the master bedroom suite, tray ceiling w/full bath, addt'l bedroom w/full bath & 2 bedrooms & hall bath. Lower level includes living area, full gym, organized closets & overall storage with access to 3/c garage. Spacious mahogany deck enhanced with stone walls allows for outdoor privacy with plenty room for a pool.Recent updates; roof, A/C condenser, freshly interior paint just to name few. Convenient to all amenities, Merritt Parkway, route 25, train, I95. A truly well-maintained home that soon can be yours!","288802 sqft",879000,"SingleFamily"
1670,3,3,1965,"COME FIND PARADISE IN THIS BEAUTIFULLY UPDATED RAISED RANCH! LIVING ROOM WITH PELLET STOVE , BEAUTIFUL CABINETRY AND COUNTERS WITH BACKSPLASH IN KITCHEN WITH ISLAND AND BREAKFAST BAR. MAIN LEVEL FEATURES A FORMAL DINING ROOM, LIVING ROOM AND 4 SEASON SUN ROOM, MASTER BEDROOM WITH FULL BATH AND TWO MORE BEDROOMS AND  FULL COMMON BATH. LOWER LEVEL FAMILY ROOM WITH FIREPLACE IS PERFECT FOR COZYING UP ON CHILLY DAYS. DEN/OFFICE OR POSSIBLE 4TH BEDROOM AND HALF BATH AND CEDAR CLOSET. THIS HOME IS UNIQUE BECAUSE IT HAS A SUN ROOM (ADDL 192 SQ FT) AND A SCREENED PORCH (ADDL 192 SQ FT). THE BACKYARD FEATURES AN ABOVE GROUND POOL AND PLENTY OF SPACE TO HOST BARBEQUES. ADDITIONAL PARTICULARS ARE HARDWOOD FLOORS, ,CENTRAL AIR, CENTRAL VAC, NEW ONDEMAND HEATING SYSTEM,SOLAR PANELS, ATTIC WITH THERMAL BARRIER INSULATION,NEW FRONT DOOR, NEW WASHER DRYER, NEW SHUTTERS, NEW FIRE PIT, NEW MICROWAVE, NEWER DISHWASHER, OVERSIZED SHED FOR STORAGE. LOCATED IN THE PLEASANT VALLEY SCHOOL DISTRICT. ALL PUBLIC UTILITIES WITH CITY SEWER/WATER AND GAS HEAT. TRANQUIL SETTING BUT EXTREMELY CONVENIENT TO AREA SCHOOLS, SHOPPING MALLS AND HIGHWAYS.","21780 sqft",339000,"SingleFamily"
3591,4,3,1990,"ONE OF THE BEST LOTS in the highly sought after Minnechaug Village neighborhood. This stately Colonial has a beautiful, large trex deck overlooking a level yard that backs up to woods with a golf course beyond. A Chef's Kitchen offers a large center island, granite countertops, bar area, all stainless steel appliances including a beverage refrigerator, and custom cabinetry. The Kitchen is open to a spacious Family Room with a cozy gas fireplace and hardwood floors. The Living Room and Dining Room have hardwood floors as well, accented by inlaid wood. An open floor plan makes this home perfect for entertaining! Upstairs are four generously sized bedrooms. The Master Bedroom Suite boasts a vaulted ceiling, two walk-in closets, and a jacuzzi in the Master Bathroom. The finished lower level provides an additional 850 sq ft of living space. Other fabulous features of this special home include irrigation system, vinyl siding, 1st floor Laundry Room, Roof 2015, Furnace 2011, 2 story foyer, cedar closet, and the trifecta...public water, public sewer and natural gas! The community offers a golf course, tennis courts, club house, and basketball court. Easy access to highways 384, 84, 91, and Route 2!","16117 sqft",590000,"SingleFamily"
2865,4,3,1987,"This is IT! The PERFECT home nestled at the beginning of this highly coveted Orange, cul-de-sac. You've admired this sweet colonial with its professional landscaping, shutters & high gloss bright yellow door for years - now it's available for sale!  This grand home has been impeccably maintained by the current owners. The location simply cannot be beat, close to rte. 34, the Meritt pkwy, and the convenience to all the amenities Orange has to offer.  From the moment you walk in, you will notice the large light filled rooms which are great for entertaining.  A custom floor plan, 2 gas fireplaces, family room, Living room, Dining Room, Large kitchen with large center island w/seating, upgraded appliances, a large separate breakfast nook make meal time a dream, screened porch,  Large master suite with additional unfinished space, 3 more spacious bedrooms on the second floor, Large walk-up attic for possible future expansion, 2.5 baths, large deck with pergola and an above ground pool and hot tub. Large level yard with shed and electric pet fence. ***The exterior of the house is scheduled to be painted, and the pool deck will be completed before closing****.  Agent related to owner.","41382 sqft",799900,"SingleFamily"
2126,3,3,1998,"Enjoy the natural lighting throughout this pretty colonial in sought after Birch Mountain Subdivision.  A fabulous large kitchen with granite counters, stainless steel appliances, breakfast bar and a light filled eatin kitchen area surrounded by glass french doors and windows look out on a flat backyard. An open floor plan between kitchen and family room with a wood burning fireplace adds to the convenience of being part of the group while entertaining and keeping an eye on all the activities! The family room is also open to an additional sitting room perfect for a home office or quiet den and there is a formal dining room. A second entry in front of the house gives easy access to the mudroom area, 1/2 bath and laundry. Upstairs master bedroom has a private ensuite bath and his and hers closets. Two more good sized bedrooms and a full bath are located upstairs. Additionally, there is plenty of space in the partially finished lower level for a recreation room, workout equipment, game tables or another area to play in! Two car garage, central air, lots of hardwood floors and move in condition make this house a great find in our limited inventory market!   HIGHEST & BEST OFFERS DUE SUNDAY APRIL 18 AT 6 PM","25700 sqft",349900,"SingleFamily"
1350,4,1,1952,"Mill Hill Area, Cape w/4 bedrooms 1 full bath. Hardwood floors on Main level. Basement partially finished, fenced in yard, detached garage, close to the highway, shopping, hospital, school and Public Transportation. Close to Stratford line. Tax records show 3 bdrms. Buyers due your own diligence.","5662 sqft",234900,"SingleFamily"
2560,3,4,2013,"If you have been looking for the perfect blend of new and old, history and modern updates, the “Ash House'' could be your next home. The original c.1732 saltbox colonial was carefully dismantled and rebuilt with brand new post-and-beam construction on its new location, a 2.5 acre parcel on one of Mansfield, Connecticut's “scenic roadways.” Completed in 2013, this “new antique home” features a central chimney with 4 working fireplaces, one with a Hearthstone Wood Stove, double-drainboard cast iron farm sink, period wood molding throughout the home, an antique claw-foot tub, and a pristine dry-stone foundation. Boasting original wide pine floorboards, antique hardware, doors & stone, the home also has a built-in corner hutch with scalloped shelves, a sought after detail from the time period. The first floor has a spacious eat-in kitchen complete with exposed beams, dining room, mudroom, 3/4 bath with laundry, living room and family room/study. The second floor features the gorgeous master bedroom with ensuite bath and 2 other spacious ensuite bedrooms. Other interior features include: “Beehive” bake oven, built-ins, walk-up attic, and a 6-zoned propane heating system via radiant heat. Exterior features include: Stone patio, enclosed garden area, tasteful shed with copper weathervane, stonewalls, perennials and views of the neighboring pond. All this conveniently located 5 mins from UConn’s campus and Downtown Storrs, and within Mansfield’s award-winning school district.","108900 sqft",435000,"SingleFamily"
2406,3,3,1989,"Farmhouse colonial with inviting front porch and recently renovated gorgeous kitchen with center island, built-in appliances, and an eat-in area overlooking a back deck and a level yard.  Lots of space to work from home including a good-sized dining room with fireplace overlooking the front porch, main level office, and a 16 x 23 great room with hardwood floors, 9' ceiling, and a fireplace.  The upper floor provides three bedrooms, one with a vaulted and beamed ceiling, and a master suite with a fireplace, hardwood floors, a walk-in closet, and an updated master bath.  Many recent upgrades including the first-floor half bath and a huge first-floor laundry room.  Centrally located between Woodbury and Watertown town centers, this spacious home provides a level house site, a two car attached garage with potential expansion above, and lots of outdoor space including a front porch, rear deck, and a private back patio with a built-in fire pit off the great room.","79714 sqft",499900,"SingleFamily"
1668,3,2,1930,"Warm and inviting 3 bedroom 2 bath classic two story home. Large bright and sunny great room with gas stove. Dining room with hdwd fl open to the living room and French Doors leading to the great room. Back door enters into the perfectly placed laundry/mudroom. Enclosed front porch. Master bedroom includes a dressing room, fully remodeled bathroom and and access to it's own private enclosed porch. Hardwood, carpet and tile floors. New gas furnace. For all you car enthusiasts, workshop lovers, tinkerers or those that just need the extra space you will absolutely fall in love with this 3 to 4 car detached garage with 220 amp subpanel. Two bays, one of which is a tandem and a separate workshop easily converted back to a 4th area for a vehicle. Dog pen/kennel behind garage. Above ground pool with deck and large backyard perfect for entertaining. Seller admits that he doesn't have a green thumb (spends too much time in that awesome garage) but there are beautiful flower gardens that can be restored to their original lovely state.","22651 sqft",314900,"SingleFamily"
