"AREA","BED","BATH","BUILT","DESCRIPTION","LOTSIZE","PRICE","TYPE"
3568,4,5,1998,"Set in the hills of South Glastonbury in a premier neighborhood this custom built home awaits! Step through the arched entry that leads you to the two story front foyer. Formal living room with hw floor, fireplace and built-ins. Guest bath off of front hall. Gracious dining room that opens to butlers pantry. Kitchen with granite, stainless appliances and island open in back to fireplaced family room with cherry floors, vaulted ceiling and informal dining. First floor master with gas fireplace, office, walk in closet and master bath with whirlpool. Detailed millwork enhance the features of the home. Side entry has access to 1/2 bath, laundry room and back staircase. Three bedrooms with two full baths including one en-suite. The back staircase leads to a 26x33 bonus rm currently used as bedroom. The bonus/bedroom access the second floor portion through an extended work space/ closet. Hall off of living room leads to French doors that open to covered porch then to patio. 1.7 acres of landscaped grounds with private backyard ideal for gatherings in the spring/summer months. Pick your own apples, enjoy blueberry pancakes at Rose's, check out the the winery with a view, the brewery or head down to the village of South Glastonbury to sample the Restaurant fare, walk along the hiking trails at the Matson Hill open space. Head to the CT River for a ferry ride. Discover why South Glastonbury is a very special place and Chatham Hill is the perfect place to be!","74052 sqft",799890,"SingleFamily"
2950,4,3,1980,"So many possibilties in this brick 4 Bedroom, 3 Bath, 5 car garage raised ranch on almost an acre! Garage is perfect for the enthusiast with a lift that will convey! Lower level has a remodeled full kitchen and can easily be an in-law! Large, level yard with a great garden area! Full bath in upper level features an American-Standard, Walk-in bathtub and handicap height toilets! Lower level has propane heater to keep heating costs down!","43124 sqft",389900,"SingleFamily"
1160,3,1,1951,"**HIGHEST AND BEST OFFERS DUE WEDNESDAY 4/21/21 @ 5PM ** Cape style home in a great neighborhood with great bones located in convenient Kensington. This beauty offers tons of potential with a little TLC. 3 Bed, 1 Bath with room for additional bath upstairs. Newer roof.  Central air.  Sun porch. breezeway. 1 car attached garage.  Property being SOLD AS IS. Easy to show log and go! Showings to begin 4/19/21","10454 sqft",194500,"SingleFamily"
1632,3,2,1951,"Central Casting could not serve up a better candidate for the role of Picture Perfect Home. From its white clapboard to its blue shutters; from its brand new roof to its flower box....23 Longview Ave exudes charm and character.  And that's not all-Not by a long shot!  This home is also Perfectly Located. Equidistant from the Merritt and I95, in the sought-after Mid Ridges neighborhood. Mere minutes to the North, find Trader Joe's, pharmacy, restaurants and library. Mere minutes to the South, find lively Stamford Downtown, with its theaters, shops, train and UCONN campus. This is the kind of street/neighborhood where residents stroll and birds sing.  New oil tank in March. Interior completely repainted in April. This sweet Cape also boasts newer Family Room, opening from  the Kitchen; a newer Full Bath, and newer appliances. The Eat-In Kitchen has original, built on site, custom cabinets, which only add to the home's charm and personality. Finally, to complete this idyllic picture: the Lot is perfectly flat and perfectly proportioned. Set back nicely from the road, with plenty of space and privacy for Backyard entertaining. Welcome Home!!","8276 sqft",485000,"SingleFamily"
2446,4,3,1971,"Welcome to this tastefully updated home that has been recently renovated throughout and ready to move in.  Wonderful open floor plan creates great flow for living and entertaining.  A new and on-trend kitchen features stainless steel appliances, granite countertops, and open flow into the dining area with sliders to the deck. A bright and airy family room lies just off the kitchen and features high vaulted ceilings and a wall of windows with views of private wooded yard that abuts preserved conservation land.  Continue through the first floor to enter a den with fireplace, great for an additional sitting area or home office.  Upstairs find a master suite with WIC and full bath, 3 more good-sized bedrooms, and another renovated full bath. Homeowners have added over $150K in improvements including, new roof, new siding, new windows, new laundry room, and new mudroom.  Beautiful hardwood floors throughout have just been refinished, and interiors freshly painted. So many updates, and all in a fun and friendly neighborhood.  Walk to Woodcock Nature Center for year-round activities and Gilly Rd for winter sledding and exploring. Excellent value for a turn-key home!","87120 sqft",689000,"SingleFamily"
1196,3,1,1954,"One Level 3 Bedroom 1 Bath Sun Drenched Ranch In Stratford. Property is Located on a Large Corner Lot and Close to Everything. Has Custom Kitchen, Open Layout, French Doors Lead to a Beautiful Outdoor Deck, Patio and Pool with A Lot of Outdoor Seating. Fenced in Yard to Keep Your Pets Safe. Central Air, Beautiful Hardwood Floors, Fireplace, Oversize Garage. This Property Will Go Fast in This Market.","9583 sqft",279000,"SingleFamily"
2012,2,2,1949,"GET READY TO BE WOW'D WITH THIS SPECTACULAR BRIGHT & SUNNY 2 BEDROOM RANCH WITH 2 FULL BATHS. IT IS DECEIVING FROM THE FRONT ON HOW SPACIOUS IT IS INSIDE, LARGE LIVING ROOM WITH A BEAUTIFUL BAY WINDOW, FILLED WITH LOTS OF CHARM INCLUDING BUILT-IN BOOKSHELVES THE  FIREPLACE WHICH YOU WILL ENJOY COZYING UP TO ON THOSE COLD WINTER NIGHTS, GLEAMING HARDWOOD FLOORS, 6 PANEL WOOD DOORS. CENTRAL AIR, NEWER ENERGY EFFICIENT WINDOWS, NEW FURNACE & HOT WATER HEATER, SPACIOUS EAT-IN KITCHEN WITH WHITE CABINETS OVERLOOKING YOUR SERENE BACKYARD, DINING ROOM LEADING TO 3 SEASON ENCLOSED PORCH, FINISHED BASEMENT W/FAMILY ROOM W/2nd FIREPLACE, PLUS WHAT COULD BE A POTENTIAL IN-LAW W/3rd BEDROOM OPTION OR OFFICE, CEDAR CLOSET, WASHER/DRYER HOOK-UPS. FABULOUS BONUS OFFICE/STUDIO SEPARATE FROM THE HOUSE W/ELECTRICITY PLUS AN ADDITIONAL TOOL SHED ON THE BACKSIDE, ENJOY ENTERTAINING YOUR FRIENDS AND FAMILY IN THE SPRAWLING FENCED IN BACKYARD W/ A GAZEBO, GARDEN AREAS JUST WAITING FOR YOUR PERSONAL TOUCH! ONE CAR ATTACHED GARAGE. LOCATION, LOCATION, LOCATION! NEAR SHOPPING, RESTAURANTS, PARKS, GOLF, CT RIVER, HISTORICAL OLD WETHERSFIELD SHOPS & THE SEASONAL FARMERS MARKET AS WELL AS RELAXING BY THE COVE, PUBLIC TRANSPORTATION CLOSE TO HARTFORD, NEW HAVEN & THE CT SHORELINE, EASY ACCESS TO HIGHWAYS RTE 91, RTE 84, RTE 9, RTE 15 & RTE 2. 20 MILES TO BRADLEY INT'L AIRPORT, 2 HOURS TO BOSTON OR NYC! THIS IS A GEM AND WILL GO QUICKLY! YOU WILL BE PROUD TO CALL THIS YOUR HOME, SO CALL NOW FOR A SHOWING!","17424 sqft",279000,"SingleFamily"
2296,4,3,1930,"The story book curb appeal of this brick and Tudor colonial is only the beginning of its charm!  The arched front doorway opens to gleaming hardwood floors that flow throughout the house.  The formal living room features recessed lighting and a wood burning fireplace.  The updated kitchen is an entertainer's dream with black and white cabinetry, Dacor gas stove, Subzero refrigerator, honed granite counters, copper sink, copper backsplash, soft close drawers and glass fronted backlit display cabinets.  The kitchen opens to the formal dining area and also includes room for casual eating space.   A mudroom and powder room area lead to the back entrance and access to the large deck overlooking the sunny fenced back yard.  A first floor office provides the private work space you need and adjoins a sweet screen porch.  The large renovated master suite includes a full bathroom with glassed-in tub/shower, comfort height granite vanity and plenty of storage.  Two additional bedrooms share the hallway bath with classic black and white basket weave tile.  The 4th bedroom is on the 3rd floor and has wall-to-wall carpet and a cool alcove area for storage or play space.  The additional unfinished attic space of 350 square feet is just waiting to be turned into your art or yoga studio, playroom or 2nd master suite.  You'll love having economical gas heat, a 2-year old hot water heater, 9 year old roof and central air conditioning.  Walk to elementary, middle school and WH Center!","10454 sqft",585000,"SingleFamily"
6144,5,6,2008,"Gorgeous Custom Nantucket Style Colonial built in 2008...this home has everything you need for today's lifestyle. Open and bright floorplan with oak and bamboo floors, 9ft ceilings, and loads of custom trim and details throughout. As you enter, you are greeted by the grand foyer that flows to the formal living room with custom paneling and gas fireplace and to the spacious dining room which flows through to the butler's pantry with wine cooler and walk-in pantry. The open floor-plan continues to the gorgeous custom kitchen featuring an oversized granite island with seating and high-end appliances and to the expansive family room with fireplace & French sliders to the stone patio. Upstairs is the open computer lounge/sitting area with Cupola, the Master Suite with his/hers walk in closets, sliders to a private balcony and a full luxurious bath with air tub and shower. Four other spacious bedrooms -2 ensuite and 2 with jack-and-jill bath and laundry room complete the second floor. The lower level features 9 ft ceilings, the media room, home office, gym/playrm, full bath & wine cellar with temperature and humidity control. The grounds are meticulously maintained and recently professionally landscaped with plenty of room for a pool. Recent updates include a new driveway, exterior lighting, 2 new water heaters, new sprinklers and drip irrigation-extensive list of upgrades will be available. Close to town, train & shopping. This custom home has it all -you will not be disappointed!","22215 sqft",1249000,"SingleFamily"
2692,3,2,1986,"Beautiful Cape Cod Style home sits on a private  1.9 acre lot.  Property boasts a large living room, formal dining room, fireplaced family room with built ins  and eat in  kitchen with Island and tons of storage.  A wonderful screen in porch and full bath finishes the first floor.   The upstairs has three large bedrooms and a full bath.  There is a finished den in the lower level with an additional  storage/utility room gives you plenty of storage space.  A new oil tank was just added.  Enjoy the built in pool, screened in large porch, and private backyard for outside entertainment.  A must see.  Current owners had plans done to put in a master bathroom.  Plans are available.         New windows throughout.","82764 sqft",369900,"SingleFamily"
820,2,1,1950,"FANTASTIC View Of Stafford Lake One Of, If Not The Only Remaining Staffordville Lake 1950s Seasonal Cottages. Needs Work But There So Much To Work With.... Stone Stairways, Flagstone Patio, Stone Fireplace, AMAZING Lake Views, As Well As A Great Waters Edge Concrete Retaining Wall! Needs Complete Remodel. Only AS-IS CASH Offers Considered.   ***   12:00PM Monday 04/19/21 Deadline For Highest And Best Offers   ***   Please Submit Offers On GHAR Contract.   Please Submit All Offers As One (1) Single pdf File.","5227 sqft",125000,"SingleFamily"
834,3,1,1940,"PACKAGE DEAL TO BE SOLD WITH 2 FAMILY, MLS# 170388184 for $199,900!  Adjacent property is a legal 2 family being used as a 1 family. Total of 1.39 acres of land combined. Separate deeds for each. Both are in IL zone (commercial / Limited Industrial District). This home offers 3 bedrooms, 1 bath, full basement, garage, deck overlooking private back yard. Property to be sold with tenants in place. Current rent is $1,100 per month. Very private setting located at end of dirt road surrounded by commercial businesses. Seller will only entertain cash offers. Sold in ""As Is"" condition. Possible rent w/ option, ask agent for details.","11761 sqft",89900,"SingleFamily"
1392,3,3,1961,"Spacious split level home sitting on an over 1 acre lot with 3 bedrooms, 2.1 bathrooms and 1,392 square feet of living space. 1 car detached garage. Deck overlooking the rear level yard.  Endless possibilities to turn this into your dream home!","46173 sqft",279000,"SingleFamily"
1641,3,2,1968,"1641 square foot ranch nestled on a private 21 acre lot that has 700 feet of frontage on Fenton River. What more do you need to say......3 bedrooms  1 and half bath in good condition Has a inground swimming pool and stone walls","927828 sqft",280000,"SingleFamily"
1394,3,3,1968,"Beautiful home in great subdivision.  Home offers updated kitchen with granite countertops, new flooring, updated bathrooms, central air, new hot water tank, LED lighting, enclosed porch, finished lower level with bathroom, newer larger septic and roof.","20473 sqft",375000,"SingleFamily"
1970,3,3,1924,"Pristine beautifully updated colonial style home in the sought out heart of Springdale with private master suite with oversized bedroom including walk-in closet and large cathedral ceiling, private bath with sitting room or nursery or office.  There are skylights throughout for that natural lighting reflecting off the freshly painted home.  This home features three bedrooms with a possible fourth bedroom on the lower level with private entrance and private full bath. Gorgeous newer hardwood flooring throughout the generous floor plan on main living area with open living room and dining area. Newer gas furnace and 40 gallon hot water tank, newer roof and maintenance free vinyl siding.  This property offers much privacy as well a commuters delight, a quick walk takes you right to the Springdale train station! Centrally located to shopping and restaurants.  Nothing to do to this turn key move in just before an amazing 2021 summer.","7405 sqft",569900,"SingleFamily"
2364,3,3,2005,"Pride of ownership in this stunning three to four Bedroom Colonial situated on 1.37 professionally landscaped acres.  This thoughtfully laid out home is graced with distinct wide plank hardwood floors, an open design, central vacuum, central air conditioning and freshly painted walls, perfect for entertaining guests. Spacious eat-in Kitchen includes a breakfast bar, cherry cabinetry, granite counters, tile backsplash, stainless steel appliances, recessed lights, ceiling fan and pantry. The Kitchen opens right up to the Living Room which warms you with a beautiful gas fireplace and recessed lights. The sun filled 14x18 sitting room offers a retreat with vaulted ceilings, ceiling fan, laminate wood flooring and access to the patio and rear yard. Formal Dining Room provides an intimate space for entertaining. Generous Master Bedroom suite features a walk-in closet and full Bathroom with corian counters, large double vanity sink, shower and tons of storage. Two more Bedrooms, full Bathroom, 2nd floor laundry, and 24x25 bonus room complete the upstairs. The unfinished lower level provides great storage and a many possibilities for future expansion. Outdoor Living at its finest with a private stone patio, fire pit and lush greens, perfect for summer nights. This home is where dream meets reality and is conveniently located to nearby shops, restaurants, and highway access!","59677 sqft",359900,"SingleFamily"
2590,4,2,1969,"This embankment style ranch capitalizes on gentle topography offering two living levels with walls of glass that immerse you in the surrounding woodlands.  One of the later-built Acorn Deck Homes, find true open concept with kitchen, dining and great rooms anchored by a floor to ceiling fireplace and cypress beamed ceilings. The kitchen is well renovated with granite and stainless. The well maintained deck extends the living space. Two bedrooms are found on the main level and one shared bath and two additional bedrooms on the lower level with second full bath.  The spacious lower level offers a grand family room with second fireplace and wood burning stove and large mudroom/laundroom entry from the garage. Climate is controlled by split unit heat and AC. This fun, architectural space offers a flexible plan and a terrific, private feel, yet close to town and schools, Old Lyme Conservation Trust hiking trails and Old Lyme beaches. Two open houses Friday, April 16 from 4:00-5:30 pm and Sunday, April 18 from 1:00-3:00.","80150 sqft",485000,"SingleFamily"
3881,4,3,1850,"Nestled in the Merryall hills tucked between New Preston and South Kent stands this 1850 Colonial with modern amenities.   The 4bed 3bath house has been carefully renovated to preserve the details of the original house while adding main living spaces that emphasize modern living and convenience.   A massive Kitchen wing and Master suite addition take advantage of Western views to distant unspoiled hills.  A gorgeous post and beam barn was rebuilt on the site on the existing stone foundation of a previous structure.  Make it into additional living space or just convert it to a pool house as a pool could be put right next to it.  Two car garage can also hold potting area for the extensive perennial gardens and specimen plantings around the house and grounds.  Amazing retreat or full time home.","229125 sqft",1300000,"SingleFamily"
2000,3,3,2021,"TO BE BUILT! 3 bedroom Colonial with covered entryway porch has 2 full and 1 half baths with 2,000 sf on secluded 1.37 acres. Open floor plan on main level offers an eat-in kitchen with center island, formal dining room, family room, living room with fireplace and central air and Thermopane windows throughout. Upper floor bedrooms with convenient laundry area include a Master bedroom suite with walk-in closet, full bath and an additional walk-in closet in second bedroom. Full basement and spacious attached 2 car garage with opener complete this home.","59677 sqft",439000,"SingleFamily"
2330,4,3,1974,"Peaceful location on a cul-de-sac and move-in perfection. Updated and remodeled kitchen, 3 season room and a hardwood floors through out. Newer Gas on demand heating system and newer siding, windows, 2 fireplaces, French drains,  A Large detached garage and work shop with so many possibilities with an entire open floor plan. All on almost 3 acres of land. Come home to Pin Oak Terrace.","120661 sqft",279900,"SingleFamily"
4982,5,5,2007,"This luxurious home is nestled in a beautiful country setting; stone pillars, a cherry tree lined drive, perennial gardens and stone walls surround the home.  This magnificent colonial farmhouse is custom built with only quality in mind. The home features 11 rooms, 5 bedrooms , about 3,432 square feet of living  area with an additional 1,529 sf finished in the lower level. Wide-width hardwood floors throughout, the interior design lends itself to easy entertaining marrying formal and informal living area. More than a chef's professional kitchen with two dishwashers, 6-burner stove with grill, two ovens one gas and  one electric, miles of custom cabinets and granite counters.  A breathtaking floor to ceiling stone fireplace takes center stage in the family room. A master suite on the main level as well as another on the upper level  with exercise room . A finished lower level offers an open floor plan and 5 rooms with outside access.  Garaging for 3 cars has space above ready to be finished for a studio/office. Builders own home , this is a very special offering.  Home is 5 minutes from center of New Preston  5 minutes from Lake Waramaug State Park, for swimming and Hiking","60112 sqft",649000,"SingleFamily"
886,2,1,1921,"Why rent or pay condo fees when you can own this lovely house !!? Here lays an Amazing opportunity to own a well maintained 2 bedroom ranch! Large eat in kitchen, spacious dining room, living room and bed rooms all on the main level. Walk up attic with an abundance of storage space, Central air for those hot summer days, Enclosed porch bringing in sunlight, Basement can be used as a workshop or additional storage space. Investors....This one is for you as well! Come add this one to your portfolio. Schedule your private showing today !!!","6098 sqft",120000,"SingleFamily"
1.5,3,NA,1900,"Wood Flooring, Eat-in Kitchen, Separate Dining Room, Walkup Attic & Welcoming Front Porch highlight this Adorable Home. Updated Mechanicals include Furnace, Hot Water Heater, Roof & Central A/C. Private Backyard with Patio Area, Gardens & Storage Shed.","0.36 Acres",NA,"SingleFamily"
2300,4,3,1968,"You will love this completely remodeled, immaculate & lovingly maintained 4 BR 2.5 bath Garrison Colonial nestled on a large 1.14 acre lot. Steps away from Blackledge Falls hiking trails & Deercrest Farm, short dive to Case Mountain or Gay City park, town preserved land directly across the street & beyond the back property line giving this home that countryside feel w/ no chance of addtnl development. The home sits approximately 200 feet from the road giving peace of mind for families w/ young children. The backyard is completely fenced-in w/ a built to last Klotter Farms playscape that can be enjoyed for years to come. Partially finished sun-filled walk out basement w/ hardwoods; perfect for a den, playroom, game, workout or guest room or office. Hardwood & tile throughout as well as crown molding provide an elegant & upscale look. Freshly painted & is in move-in, pristine condition. Updates include: Central AC, newer roof, siding, windows, sliders.. workshop wired w/ 220 volt outlets, newer kitchen w/ spacious storage & counters w/ new appliances, custom bathroom w/ wrap around Italian tile & deep soaking tub, spacious bright living room w/ large windows, beautiful solid mahogany front doors w/ double pane glass, spray foam insulation in attic, indirect hot water so you never run out, newer constant pressure water well pump and treatment system, new front walkway with bluestone and pavers, newer retaining wall in backyard and newer fireplace insert decreasing fuel costs.","49658 sqft",489000,"SingleFamily"
9380,6,8,2006,"This magnificent, extensively customized home is set near the end of one of the scenic Hunt Club area's premier streets. The meticulous attention to detail & careful maintenance is readily apparent. Lush landscaping perfectly frames this spectacular home, which is complete with every amenity for year-round enjoyment. With summer fast approaching, the resort-style property is ready to delight you: a gorgeous gunite pool with auto cover & spa is surrounded by extensive stone work for relaxation & entertaining, and the adjacent pool house with covered lounge area and fully-equipped Viking outdoor kitchen has heaters to extend the season into the autumn. Step inside the two story foyer, where the gorgeous millwork and generous room proportions that characterize the home begin to unfold. Meant to be a home that is fully enjoyed and where lasting memories are created, the main level has an incredible ""Pub"" ready for fun. The library is a tranquil work-from-home space. An incredible gourmet kitchen with Sub Zero and Wolf appliances has a large center island, breakfast room with French doors and a butler's pantry. Great family room with built-ins and fireplace. The bedrooms all have unique features incl. built-ins, luxurious bathrooms. Master suite w/spa-like bath. Finished 3rd floor & walk-out Lower Level with game room, play room & gym.","43560 sqft",3675000,"SingleFamily"
1952,3,3,2021,"TO BE BUILT! Stylish Colonial with covered porch entryway, 3 bedrooms, 2 full and 1 half baths, and 1,952 sf on 1.43 acres. First floor open layout has kitchen with pantry and center island, a dining room area, and living room with central air and Thermopane windows throughout the home. Full bath with walk-in closet in upper level Master with 2 additional bedrooms. Enjoy the full basement and attached 2 car garage with opener.","62290 sqft",419000,"SingleFamily"
2200,3,4,2021,"New construction 1/2 duplex with views of LI sound and marsh situated 1/2 block to sandy beach and a stroll away from Silver Sands State park and restaurants. Come live the life in this quality built home featuring 2 master baths, 3 1/2 baths, and decks to have morning coffee and watch the wild life and listen to the sound of the waves. This unit boasts 9' ceilings, hard wood floors throughout, open floor plan, gourmet kitchen with waterfall breakfast bar island, high end appliances, farm sink and quarts counter tops.  Bring your beach chairs and kayaks and live the lifestyle you've always dreamed of.","2178 sqft",649900,"SingleFamily"
1965,3,1,1951,"Home to be sold to settle and estate. Large living room with bookshelves, (TV included) gas fireplace and hardwood floors, formal dining room (mirror included), private porch great place for a cool drink, eat in kitchen with granite counters, quality wood cabinets. Main bedroom on first floor with 2 closets and hardwood floors, second first floor bedroom with large walk in closet, large full bath with walk in shower and jacuzzi tub,2 rooms up. 3rd bedroom with hardwood floors,(couch included)  storage attic and office with hardwood floors. Large unfinished basement. Thermopane windows, 200 amp electric, gas furnace, gas hot water heater, washer and dryer. large 2 car garage attached. Private Corner lot. Located on quiet side street close to everything. Property sold as is.","9147 sqft",329900,"SingleFamily"
