"AREA","BED","BATH","BUILT","DESCRIPTION","LOTSIZE","PRICE","TYPE"
1704,4,2,1977,"Pristine! Welcome to 180 Regency Terrace. With almost 1700 sq ft ,this 4 bedroom,2 bathroom home offers an open floor plan with gleaming hardwood floors throughout . It has room for anyone and everyone. Living room with tons of natural light leading to a spacious renovated eat-in kitchen with newer cabinets, granite counter tops and stainless steel appliances. Updated bathroom with 3 ample sized bedrooms complete the main floor. Lower level includes huge family room and an additional 4th bedroom and an updated full bathroom with a walk out basement offering a  possible in-law set-up. Perfect for the large and growing family as well as In-Law possibilities , this completely remodeled and updated Ranch on private  level lot offers all the amenities that the buyers are looking for. The total sq. ft includes approximately 600 sq. ft.in the finished basement. There is also an additional unfinished room in the basement with access to the rear fenced in yard. Gas heat, tons of storage and close to all highways and shopping. Your search ends here! Bring your furniture and call it home today.","6534 sqft",299000,"SingleFamily"
1890,2,2,1986,"Spacious 2 bedroom Ranch located on cul-de-sac in desirable neighborhood. Large foyer. Master bedroom with full bath. Kitchen with double sink and granite counter tops. 8X16 trex deck.","20037 sqft",349900,"SingleFamily"
1268,4,2,1960,"East-side split level home in a desirable Wallingford neighborhood.  1,452 square feet, 3 bedrooms, 2 full bathrooms, main level includes living room with hardwood floors and wood burning fireplace,  large eat in updated kitchen.  Upstairs has 3 bedrooms with hardwood floors under the carpet and a full bathroom. The finished lower level has family room and additional space for office or bedroom, laundry room and the second full bathroom.  French doors from the kitchen lead to large deck and  fully fenced in yard with firepit shed and nice level lawn- perfect outdoor living space  for entertaining or tossing the ball. Carport is also fenced in with concrete pad which was used as a patio. Great for entertaining! Corner lot, City water, sewer and natural gas heat. Probate approval required for sale.","18295 sqft",259900,"SingleFamily"
1296,4,1,1964,"This is such a fantastic place to call home! Grab your bags and you can move right in to this wonderful 3/4 Bedroom home. There's a good sized, eat in kitchen and hardwoods on the main level. There are three bedrooms upstairs with one bathroom that has been nicely updated. The lower level has a large family room--get ready for game night! There's also another room that could be used as a guest bedroom, office, home schooling area or craft room. The house is plumbed for an additional half bath. The roof is only a few years old and this raised ranch is heated by a Buderus Boiler. Let's not forget the wonderful, screened in sun porch! The backyard is fenced in. The town owns the space/lot next door, but you get the benefit of it!  Home borders 11 acres of Town woods behind it.","14374 sqft",234900,"SingleFamily"
1612,3,3,2005,"Beautiful 3 bedroom home at the end of a Cul-de-sac, offering an amazing amount of privacy on just over an acre and a half. As you enter the home you will first notice the amazing open feeling with a cathedral ceiling  and  the custom built fireplace and mantel. Wood floors through out  the living rooms and bedrooms.  All the bathrooms have been updated with gorgeous tile work. The master bedroom is spacious and has a custom walk-in closet with built in shelves and a sliding  door.   More beautiful tile work in the Master bathroom with a walk in tiled shower. The two other  bedrooms each have custom closets, ceiling fans.. The lower level is where you will find the laundry room and half bathroom, den area with slider .  With two screened in Patios and a fenced in back yard this home is ready  for summer and  whatever your plans are!  Just 12 Mins to the UCONN Storrs campus! Solar panels on the home are leased and the total cost for them and electric bill is roughly 110 a month.","67953 sqft",270000,"SingleFamily"
2168,3,3,1983,"Complementary spaces of beauty, inside and outside of this elevated Colonial farmhouse, make it unique and wonderful. Enjoy morning coffee or an  afternoon beverage on the expansive covered front porch, dine alfresco in the airy 3 season sunroom, grill on the adjoining deck, all while taking in the picturesque and peaceful landscape. Bright, cheerful and updated, this home is enriched by delightful upgrades and meticulous care and attention to detail.  The distinctive kitchen features custom Cherry Shaker cabinets, center island, granite & newer appliances. Open to the dinette and FR, with sliders accessing the sunroom, there’s a natural extension of living/entertaining space from the kitchen. The sweet & airy FR has a cathedral ceiling & brick FPL w/gas log insert. The versatile main level includes a spacious LR open to a lovely formal DR; a highly practical full bath & laundry. Your flow-through access between rooms is enriched by elegant French doors. There's 3 roomy UL BRs, including a MBR suite, updated baths and extra & oversized closet space. The newly finished LL offers perfect office/craft/play space. Highly efficient new ductless mini-split provides heat & AC on the main level. Hardwood floors; newer carpets, light fixtures. Newer roof, water heater, driveway & shed. Generator hookup. Choose comfort & serenity on this small country cul de sac.  The world remains near by as it's just minutes to New Milford & Kent Villages and the NY State border(metro North train).","47916 sqft",415000,"SingleFamily"
2348,3,2,1966,"Come take a look at this cozy and spacious split level style home situated on 0.51 acres of well manicured land with 3 bedrooms, 2 full bathrooms, full finished basement, and a 2 car garage. This cozy house has been updated within the past 5 years including: flooring, kitchen, appliances, paint, roof, and 2 bathrooms.  Discover Trumbull’s endless amenities and charm; close to parks, schools, shopping, restaurants, outdoor activities, gold courses, and other numerous amenities; the possibilities of family fun are endless.       Disclosure: Listing agent is related to the owner. The rear deck needs to be partially repaired.  In the family room there is a small area of water damage to the flooring by the sliding door from the owners watering potted plants in the area.    Public record shows incorrect square footage, it lists the family room as ""Finished Raised Bsmt"" and finished basement as ""Unfinished Basement"".    04/17/2021 0906 edit: Due to multiple offers already, highest and best due by Sunday 04/18/2021 at 3pm.","22215 sqft",359000,"SingleFamily"
1872,3,3,1995,"Beautifully updated colonial style home in friendly cul-de-sac in Old Lyme! Walk inside this gorgeous home and be welcomed by an open floor plan and abundance of natural lighting. The living room is spacious and has a fireplace, perfect to cozy up to on these cool Connecticut evenings. Do you enjoy cooking? Equipped with all stainless steel appliances and a generous island, this kitchen is perfect to test your skills. Flow with the open floor plan into the dining room that is large enough to host dinner parties, but is still excellent for intimate dining. Exit through the sliding doors within the dining room onto the deck, perfect to enjoy the views with your morning cup of coffee, or grill with friends on these warm spring days! Utilize the bonus room on the main level as an at home office, play room or distant learning area. With 3 full updated bathrooms this home has it all. This home features 3 ample sized bedrooms, including a master bedroom with an ensuite. The attic space provides ample storage space. The yard is great for play and comes with a shed perfect for lawn equipment. For the nature lovers, a trail head with multiple hiking trails right inside the cul-de-sac! Privacy is no issue here! This home is conveniently located near the center of town and highway! Other improvements include a new furnace, water pump, and roof all new as of 2016. Brand new cedar decking (16x20), and a cost saving dual 275 gallon oil tank. Expanded crushed stone driveway and parking area.","85377 sqft",399900,"SingleFamily"
4008,4,4,2006,"Welcome Home.... to this beautiful spacious Colonial located a short distance from Squantz Pond State Park & Candlewood Lake Town Park!  This home features an oversized family room with gorgeous beams & windows.  Custom eat-in-kitchen with granite.  Formal dining room.  A great home for entertaining & holidays!   Master bedrooms suite with balcony and three additional bedrooms on the upper level. 3/4 finished walkout basement with full bathroom & wet bar.  Enjoy the amazing views from the expansive deck...there is plenty of space for all your out door furniture. Built-in shed below the deck to store all that furniture & lawn equipment from the elements and out of sight.  Private 2.8 acres gives has many landscaping possibilities.  Lets not forget the three bay garage with built out storage shelves.  This is definitely a must see!","122839 sqft",649000,"SingleFamily"
3739,6,2,1832,"Unique opportunity to own and care for the quintessential New England antique Greek Revival General Phelps House. Sandy Brook winds around and through the 12.53 acres. In addition to the General Phelps House, property includes a separate charming, rustic bungalow with loft bedroom and a Cape-style cottage offering 1411 square ft. of living space all overlooking Sandy Brook. Expansive pasture land features a two stall horse barn. There is also a large red barn located next to the cottage serving as use for a multitude of possible purposes.  Enjoy the country life sitting by the water of Sandy Brook.  Live in one home and rent out the other two for additional income if desired. Lots of room for those family members also. Could this be your opportunity of a lifetime?","545806 sqft",7e+05,"SingleFamily"
2623,4,2,1968,"If you need a home with a ton of great living space this house is for you* Cathedral ceiling in family room with recessed lighting, ceiling fans and gas fireplace* Access to beautiful patio with gazebo* Completely private fenced yard* Right off the kitchen is another living space* Seller used this area for a pool table, but it could be used for another living space or home office and workspace*  Five bedrooms, three upstairs and two on the main floor*  Gorgeous kitchen is completely open to the dining area with a fireplace* The kitchen has been completely remodeled with custom cabinets, granite countertops and a huge breakfast island that easily seats five but could seat more* Stainless steel appliances* Hardwood floors throughout the entire house* The upstairs is completely dormered with a front to back master bedroom and a full bathroom right off the master* Bathrooms have all been updated* Basement is beautifully finished for even more living space* Roof is only five years old* New gas hot water heater*Newer garage door openers* anderson windows* Whole house attic fan to cool house* This home is truly a show place and there is nothing left to update* Home is in the Presidential section of Enfield","20037 sqft",369900,"SingleFamily"
5599,5,5,1957,"Located at the end of a quiet mid-country cul-de-sac, in the Golden Triangle, this spacious, completely rebuilt, home is situated on 2.28 flat, park-like acres. French doors in the dining room and eat-in kitchen open to large terraces with extensive room for a large pool and tennis court. This sun-filled 5 bedroom, 5 bathroom home has a first floor office/family room/in-law suite with a full bathroom Upstairs is a master suite, with generous his/her walk-in closets, 3 additional large bedrooms with 2 full bathrooms and walk-in attic with the option for additional living space. A walk-out finished lower level gym/playroom with a full bathroom completes this exceptional property. Minutes from town, this pastoral home is perfect for a young family.","2.28 Acres",3350000,"SingleFamily"
6898,6,6,1890,"Built and cared-for to the highest standards, 130 Wallacks Drive delivers classic, waterfront magic year-round. Sitting atop a gorgeous promontory within Wallacks Point - a small, private waterfront enclave - this home provides abundant natural light and unobstructed water views from almost every window and vantage point. The master suite allows sunrise to sunset water views, and four additional sunny bedrooms plus adorable guest cottage provide room for family or guests.  A finished lower level, also with water views, has a full kitchen, providing an inviting place for entertaining, unwinding, or easy walk-out access to the in-ground pool overlooking Long Island Sound.  Architectural details grace every corner, wall and window: gorgeous paneling, transoms above windows, coffered ceilings and an artful Belgian block driveway circle.  Completing the perfection is a one-bedroom guest cottage with brick floors, wood burning fireplace and kitchen.  Perfectly thought out and professionally lit perennial gardens and mature trees envelop the property. Whether enjoying the sun gleaming off Long Island Sound or watching the drama of a passing storm, the views and setting of this home are unrivaled. Elevator from garage to 1st floor. Only three owners in 130 years have been fortunate enough to call this property home - here is your chance to be the fourth steward to fall in love with this estate.","54450 sqft",3395000,"SingleFamily"
2200,3,3,1954,"Don't miss this newly remodeled 4 bedroom ranch in a quiet and secluded neighborhood!! This home which has a total of 2200 sq ft of living space, features a recently remodeled fashionable open concept kitchen, 2.5 newly renovated bathrooms and a completely finished lower level. Master bedroom comes private en-suite bath. Other newer features include: Roof replacement, brand new heating system and water heater installed 2018. Bay window in living room, central air system, upgraded electrical and plumbing. Installed drainage system along walls in basement, Bosch dishwasher, refrigerator, new deck and fully fenced backyard. This home offers an attractive combination of living space and updated features. All this in a convenient area located close to Yale, SCSU, parks, hospitals, highways and shopping.","10018 sqft",289900,"SingleFamily"
1165,3,1,1962,"Very well maintained Cape Cod style home in the desired town of Plainville! Nestled in a quiet neighborhood this home has hardwood throughout and an open floor plan. The flow of the living room, dining room and kitchen is amazing for entertaining. With tons of natural lighting and a spacious living room there is enough space for everyone! Step into the kitchen that is equipped with all stainless steel appliances. The bonus room on the main level contains beautiful french doors to the back yard. This room can also be utilized as a dining room or an at home office. This home offers 3 substantially sized bedrooms perfect for your family. The unfinished basement provides ample storage space. Moving outside, the backyard is fully fenced and comes with a shed perfect for lawn equipment. This home is minutes away from restaurants, shopping, and parks. Other improvements on this home include a furnace from 2009, a new roof, new siding, some replaced windows, central air installed in 2010, irrigation system and a whole house generator installed in 2011, and the oil tank was replaced in 2018.","12632 sqft",225000,"SingleFamily"
3554,4,5,1928,"Enchanting masterpiece! This 1928 stone English Cotswold Cottage has been completely renovated from driveway to doorstop to exquisite standards on 6.59 private acres with a scenic aerated pond, abutting hundreds of acres of open space and access to hiking trails. The idyllic setting is tucked away at the end of a desirable, lower Redding cul-de-sac. An open floor plan with charming kitchen, spacious sunroom, fireplace, 4 bedrooms and 4.5 marble baths welcomes you. Treehouse views from all bedrooms makes this fairytale retreat the perfect getaway or country home! The cottage’s total renovation comes with state-of-the-art conveniences and is fully furnished with wonderful antique furniture, rugs and fine art. The woodland private setting is minutes to schools, train, library, shops, restaurants, and services. Redding, often selected as the #1 Small Town in CT, offers award-winning schools, wonderful parks, countless hiking trails, waterfalls, organic farmers markets, New Pond Farm, great restaurants, and the Mark Twain Library. Redding Country Club is 5 minutes away with pool, tennis, superb golf course and fine dining. Westport beaches within 15 minutes; Manhattan within 56 miles. Turnkey ready!","287060 sqft",1499000,"SingleFamily"
1596,3,1,1957,"Solid Brick home set on a sprawling private yard. This home offers 4 bdrms, 1 full bath, mudroom, c-air and 2 detached oversized garages. Large deck overlooks the back yard. Great for family gatherings and cookout.  BONUS: Detached apartment includes kitchen, full bath, laundry and combination bedroom/living room. Also, sliders to open deck. Great for in-law, cave man or teenage hideout or Extra rental income.","26571 sqft",239000,"SingleFamily"
1068,2,2,1954,"Incredible Opportunity! Beautifully maintained and updated ranch style half duplex in a quiet neighborhood. Stunning New Kitchen (2019) with white cabinets, granite and top-of-the-line stainless steel appliances. Gorgeous Hardwood flooring in dining/living room area, updated full bath, and two bedrooms complete the main floor. The partially finished lower level offers endless possibilities with an updated full bath with stall shower, large family room/office/bedrooom with built-ins, storage space and laundry. Newer Roof, furnace, hot water heater and windows. The level back yard is perfect for entertaining, fully fenced and offers a patio area and raised deck. Great condo alternative at an incredible price. Truly a move-in-ready home, schedule a showing today!","3484 sqft",134900,"SingleFamily"
1800,4,2,1930,"A home ready made for your family to enjoy.  The open floor plan allows for easy living…Front door foyer leads to living room with hardwood floors, brick fireplace (insert to for air flow).  Dining room is right off the eat-in kitchen and living room. Kitchen was remodeled 10 years ago and  offers granite counter tops and maple cabinets.  The flow is about family gatherings..  The added family room  is right off the dining room – heated, lots of windows and ceiling skylights.  Family room sliders lead to the deck, large fence yard and shed.  Main level has half bath. Upper level has 4 bedrooms with hardwood floors.  Full bath on this level.   Garage is presently a workshop…but will convert back to garage.  Home Warranty included. 4 zone furnace, on-demand water heater. You've got it all...private yard, large house for gatherings small and large.  Location is convenient to train station, restaurants, stores and I95.","8712 sqft",365000,"SingleFamily"
1728,3,3,1959,"Enjoy 4 level living in this spacious Split Level home that's perfect for entertaining with family and friends. The main level offers a large living room with a wood burning fireplace that leads to the eat in kitchen with stainless steel appliances, center island and granite countertops. Both rooms flow nicely into the oversized dining room and great room with hardwood floors, cathedral ceiling with skylights and slider that leads to the patio and private backyard. Step down into the family room that's another great space for entertaining or just relaxing. This area has a half bath and leads to the garage and also to the back yard and patio. Another few steps down and you have a great finished office space. The upper level features 3 bedrooms with hardwood floors, ceiling fans along with 2 full baths and storage area. Convenient location to I-91 and Route 15 for easy access to New Haven & Hartford. 24 hour notice required for all showings. Showings start at 11:30 on Saturday April 17, 2021.","20473 sqft",357000,"SingleFamily"
1204,2,2,1953,"Don't miss out on this fabulous ranch style home IDEAL for a starter or retirement! This 2 bedroom ranch awaits your final touches, featuring hardwood flooring, fireplaced living room, and a spacious eat-in kitchen overlooking the living room. Down the hallway you'll find a full bath and two bedrooms, one being the master suite with half bath. The lower level of the home is spacious and houses the laundry facility. This room offers plenty of room for either refinishing to add living space or an amble storage area. Located just off the kitchen is a charming enclosed 3 season porch that leads to your open back yard. Enjoy your attached one car garage and the convenient, cul de sac neighborhood location of this home, just minutes from highways, schools, shopping and more..The possibilities are endless!","13503 sqft",179900,"SingleFamily"
2004,3,1,1913,"Built in 1913 this Dutch Colonial has stood the test of time.  1,346 Sq. Ft., 3 Bedrooms & 1 Bathroom.  9 foot ceilings. Period trim & millwork   throughout.  A classic front porch, mudroom and pantry. The price includes a 50' x 100' building lot. In close proximity to parks, fields, restaurants and Housatonic River Parks and water activities. It is recognized here by the City of Shelton's Tax Assessor's map 128.B - 23 (38 Lakeview Ave ) and 128.B - 24  (Vacant Lot).","6098 sqft",349000,"SingleFamily"
2191,3,3,1941,"Terrific opportunity to live on Ridge Park in this charming 3 bedroom, 2.5 Cape Cod home on a beautiful, level property!  Living room has original pine paneling, a fireplace, hardwood floors and is open to the dining area/kitchen area. Large family room with beamed ceilings and a wet-bar, fireplace and doors to the large deck.   The second floor offers an office/library that could be used as a 4th bedroom. This beautiful, large and flat yard is ready for entertaining, gardening, playing sports, and having fun with the family. Great space but needs some updating to bring it into its lovely potential!  Enjoy this jewel on a quiet and convenient location that needs just a little polish!","13503 sqft",499000,"SingleFamily"
2742,3,3,1964,"Here is your chance to reside in a delightful neighborhood and enjoy all that Trumbull has to offer. This well- maintained, raised ranch features more than 2700 square feet of finished living space and includes 3 bedrooms, 2.5 bathrooms, eat-in kitchen, expansive living room and formal dining room. Amenities include a walk-out deck, 2 fireplaces, central A/C, 2 bay garage and updated mechanicals. Convenient to Rails to Trials, Parlor Rock Park, Indian Ledge Park and Tashua Knolls. Close proximity to schools, shopping and highways. A terrific value in a terrific town! Property being sold AS-IS.   Estate sale - PROBATE APPROVAL NOT REQUIRED.","21780 sqft",415000,"SingleFamily"
1092,3,1,1962,"Location! Location! Why rent when you can own? Pristine Ranch end of street...all new paint, Hardwood, eat in kitchen, Thermopane windows, Brand new Furnace, oil tank & refrigerator, baseboard heat, Oversized 2 car garage leads to outdoor patio* updated  electrical * Living room with Brick Fireplace . slate hearth and pellet stove to save on the heating. Large fenced in yard for the children to play or pets to run free. Basement is dry and boasts another 1092 sq ft unfinished. Subject to Probate Court. Minutes to ESPN, Lake Compounce, shopping * restaurants* and major Highways.  See it Today!!","24393 sqft",216560,"SingleFamily"
1814,3,2,1952,"FANTASTIC OPPORTUNITY to own lovely Ranch in MOST DESIRABLE west side neighborhood of Naugatuck. You will love this good sized 3 Bedroom, 2 Bath (remodeled) desirable one level home, expansive living room with beautiful custom stone wood burning fireplace, light filled dining area, adjacent remodeled kitchen, custom-like cabinets, new tile, granite counter-tops, stainless appliances, polished hardwood floors, adjacent over-sized family room. Replacement windows, recessed lighting, newly painted, newer HW heater, gutters, upgraded electric and more.  Abundance of windows allowing bright light and sun throughout. LARGE, dry basement for tons of storage, utilities, laundry, plus potential for LL FR+ whatever Client wants. Buyer will love the extra large wood deck, room for grills, firepit, multiple dining areas and steps to lower level yard which is Expansive, level, tree enclosed ensuring privacy; family can enjoy every kind of activity year-round. Quiet cul-de-sac street. CONVENIENT to shopping, banking, restaurants, medical facilities, PLUS minutes to HIGHWAYS 8 and 84. EXCELLENT commuter location.  CALL NOW FOR VIEWINGS, WILL NOT LAST!","37897 sqft",269900,"SingleFamily"
